user_input,retrieved_contexts,response,reference,faithfulness,answer_relevancy,context_precision,context_recall
¿Cuál es la finalidad de los planes de estudio según el reglamento?,"['REGLAMENTO DE RÉGIMEN DE ESTUDIO DE PREGRADO 21/ RREP TÍTULO VI: DEL IDIOMA INGLÉS COMO ACTIVIDAD CURRICULAR ARTÍCULO 27º: Los(as) estudiantes que se incorporen a una carrera que conduzca al grado de licenciado deberán aprobar el requisito de inglés institucional. a. Los(as) estudiantes de primer año deberán rendir el Diagnóstico de Inglés Institucional antes de iniciar su primer semestre y en las fechas que establece el calendario académico. El resultado obtenido ubicará al/la estudiante en uno de los niveles de inglés impartidos por la Coordinación de Idiomas, y que deberá inscribir a partir del segundo nivel de su carrera y dentro de los plazos que establece su Plan de Estudios. Los niveles de inglés y porcentajes de logro en el diagnóstico son los siguientes: Nivel a cursar Porcentaje Descripción Principiante Entre 0% y 29% de logro Corresponde a los(as) estudiantes que poseen conocimientos rudimentarios de inglés. Los sitúa bajo el nivel A1 Básico Entre 30% y 44% de logro Corresponde a los(as) estudiantes que poseen conocimientos elementales de inglés. Similar al nivel A1 Pre-Intermedio Entre 45% y 59% de logro Corresponde a los(as) estudiantes que poseen conocimientos básicos de inglés. Similar al nivel A2 inferior Intermedio Entre 60% a 69% de logro Corresponde a los(as) estudiantes que poseen un nivel pre-intermedio, equivalente al nivel A2 superior Aprueba el requisito de inglés institucional Igual o mayor a 70% de logro Corresponde a los(as) estudiantes que poseen un nivel equivalente al B1 o superior', 'REGLAMENTO DE RÉGIMEN DE ESTUDIO DE PREGRADO 17/ RREP TÍTULO V: DE LAS ASIGNATURAS Y OTRAS ACTIVIDADES CURRICULARES ARTÍCULO 20º: Los(las) estudiantes que ingresan a la carrera quedarán automáticamente inscritos en todas las asignaturas obligatorias del primer nivel de sus respectivos planes de estudios, con excepción de las asignaturas del segundo bimestre. En relación a las asignaturas de Formación General Electiva, estas deberán ser inscritas por los(las) estudiantes de acuerdo a sus preferencias y cupos disponibles. A contar del segundo semestre del primer año de ingreso a una carrera y hasta su egreso, los(las) estudiantes son responsables de inscribir sus asignaturas, revisar su ﬁcha de inscripción en Intranet y solicitar las modiﬁcaciones que requiera de acuerdo a lo establecido en el articulado del presente Reglamento y en el periodo establecido en el calendario académico respectivo. ARTÍCULO 21º: Los(las) estudiantes deberán cursar obligatoriamente, tan pronto se programen, las asignaturas del nivel más bajo de su plan de estudios. Lo anterior es, además, aplicable a las asignaturas que el(la) estudiante hubiese reprobado. a. Informe de médico especialista en la patología, tramitado por la Dirección de Desarrollo Estudiantil. b. Informe fundado de una Comisión, nombrada por el(la) decano(a) de la Facultad, integrada por el(la) médico(a) tratante del estudiante, si lo tuviese, un médico especialista en la patología distinto del anterior, el(la) director(a) de carrera y el(la) Encargado(a) del Servicio de Salud Estudiantil, quien la coordinará, que determine el estado de salud incompatible del estudiante. El(La) vicerrector(a) de Pregrado resolverá la solicitud del decano(a) disponiendo, si procede, la cancelación de la matrícula mediante resolución.', 'REGLAMENTO DE RÉGIMEN DE ESTUDIO DE PREGRADO 31/ RREP a. acumulados, debido a Retiro Temporal, Postergación de Estudios y/o Abandonos. En el caso de estudiantes de un Programa de Bachillerato esta causal administrativa de eliminación se aplicará cuando el(la) estudiante no registre caliﬁcaciones por más de dos semestres en el programa, consecutivos o acumulados, debido a Retiro Temporal, Postergación de Estudios y/o Abandono. b. Por aplicación de alguna de las medidas disciplinarias contempladas en el Reglamento respectivo de la Universidad de La Frontera. c. Esta causal no será aplicada en el caso de los y las estudiantes de la carrera de Derecho cuando estos se encuentren en condiciones de rendir el examen de grado, por lo que se les aplicará lo establecido en el propio Reglamento. ARTÍCULO 46º: El(la) estudiante eliminado(a) de conformidad a la causal establecida en el art. 45º (a) podrá presentar, con un informe favorable del decano(a), por una única vez una solicitud de continuidad de estudios al Vicerrector(a) de Pregrado, quien resolverá sin ulterior recurso. El(la) estudiante al que se le concede esta continuidad de estudios no podrá presentar nuevas solicitudes de continuidad de ningún tipo. TÍTULO XI: DE LA ASISTENCIA A ACTIVIDADES CURRICULARES ARTÍCULO 47º: La asistencia a las actividades curriculares será regulada de la siguiente forma: a. Asignaturas de Carácter Práctico: Asistencia obligatoria en un 100% a todas las actividades curriculares deﬁnidas como de carácter práctico según el Plan de Estudios de la carrera y actividades de evaluación. b. Asignaturas de Carácter Teórico: En las actividades curriculares deﬁnidas como de carácter teórico, se podrá establecer en el Programa de Asignatura un porcentaje mínimo de asistencia, no mayor al 70%, lo que deberá ser informado a los(as) estudiantes. La asistencia deberá ser evidenciada con un registro formal de cada una de las clases. c. Asignaturas de Carácter Teórico-Práctico: Asistencia obligatoria de', '50/ RREP TÍTULO FINAL ARTÍCULO 93º: El(La) decano(a) con la aprobación de su Consejo de Facultad, mediante Resolución Interna, podrá establecer normas complementarias de iniciativas académicas que permitan mejorar los niveles de rendimiento, retención y avance curricular de los(as) estudiantes de sus respectivas carreras, que no contravengan al presente Reglamento. ARTÍCULO 94º: Las situaciones no contempladas en este Reglamento y que no importen una contravención expresa a lo establecido en el presente Reglamento, serán resueltas por el(la) vicerrector(a) de Pregrado, previo informe del decano(a) de la Facultad correspondiente y del Comité Académico de Pregrado de la Universidad.']","El contexto proporcionado no incluye información específica sobre la finalidad de los planes de estudio según el reglamento. Por lo tanto, no puedo responder la pregunta.",La finalidad es formar profesionales,1.0,,0.0,0.0
¿Qué debe hacer un estudiante si necesita anular su matrícula durante el primer semestre de su carrera?,"['38/ RREP a. curricular que tenía el(la) estudiante al momento de interrumpir sus estudios. b. Las asignaturas que el(la) estudiante deberá inscribir previo informe del director(a) de carrera respectivo. Una vez aceptada la solicitud de reincorporación, el(la) estudiante deberá formalizar su matrícula e inscribir asignaturas dentro del plazo que la resolución señale. De otro modo la reincorporación quedará sin efecto. c.d. TÍTULO XIV: DE LA TRANSFERENCIA DE CARRERA ARTÍCULO 60º: Se considera que un(a) estudiante solicita transferencia de carrera, cuando desea matricularse en una carrera diferente a la que estudia actualmente en la Universidad de La Frontera. La solicitud de transferencia se deberá presentar en el periodo establecido en el calendario académico. “Según establece el artículo 55º del Reglamento de Admisión, un(a) estudiante que fue eliminado académicamente, no podrá solicitar transferencia a la carrera de la cual fue eliminado”. ARTÍCULO 61º: Los(as) estudiantes recién ingresados a la Universidad podrán solicitar transferencia de carrera durante el primer mes de iniciado el periodo académico mediante una solicitud a la Dirección de Pregrado de la Facultad o autoridad equivalente, anexando documentación emitida por el Registro Académico Estudiantil, que veriﬁque el cumplimiento de los siguientes requisitos: a. Haber ingresado por admisión regular a la carrera de origen en el semestre que solicita la transferencia. b. Haber rendido las pruebas de selección universitaria requeridas por la carrera de destino. c. Haber obtenido puntaje ponderado mayor o igual al último matriculado en la admisión regular en la carrera de destino. d. Que exista cupo en la carrera de destino luego de cerrado el proceso de admisión regular.', '30/ RREP c. Continuidad de Estudios de Alta Excepción: Podrá presentar esta solicitud el(la) estudiante que haya agotado las solicitudes de continuidad de la letra b) y que haya o esté cursando una o más actividades curriculares de los últimos dos niveles de su Plan de estudios y tenga aprobado el examen de suﬁciencia de inglés institucional y que cuente con un informe favorable del decano(a) de su Facultad, previa consulta al Consejo de Carrera. Esta solicitud de continuidad de estudios de alta excepción deberá ser enviada por el decano de la Facultad respectiva, por única vez, al vicerrector(a) de Pregrado, quien resolverá en acuerdo con el(la) director(a) de Pregrado de la respectiva Facultad o autoridad equivalente y el(la) director(a) de la Dirección de Desarrollo Estudiantil, sin ulterior recurso. En el acto de autorización de esta continuidad de estudios, mediante Resolución Interna de la Vicerrectoría de Pregrado, se deberán ﬁjar condiciones especiales a cumplir por parte del o la estudiante, de tal manera de apoyar su adecuado avance curricular. El (la) estudiante a la que se le conceda la continuidad de estudios de alta excepción, no podrá presentar nuevas solicitudes de continuidad de estudios, por causal académica. Se excluye de las solicitudes del segundo Ciclo Formativo y solicitud de alta excepción a estudiantes que cursen el Plan Común de Ingeniería Civil o Programa de Bachillerato. Si el(la) estudiante no presenta solicitud de continuidad o se le deniega, se le anularán las inscripciones de todas las asignaturas inscritas, quedando eliminado académicamente. ARTÍCULO 45º: Serán causales administrativas de eliminación: a. Cuando el o la estudiante no registre caliﬁcaciones ﬁnales por más de seis semestres en la Universidad, ya sea en una misma carrera o cuando haya recurrido a la transferencia interna, consecutivos o', '32/ RREP a. un 100% en el aspecto práctico. En el aspecto teórico se podrá establecer un mínimo de asistencia, no mayor al 70%, lo que deberá ser informado a los(as) estudiantes. En este tipo de asignaturas se deberá explicitar en el programa de la asignatura cuales son las actividades de carácter práctico que deberán contar con asistencia del 100%. La asistencia deberá ser evidenciada con un registro formal de cada una de las clases. El(la) estudiante, en caso de fuerza mayor, podrá asistir a la sala de clases (a excepción de laboratorios, salidas a terreno y prácticas profesionales e internados) con su hija(o). El(la) estudiante será responsable del cuidado y comportamiento del menor. Las facultades podrán estipular, mediante Resolución Interna, un porcentaje de asistencia mínimo para todas o algunas de las actividades curriculares impartidas por su Facultad, el que no podrá contravenir lo señalado precedentemente. ARTÍCULO 48º: El(la) estudiante podrá ausentarse, justiﬁcadamente, de las evaluaciones y actividades curriculares siguientes: a. Actividad de evaluación: En una asignatura o Actividad Curricular, el/la estudiante podrá justiﬁcar todas aquellas inasistencias a evaluaciones parciales. b. Actividades prácticas de una asignatura: El(la) estudiante podrá justiﬁcar hasta en un máximo de 20% de las horas efectivamente realizadas. Sin embargo, estas deberán ser recuperadas por los(as) estudiantes. Los departamentos académicos dispondrán la factibilidad y modalidad de recuperación de las actividades a las que el(la) estudiante no asistió. ARTÍCULO 49º: La justiﬁcación deberá ser hecha mediante formulario de inasistencia, en un plazo máximo de 5 días hábiles de iniciada la inasistencia, ante el(la) director(a) de Carrera a la cual pertenece el/la estudiante, quien podrá aceptarla o rechazarla, previo análisis de los motivos señalados por el(la) estudiante. Además, el(la) director(a) de Pregrado o autoridad equivalente podrá autorizar por escrito a personas o grupos para asistir a: Congresos', 'REGLAMENTO DE RÉGIMEN DE ESTUDIO DE PREGRADO 39/ RREP ARTÍCULO 62º: Podrá solicitar transferencia de carrera el(la) estudiante que haya cursado el primer nivel de su carrera a la Dirección de Pregrado o autoridad equivalente, de la Facultad a la que se encuentra adscrita la carrera de destino y siempre que cumpla los siguientes requisitos: a. Tener aprobado el 50% de las asignaturas del primer nivel semestral o anual de la carrera de origen. b. No tener deudas con la Universidad de La Frontera. c. Aquellos requisitos adicionales que agreguen las facultades por Resolución Interna que no contravengan el presente Reglamento. Los(as) estudiantes deben solicitar la transferencia de carrera en el periodo indicado en el calendario académico, adjuntando la siguiente documentación: a. Carta indicando las causales que motivan la solicitud. b. Informe de situación ﬁnanciera en la Universidad. c. Solicitud de convalidación de asignaturas, que se será analizada en una única oportunidad. d. Un(a) estudiante podrá solicitar transferencia de carrera sólo en una única oportunidad durante su permanencia en la Universidad. ARTÍCULO 63º: Para decidir la transferencia de carrera, el(la) director(a) de carrera de destino emitirá un Informe fundado al director(a) de Pregrado o autoridad equivalente que indique, si corresponde, una proposición de convalidación de asignaturas y otros antecedentes que se estime pertinente incluir. El(La) decano(a) emitirá una Resolución Interna aprobando o rechazando la transferencia. En caso de aprobación, la resolución indicará las asignaturas convalidadas, e indicará el semestre académico en que se hará efectiva. Al cambiar de carrera, a lo que el(la) estudiante tendrá derecho una única vez, las reprobaciones previas de asignatura(s) no serán consideradas en el plan de convalidación. En caso de denegación, la misma resolución expresará las razones de esta.']","La información proporcionada no incluye detalles sobre el procedimiento específico que un estudiante debe seguir para anular su matrícula durante el primer semestre de su carrera en la UFRO. Por lo tanto, no puedo responder a tu pregunta con el contexto proporcionado.",Debe presentar una solicitud a la Vicerrectoría de Pregrado. Esta anulación no se considera una renuncia a la carrera ni utiliza una de las posibilidades de anulación reglamentarias.,1.0,,0.0,0.5
¿Cuál es el requisito de Asistencia Mínima para ser evaluado en una asignatura?,"['32/ RREP a. un 100% en el aspecto práctico. En el aspecto teórico se podrá establecer un mínimo de asistencia, no mayor al 70%, lo que deberá ser informado a los(as) estudiantes. En este tipo de asignaturas se deberá explicitar en el programa de la asignatura cuales son las actividades de carácter práctico que deberán contar con asistencia del 100%. La asistencia deberá ser evidenciada con un registro formal de cada una de las clases. El(la) estudiante, en caso de fuerza mayor, podrá asistir a la sala de clases (a excepción de laboratorios, salidas a terreno y prácticas profesionales e internados) con su hija(o). El(la) estudiante será responsable del cuidado y comportamiento del menor. Las facultades podrán estipular, mediante Resolución Interna, un porcentaje de asistencia mínimo para todas o algunas de las actividades curriculares impartidas por su Facultad, el que no podrá contravenir lo señalado precedentemente. ARTÍCULO 48º: El(la) estudiante podrá ausentarse, justiﬁcadamente, de las evaluaciones y actividades curriculares siguientes: a. Actividad de evaluación: En una asignatura o Actividad Curricular, el/la estudiante podrá justiﬁcar todas aquellas inasistencias a evaluaciones parciales. b. Actividades prácticas de una asignatura: El(la) estudiante podrá justiﬁcar hasta en un máximo de 20% de las horas efectivamente realizadas. Sin embargo, estas deberán ser recuperadas por los(as) estudiantes. Los departamentos académicos dispondrán la factibilidad y modalidad de recuperación de las actividades a las que el(la) estudiante no asistió. ARTÍCULO 49º: La justiﬁcación deberá ser hecha mediante formulario de inasistencia, en un plazo máximo de 5 días hábiles de iniciada la inasistencia, ante el(la) director(a) de Carrera a la cual pertenece el/la estudiante, quien podrá aceptarla o rechazarla, previo análisis de los motivos señalados por el(la) estudiante. Además, el(la) director(a) de Pregrado o autoridad equivalente podrá autorizar por escrito a personas o grupos para asistir a: Congresos', '/gid00014/gid00049/gid00162/gid00070/gid00072/gid00077/gid00064 /gid00020/gid00019 a) Suspensión condicionada de la sanción: Consiste en la no aplicación efectiva de la sanción por el tiempo equivalente al ﬁjado para la suspensión, sujeto a la condición de no incurrir en alguna falta a sus obligaciones estudiantiles en dicho período. b) Asistencia obligatoria a los seminarios y talleres. La Universidad implementará seminarios y talleres con el ﬁn de educar y orientar a las y/o los estudiantes en los temas que sean relevantes para la formación integral de ellas y/o ellos. El alumno deberá obtener constancia de haber asistido y aprobado las mismas y deberá hacerlas llegar a la Dirección de Desarrollo Estudiantil. c) Trabajo a favor de la comunidad universitaria. Para lo anterior se destinarán horas semanales, que se determinarán en el momento que se resuelva la sanción por esta vía y por el tiempo que allí mismo se ﬁje. El/la estudiante deberá obtener constancia de haber realizado las mismas y deberá hacerlas llegar a la Dirección de Desarrollo Estudiantil. La Dirección de Desarrollo Estudiantil será la encargada de implementar el cumplimiento de la medida alternativa acordada y veriﬁcar que estas hayan sido efectivamente realizadas, para lo cual deberá emitir un informe al Tribunal de Convivencia. En caso de incumplimiento de la sanción conmutada en el plazo ﬁjado por el Tribunal o por la Junta Directiva, la Dirección de Desarrollo Estudiantil informará por escrito al Tribunal de Convivencia quien podrá dejar sin efecto el beneﬁcio otorgado, y hacer aplicable la sanción propuesta por el ﬁscal. La o el ﬁscal, en la vista de la causa dirigida a la Rectora o Rector y/o Vicerrectora o Vicerrector Académico, en la que propone aplicar una sanción a la persona denunciada, indicará la o las medidas tendientes a dar protección a la víctima. /gid00034/gid00051/gid00053/gid00144/gid00036/gid00054/gid00045/gid00048/gid00001/gid00019/gid00019/gid00027/gid00001/gid00055/gid00072/gid00082/gid00083/gid00064/gid00001/gid00039/gid00072/gid00082/gid00066/gid00064/gid00075/gid00015 /gid00051/gid00068/gid00070/gid00075/gid00064/gid00076/gid00068/gid00077/gid00083/gid00078/gid00001/gid00067/gid00068/gid00001 /gid00036/gid00078/gid00077/gid00085/gid00072/gid00085/gid00068/gid00077/gid00066/gid00072/gid00064/gid00001/gid00054/gid00077/gid00072/gid00085/gid00068/gid00081/gid00082/gid00072/gid00083/gid00064/gid00081/gid00072/gid00064', 'REGLAMENTO DE RÉGIMEN DE ESTUDIO DE PREGRADO 17/ RREP TÍTULO V: DE LAS ASIGNATURAS Y OTRAS ACTIVIDADES CURRICULARES ARTÍCULO 20º: Los(las) estudiantes que ingresan a la carrera quedarán automáticamente inscritos en todas las asignaturas obligatorias del primer nivel de sus respectivos planes de estudios, con excepción de las asignaturas del segundo bimestre. En relación a las asignaturas de Formación General Electiva, estas deberán ser inscritas por los(las) estudiantes de acuerdo a sus preferencias y cupos disponibles. A contar del segundo semestre del primer año de ingreso a una carrera y hasta su egreso, los(las) estudiantes son responsables de inscribir sus asignaturas, revisar su ﬁcha de inscripción en Intranet y solicitar las modiﬁcaciones que requiera de acuerdo a lo establecido en el articulado del presente Reglamento y en el periodo establecido en el calendario académico respectivo. ARTÍCULO 21º: Los(las) estudiantes deberán cursar obligatoriamente, tan pronto se programen, las asignaturas del nivel más bajo de su plan de estudios. Lo anterior es, además, aplicable a las asignaturas que el(la) estudiante hubiese reprobado. a. Informe de médico especialista en la patología, tramitado por la Dirección de Desarrollo Estudiantil. b. Informe fundado de una Comisión, nombrada por el(la) decano(a) de la Facultad, integrada por el(la) médico(a) tratante del estudiante, si lo tuviese, un médico especialista en la patología distinto del anterior, el(la) director(a) de carrera y el(la) Encargado(a) del Servicio de Salud Estudiantil, quien la coordinará, que determine el estado de salud incompatible del estudiante. El(La) vicerrector(a) de Pregrado resolverá la solicitud del decano(a) disponiendo, si procede, la cancelación de la matrícula mediante resolución.', '10 ARTÍCULO 45. Los programas podrán incorporar a personas nacionales o extranjeras interesadas en cursar como estudiantes libres, una o más asignaturas sin adscripción a un programa de magíster, siempre que te ngan los estudios previos necesarios para cursar dichas asignaturas. La solicitud de ingreso como estudiante libre se realizará a través de la dirección del programa. La aceptación dependerá de la disponibilidad de cupos y de la evaluación realizada por e l comité académico del programa. Si la solicitud es acogida favorablemente, dará lugar a una resolución interna que aprueba su ingreso como estudiante libre de postgrado, y la inscripción de las asignaturas correspondientes; asimismo indicará el valor de matrícula y el arancel a pagar, si procede, de acuerdo a lo que establece la resolución que fija los aranceles de los programas de postgrado y especialidades. La o el estudiante libre de postgrado no podrá modificar ni anular la inscripción de asignatura. TÍTULO VII: DE LAS Y LOS ESTUDIANTES DE MAGÍSTER ARTÍCULO 46. Será estudiante regular de un programa de magíster, la persona que haya ingresado de acuerdo al procedimiento señalado en el Título precedente, formalice su matrícula e inscriba activida des curriculares del programa en el período académico en curso. La o el estudiante también deberá matricularse durante el periodo que se encuentre realizando su tesis de grado/AFE o cumpliendo con otros requisitos necesarios para obtener su grado académic o como: estadías de entrenamiento o investigación, seminarios y otras que establezca cada programa. ARTÍCULO 47. La calidad de estudiante regular se extinguirá automáticamente: a) Cuando complete el plan de estudios del programa. b) Por renuncia voluntaria al programa, dirigida por escrito a la Dirección del Programa. La renuncia se formalizará en la Dirección de Registro Académico Estudiantil, previa emisión de un documento de la Dirección Académica de Postgrado. La renuncia no impide volver a ingresar al mismo programa, cumpliendo los requisitos de postulación. c) Cuando la o el estudiante incurra en alguna de las causales de eliminación contempladas en este reglamento y/o en el reglamento del programa al cual está adscrito. d) Por aplicación de alguna de las med idas disciplinarias contempladas en el Reglamento de Convivencia Estudiantil que impliquen la pérdida de la condición de estudiante. e) Exceder el plazo estipulado en el artículo 69 del presente reglamento. Para los efectos de la aplicación de la causal contemplada en la letra c) precedente, la Dirección del Programa deberá notificar a la o el estudiante a su correo institucional. ARTÍCULO 48. La Dirección del Programa informará la nómina de estudiantes que pierdan su calidad, a la Dirección Académica de Po stgrado y a la Dirección de Registro Académico Estudiantil, cada vez que esto ocurra. ARTICULO 49. Las y los estudiantes estarán obligados a respetar la normativa, en materia de acoso sexual, violencia y discriminación de género, discriminación arbitraria y maltrato, conforme al reglamento de Convivencia Universitaria. ARTICULO 50. Las conductas no referidas en el artículo precedente, serán investigadas conforme al procedimiento contenido en el reglamento de Convivencia Estudiantil Universitaria o instrumento que disponga la normativa interna. TÍTULO VIII: DE LA INSCRIPCIÓN DE ASIGNATURAS Y OTRAS ACTIVIDADES CURRICULARES']","Según la normativa de la UFRO, el requisito de asistencia mínima para ser evaluado en una asignatura teórica es del 70%. Sin embargo, en el aspecto práctico, se requiere un 100% de asistencia. Además, las actividades de carácter práctico que requieren asistencia del 100% deben estar explicitadas en el programa de la asignatura. Por lo tanto, la asistencia mínima dependerá del tipo de asignatura (teórica o práctica).",El estudiante debe cumplir con un mínimo del 75% de asistencia a las actividades curriculares presenciales o sincrónicas. El director de carrera puede exigir un porcentaje superior.,1.0,,0.9999999999,0.0
"Según el reglamento, ¿qué se entiende por Violencia de Género?","['6.- UNIVERSIDAD LIBRE DE DISCR IMINACIONES Y VIOLENCIAS DE GÉNERO La Universidad comprende que la prevención y la erradicación de las diferentes formas de violencia de género, dentro de las cuales se c omprenden el acoso sexual, la violencia y la discriminación de género, son fundamentales para el desarrollo pleno y sana convivencia de todas las personas y comunidades. Es por ello que, entendiendo el valor qu e tienen los procesos form ativos y educativos, se desarrollarán instancias y estrategias permanentes que permitan prevenir, abordar y erradicar las diferentes formas de discriminación y violencia de género, entregando además las condiciones que permitan a la co munidad universitaria participar de instancias que promuevan el buen trato, la valoración y reconocimiento de las diversidades culturales y de género. La prevención, acogida, acompañamiento, reeducación, actuación y sanción serán abor dadas desde modelos y protocolos construidos y evaluados participativa y triestamentalmente. Se promoverán estrategias para el bienestar y p r o t e c c i ó n d e l a s p e r s o n a s y c o m u n i d a d e s universitarias que hayan vivenciado situacion es de discriminación y/o violencias de g énero, a través de un modelo de reparación. Se desarrollarán ambientes físicos seguros y protectores, con el fin de erradicar los prejuicios, discriminaciones, agresiones y violencias de género, en todos los espacios de encuentro y convivencia universitaria. Se promoverá el reconocimiento y visibilización de las desi gualdades, disc riminaciones, desventajas y exclusiones que se configuran a part ir de la superposición de diferentes factores sociales, como el género, la cultura, clase social, entre otros, que afecta el crecimiento y desarrollo de las personas, favoreciendo la pa rticipación y empoderamiento en la comunidad universitaria de todas las personas, sin ningún tipo de discriminación. Atendido lo mandatado en el artículo 3 de la ley 21.369, se determina que el modelo de prevención y el modelo de sanción de las cond uctas contra el acoso sexual, la violencia y la discriminación de género, se contendrán en actos administrativos que aborden dicha temática en el contexto de la normativa que al efecto determine la Universidad. Esta normativa contendrá acciones de prevención , información, sensibi lización, sanción, capacitación y formación relacionadas con la vi olencia y la discrimin ación de género, y mecanismos de monitoreo y evaluación de su impacto. Asimismo, deberá contar con una estrategia de comunicación que garantice que las políticas, planes, protocolos y reglamentos sean conocidos en el interior de las instituciones de educación superior. TÍTULO V. DE LA IMPLEMENTACIÓN, SEGUIMIENTO Y EVALUACIÓN PERMANENTE DE LA POLÍTICA DE IGUALDAD Y EQUID AD DE GÉNERO Y DE SUS ACTORES. Una vez aprobada la Política de Igualdad y Equidad de Género, ésta se materializará en un PLAN DE IGUALDAD Y EQUIDAD DE GÉNERO , el cual se construirá teniendo como base los principios y lineamien tos contenidos en esta Política. Este instrumento establecerá responsables, plazos y recursos para su implem entación e impacto en los ámbitos de gestión institucional, docencia de pregrado y postgrado, investigación y vinculación con el medio. Asimismo, las diferentes unidades de la Universidad implementarán su s Planes de Acción en concordancia con la Política y el Plan de Igualdad y Equidad de Género. En todos estos procesos, EL ROL DE LOS/AS DIRECTIVOS/AS, JEFATURAS Y PERSONAS RESPONSABLES DE EQUIPOS en la Universidad, será velar por el cumplimiento de las diferentes etapas señaladas en esta Política y en su Plan, impulsando el compromiso de las personas que conforman la comunidad universitaria para alcanzar los objetivos y metas de la institución y sostenerlas en el tiempo. TÍTULO VI. UNIDAD RESPONSABLE. LA DIRECCIÓN DE EQUIDAD DE GÉNERO coordinará el diseño y pu esta en marcha del Plan de Igualdad y Equidad de Género.', '/gid00017/gid00022/gid00015 /gid00017/gid00023/gid00015 /gid00017/gid00024/gid00015 Que, el “Diagnóstico de la Situación y Relaciones de Género en la Universidad de La Frontera” (2020) y el “Estudio de Riesgos de Acoso Sexual, violencia y discriminación de género al Interior de la UFRO” (2022) señalan que existen diversas formas de discriminación y violencia de género en la Universidad entre los tres estamentos. Ambos estudios se encuentran a disposición en el sitio web de la Dirección de Equidad de Género, deg.ufro.cl, sección documentos. Que, el artículo 3 la Ley N°21.369 que regula el acoso sexual, la violencia y la discriminación de género en el ámbito de la Educación Superior, dispone que las Instituciones de Educación Superior deberán contar con una política integral contra las materias que trata la ley, la cual deberá contener un modelo de prevención y un modelo de sanción de dichas conductas, el cual deberá ser construido mediante métodos participativos por los estamentos de dicha Institución. En este sentido, por Resolución Exenta N°2340 de 2022 se aprobó la Política de Igualdad y Equidad de Género de la Universidad de La Frontera y por Resolución Exenta N°2347 de 2022 se aprobó Modelo de Prevención contra el acoso sexual, la violencia la discriminación de género, sin perjuicio de ello y anterior a la exigencia de la Ley N°21.369, mediante Resolución Exenta N°1141 de 2019 se Aprobó Protocolo de actuación para enfrentar situaciones de acoso sexual, abuso sexual, maltrato, acoso laboral y discriminación arbitraria de la Universidad de La Frontera. Ahora bien, el artículo 6 de la ley precitada vino en deﬁnir mínimos legales que hacen necesario la modiﬁcación y complementación del protocolo de actuación universitario, en mérito de disponer de un modelo de investigación y sanción del acoso sexual, la violencia y la discriminación de género y de protección y reparación a las víctimas mediante los literales que indica la ley. Que, el presente Reglamento ha sido construido en base a los instrumentos aprobados previamente por las instancias universitarias correspondientes, a saber: el Protocolo de Buenas Prácticas Laborales y Gestión de Denuncias de Maltrato y Acoso Laboral y Sexual (Resolución Exenta N°3597 de 2017), el Protocolo de actuación para enfrentar situaciones de acoso sexual, maltrato, abuso laboral y discriminación arbitraria (Resolución Exenta N°1141 de 2019) y la Coordinación de Procedimientos Disciplinarios (Resolución Exenta N°0719 de 2021). /gid00049/gid00162/gid00070/gid00072/gid00077/gid00064 /gid00017/gid00020 /gid00014 /gid00051/gid00068/gid00070/gid00075/gid00064/gid00076/gid00068/gid00077/gid00083/gid00078/gid00001/gid00067/gid00068 /gid00036/gid00078/gid00077/gid00085/gid00072/gid00085/gid00068/gid00077/gid00066/gid00072/gid00064/gid00001/gid00054/gid00077/gid00072/gid00085/gid00068/gid00081/gid00082/gid00072/gid00083/gid00064/gid00081/gid00072/gid00064', '/gid00014/gid00049/gid00162/gid00070/gid00072/gid00077/gid00064 /gid00017/gid00023 Para los efectos de este reglamento y sin perjuicio de lo establecido en el Código Penal, en el Código del Trabajo, en el Estatuto Administrativo o en otras leyes, se entenderá por: I. Deﬁniciones en el contexto de la Ley N°21.369 que regula el acoso sexual, la violencia y la discriminación de género en el ámbito de la educación superior. 01. Violencia de género. Cualquier acción o conducta, basada en el sexo, la orientación sexual, la identidad sexual o la expresión de género de una persona, que le cause la muerte, daño o sufrimiento físico, sexual o psicológico, tanto en el ámbito público como en el privado. 02. Violencia sexual. Entendida como todo comportamiento de connotación sexual no consentido que vulnere la integridad física o psicológica de una persona. Algunas de sus manifestaciones son: a) Acoso Sexual. Constituye acoso sexual cualquier acción o conducta de naturaleza o connotación sexual, sea verbal, no verbal, física, presencial, virtual o telemática, no deseada o no consentida por la persona a quien va dirigida o quien la recibe, que atente contra la dignidad de una persona, la igualdad de derechos, su libertad o integridad física, sexual, psíquica, emocional, o que cree un entorno intimidatorio, hostil o humillante, o que pueda amenazar, perjudicar o incidir en sus oportunidades, condiciones materiales o rendimiento laboral o académico, con independencia de si tal comportamiento o situación es aislado o reiterado. Algunos ejemplos de conductas constitutivas de acoso sexual son los siguientes: i) Comportamiento físico de naturaleza sexual: equivale a un contacto físico no deseado que varía desde besos, tocaciones, palmadas, acorralamientos, pellizcos o roces en el cuerpo. /gid00049/gid00133/gid00051/gid00051/gid00034/gid00039/gid00048/gid00001/gid00019/gid00128 /gid00037/gid00038/gid00001/gid00045/gid00034/gid00052 /gid00037/gid00038/gid00039/gid00042/gid00047/gid00042/gid00036/gid00042/gid00048/gid00047/gid00038/gid00052 /gid00034/gid00051/gid00053/gid00144/gid00036/gid00054/gid00045/gid00048/gid00001/gid00020/gid00027/gid00001/gid00037/gid00068/gid00195/gid00077/gid00072/gid00066/gid00072/gid00078/gid00077/gid00068/gid00082/gid00015/gid00001 /gid00051/gid00068/gid00070/gid00075/gid00064/gid00076/gid00068/gid00077/gid00083/gid00078/gid00001/gid00067/gid00068/gid00001 /gid00036/gid00078/gid00077/gid00085/gid00072/gid00085/gid00068/gid00077/gid00066/gid00072/gid00064/gid00001/gid00054/gid00077/gid00072/gid00085/gid00068/gid00081/gid00082/gid00072/gid00083/gid00064/gid00081/gid00072/gid00064', 'De acuerdo con lo establecido en la Ley N°21.369 que regula el acoso sexual, discriminación y violencia de género, la Universidad implementará mecanismos que contemplen apoyo psicológico, médico, social y jurídico para las víctimas y los miembros de la comunidad educativa afectados por los hechos denunciados. La Dirección de Equidad de Género coordinará y recomendará las medidas destinadas a otorgar asistencia médica o sicológica, apoyo psicosocial y jurídico en beneﬁcio de la persona afectada. Estos se realizarán a través de las instancias internas y externas a la Universidad que se ﬁjen al efecto. Se podrán adoptar de oﬁcio o a petición de las personas afectadas. Se implementarán estrategias de intervención en el entorno en que se encuentra la persona afectada, en coordinación con unidades internas, dependiendo del espacio universitario de que se trate. Asimismo, se realizarán acciones de seguimiento para la persona y la comunidad afectada una vez ﬁnalizados los procedimientos. Así también, quien ejerza como ﬁscal podrá recomendar a la/s persona/s y comunidad/es su asistencia obligatoria a actividades de sensibilización sobre violencia y discriminación de género. /gid00049/gid00162/gid00070/gid00072/gid00077/gid00064 /gid00020/gid00022 /gid00014 /gid00049/gid00133/gid00051/gid00051/gid00034/gid00039/gid00048/gid00001/gid00022/gid00128 /gid00037/gid00038/gid00001/gid00045/gid00034/gid00052/gid00001/gid00046/gid00038/gid00037/gid00042/gid00037/gid00034/gid00052 /gid00037/gid00038/gid00001/gid00034/gid00049/gid00048/gid00058/gid00048/gid00001/gid00058 /gid00051/gid00038/gid00049/gid00034/gid00051/gid00034/gid00036/gid00042/gid00149/gid00047 /gid00034/gid00051/gid00053/gid00144/gid00036/gid00054/gid00045/gid00048/gid00001/gid00019/gid00023/gid00027/gid00001/gid00046/gid00068/gid00066/gid00064/gid00077/gid00072/gid00082/gid00076/gid00078/gid00082/gid00001/gid00067/gid00068/gid00001/gid00034/gid00079/gid00078/gid00088/gid00078/gid00015 /gid00051/gid00068/gid00070/gid00075/gid00064/gid00076/gid00068/gid00077/gid00083/gid00078/gid00001/gid00067/gid00068 /gid00036/gid00078/gid00077/gid00085/gid00072/gid00085/gid00068/gid00077/gid00066/gid00072/gid00064/gid00001/gid00054/gid00077/gid00072/gid00085/gid00068/gid00081/gid00082/gid00072/gid00083/gid00064/gid00081/gid00072/gid00064']","Según el reglamento, se entiende por Violencia de Género cualquier acción o conducta, basada en el sexo, la orientación sexual, la identidad sexual o la expresión de género de una persona, que le cause la muerte, daño o sufrimiento físico, sexual o psicológico, tanto en el ámbito público como en el privado.",Cualquier acción o conducta,1.0,,0.3333333333,1.0
¿Qué es el Acoso Sexual y cuáles son ejemplos de conducta verbal de naturaleza sexual?,"['ii) Conducta verbal de naturaleza sexual (lenguaje sexual): incluye insinuaciones sexuales molestas, proposiciones o presión para la actividad sexual, insistencia que resulta molesta para una actividad social fuera del lugar de trabajo, ﬂirteos ofensivos, comentarios insinuantes, directos o indirectos, de carácter obscenos, asignando a la persona acosada un papel de objeto sexual en lugar de compañero de trabajo o de estudios. iii) Comportamiento no verbal de naturaleza sexual: exhibicionismo, exposición de fotos sexualmente sugestivas o pornográﬁcas, objetos o materiales escritos, miradas persistentes o sugestivas de carácter sexual, sonidos relativos a la actividad sexual, suspiros, silbidos o gestos de carácter sexual produciendo incomodidad. iv) Grabación de imágenes: grabar en audio, video o fotograﬁar (de forma digital o análoga) situaciones o imágenes de carácter sexual que comprometan la vida privada de forma unilateral y no consentida. v) Distribución: difundir, de forma unilateral y no consentida, a través de medios físicos o digitales, videos, imágenes o audios de situaciones de carácter sexual que comprometan la vida privada. vi) Comunicación verbal presencial: comentarios, palabras o bromas sexuales, humillantes, hostiles u ofensivas, relativas al cuerpo humano, ciclo reproductivo y apariencia de una persona, que no se encuadren dentro de una conducta verbal de naturaleza sexual (lenguaje sexual). b) Agresión sexual: uso de la fuerza física, la amenaza de su uso o cualquier otra forma de coacción para obtener algún tipo de interacción sexual no consentida expresamente por la otra persona, tales como, abuso sexual y/o violación. Lo anterior abarca también las situaciones en que la persona se halla privada de sentido o cualquier otra situación que le impida manifestar su voluntad. /gid00049/gid00162/gid00070/gid00072/gid00077/gid00064 /gid00017/gid00024 /gid00014 /gid00051/gid00068/gid00070/gid00075/gid00064/gid00076/gid00068/gid00077/gid00083/gid00078/gid00001/gid00067/gid00068 /gid00036/gid00078/gid00077/gid00085/gid00072/gid00085/gid00068/gid00077/gid00066/gid00072/gid00064/gid00001/gid00054/gid00077/gid00072/gid00085/gid00068/gid00081/gid00082/gid00072/gid00083/gid00064/gid00081/gid00072/gid00064', '/gid00014/gid00049/gid00162/gid00070/gid00072/gid00077/gid00064 /gid00017/gid00025 c) Acoso sexual en lugares públicos: es aquel cometido en lugares públicos o de libre acceso público por personas que integren la comunidad universitaria, en que, sin mediar el consentimiento de la persona, se realiza un acto de signiﬁcación sexual consistente en actos de carácter verbal o ejecutados por medio de gestos; conductas consistentes en acercamientos o persecuciones, o actos de exhibicionismo obsceno o de contenido sexual explícito. 03. Discriminación de género: entendida como toda distinción, exclusión o restricción, basada en el sexo, orientación sexo afectiva, identidad de género o expresión de género de una persona y que, careciendo de justiﬁcación razonable, le cause privación, perturbación o amenaza en el legítimo ejercicio de sus derechos humanos y libertades fundamentales. Las deﬁniciones antes indicadas son sin perjuicio de otras conductas que puedan estimarse vulneradoras de lo establecido en la Ley N°21.369. II. Deﬁniciones relacionadas con la convivencia universitaria en temáticas diversas a las tratadas por la Ley 21.369 y que conﬁguran atentados a la dignidad de los integrantes de la Comunidad Universitaria. 01. Discriminación Arbitraria: toda distinción, exclusión o restricción que carezca de justiﬁcación razonable, efectuada por agentes del Estado o particulares, y que cause privación, perturbación o amenaza en el ejercicio legítimo de los derechos fundamentales establecidos en la Constitución Política de la República o en los tratados internacionales ratiﬁcados por Chile que se encuentren vigentes. Algunas categorías en las cuales pudiera basarse la discriminación arbitraria son pertenencia a pueblos originarios, nacionalidad, situación económica, preparación estudiantil, profesional o académica, grado académico, idioma, pareceres, ideología u opinión política, religión o creencia, sindicación y/o participación (o no) en organizaciones, estado civil, edad, ﬁliación, apariencia personal, enfermedad o situación de discapacidad. /gid00051/gid00068/gid00070/gid00075/gid00064/gid00076/gid00068/gid00077/gid00083/gid00078/gid00001/gid00067/gid00068/gid00001 /gid00036/gid00078/gid00077/gid00085/gid00072/gid00085/gid00068/gid00077/gid00066/gid00072/gid00064/gid00001/gid00054/gid00077/gid00072/gid00085/gid00068/gid00081/gid00082/gid00072/gid00083/gid00064/gid00081/gid00072/gid00064', ""\x14\x14 Administración del Estado reconoce el principio de la probidad administrativa. /g520La Ley 20.005 que tipifica y sanciona el acoso sexual e incorpora esa normativa para toda relación de trabajo. • EL DFL 29 del 2004 del Ministerio de Hacienda que contiene el texto refundido dela Ley Nº 18.834 sobre Estatuto Administrativo, aplicable a los funcionarios de esta universidad, que prohíbe a todo funcionario realizar cualquier acto atentatorio a la dignidad de los demás funcionarios y considera como una acción de este tipo el acoso sexual (art. 84 letra l). También sanci ona el acoso laboral (art.84 letra m). /g520Ley Nº20.370 que establece la Ley General de Educación y sus respectivas modificaciones. /g520La Ley 20.545 que modifica las normas sobre protección a la maternidad e incorpora el permiso postnatal parental. /g520La Ley 20.607 que modifica el Código del Trabajo, sancionando las prácticas de acoso laboral. /g520La Ley 20.609 que establece medidas contra la discriminación. /g520La Ley 21.091 sobre educación superior. /g520La Ley 21.094 sobre Universidades Estatales. /g520La Ley 21.120 que reconoce y da protección al derecho a la identidad de género. /g520La Ley 21.369 que regula el acoso sexual, la violencia y la discriminación de género en el ámbito de la educación superior. ANÓTESE Y COMUNÍQUESE SECRETARIO GENERAL R E C T O R EHW/PDG/CMI/fhb Distribución: /g16Rectoría /g16Secretaría General /g16Vicerrectoría Académica /g16Vicerrectoría Investig. y Postgrado /g16Vicerrectoría de Pregrado /g16Vicerrectoría Adm. y Fzas. /g16Contraloría Universitaria /g16Decanos de Facultad /g16Vicedecanos de Facultad /g16Direcciones de Pregrado /g16Directores de Campus /g16Directores de Instituto /g16Secretarios de Facultad /g16Directores Administrativos /g16Directores Deptos. Académicos /g16Directores de Carrera /g16Direcc. Registro Académico Estudiantil /g16Jefes de División /g16Jefes de Sección /g16Jefes de Oficina Firmado digitalmente por PLINIO DONOSOR DURÁN GARCÍA Firmado digitalmente por Eduardo Rodolfo Alfredo Hebel Weiss Control de Legalidad Dirección de Legalidad Universidad de La Frontera Firmado digitalmente por Gustavo Becerra Nombre de reconocimiento (DN): cn=Gustavo Becerra, o=UFRO, ou=UFRO, email=gustavo.becerra@ufrontera.cl, c=CL Fecha: 2022.09.23 17:19:59 -03'00' Firmado digitalmente por Roberto David Contreras Eddinger Motivo: TOMA DE RAZON CONTRALORIA UNIVERSIDAD DE LA FRONTERA Ubicación: TEMUCO. CHILE Fecha: 2022.09.23 17:23:35 -03'00'"", 'De acuerdo con lo establecido en la Ley N°21.369 que regula el acoso sexual, discriminación y violencia de género, la Universidad implementará mecanismos que contemplen apoyo psicológico, médico, social y jurídico para las víctimas y los miembros de la comunidad educativa afectados por los hechos denunciados. La Dirección de Equidad de Género coordinará y recomendará las medidas destinadas a otorgar asistencia médica o sicológica, apoyo psicosocial y jurídico en beneﬁcio de la persona afectada. Estos se realizarán a través de las instancias internas y externas a la Universidad que se ﬁjen al efecto. Se podrán adoptar de oﬁcio o a petición de las personas afectadas. Se implementarán estrategias de intervención en el entorno en que se encuentra la persona afectada, en coordinación con unidades internas, dependiendo del espacio universitario de que se trate. Asimismo, se realizarán acciones de seguimiento para la persona y la comunidad afectada una vez ﬁnalizados los procedimientos. Así también, quien ejerza como ﬁscal podrá recomendar a la/s persona/s y comunidad/es su asistencia obligatoria a actividades de sensibilización sobre violencia y discriminación de género. /gid00049/gid00162/gid00070/gid00072/gid00077/gid00064 /gid00020/gid00022 /gid00014 /gid00049/gid00133/gid00051/gid00051/gid00034/gid00039/gid00048/gid00001/gid00022/gid00128 /gid00037/gid00038/gid00001/gid00045/gid00034/gid00052/gid00001/gid00046/gid00038/gid00037/gid00042/gid00037/gid00034/gid00052 /gid00037/gid00038/gid00001/gid00034/gid00049/gid00048/gid00058/gid00048/gid00001/gid00058 /gid00051/gid00038/gid00049/gid00034/gid00051/gid00034/gid00036/gid00042/gid00149/gid00047 /gid00034/gid00051/gid00053/gid00144/gid00036/gid00054/gid00045/gid00048/gid00001/gid00019/gid00023/gid00027/gid00001/gid00046/gid00068/gid00066/gid00064/gid00077/gid00072/gid00082/gid00076/gid00078/gid00082/gid00001/gid00067/gid00068/gid00001/gid00034/gid00079/gid00078/gid00088/gid00078/gid00015 /gid00051/gid00068/gid00070/gid00075/gid00064/gid00076/gid00068/gid00077/gid00083/gid00078/gid00001/gid00067/gid00068 /gid00036/gid00078/gid00077/gid00085/gid00072/gid00085/gid00068/gid00077/gid00066/gid00072/gid00064/gid00001/gid00054/gid00077/gid00072/gid00085/gid00068/gid00081/gid00082/gid00072/gid00083/gid00064/gid00081/gid00072/gid00064']","El acoso sexual se define como cualquier comportamiento de naturaleza sexual que se realiza de manera no consentida, creando un ambiente hostil o incómodo para la persona afectada. Esto puede incluir una variedad de conductas, tanto verbales como no verbales.

Los ejemplos de conducta verbal de naturaleza sexual incluyen:

1. Insinuaciones sexuales molestas.
2. Propuestas o presión para actividades sexuales.
3. Flirteos ofensivos.
4. Comentarios obscenos o insinuantes de carácter sexual.
5. Directas o indirectas insinuaciones que transforman a la persona en un objeto sexual en lugar de reconocerla como compañera de trabajo o de estudios.

Estas conductas generan incomodidad y son consideradas acoso, sobre todo si son repetitivas o persistentes.",Constituye acoso sexual cualquier acción o conducta de connotación sexual,1.0,,0.999999999975,1.0
Mencione dos ejemplos de Comportamiento no verbal de naturaleza sexual que constituyan acoso.,"['ii) Conducta verbal de naturaleza sexual (lenguaje sexual): incluye insinuaciones sexuales molestas, proposiciones o presión para la actividad sexual, insistencia que resulta molesta para una actividad social fuera del lugar de trabajo, ﬂirteos ofensivos, comentarios insinuantes, directos o indirectos, de carácter obscenos, asignando a la persona acosada un papel de objeto sexual en lugar de compañero de trabajo o de estudios. iii) Comportamiento no verbal de naturaleza sexual: exhibicionismo, exposición de fotos sexualmente sugestivas o pornográﬁcas, objetos o materiales escritos, miradas persistentes o sugestivas de carácter sexual, sonidos relativos a la actividad sexual, suspiros, silbidos o gestos de carácter sexual produciendo incomodidad. iv) Grabación de imágenes: grabar en audio, video o fotograﬁar (de forma digital o análoga) situaciones o imágenes de carácter sexual que comprometan la vida privada de forma unilateral y no consentida. v) Distribución: difundir, de forma unilateral y no consentida, a través de medios físicos o digitales, videos, imágenes o audios de situaciones de carácter sexual que comprometan la vida privada. vi) Comunicación verbal presencial: comentarios, palabras o bromas sexuales, humillantes, hostiles u ofensivas, relativas al cuerpo humano, ciclo reproductivo y apariencia de una persona, que no se encuadren dentro de una conducta verbal de naturaleza sexual (lenguaje sexual). b) Agresión sexual: uso de la fuerza física, la amenaza de su uso o cualquier otra forma de coacción para obtener algún tipo de interacción sexual no consentida expresamente por la otra persona, tales como, abuso sexual y/o violación. Lo anterior abarca también las situaciones en que la persona se halla privada de sentido o cualquier otra situación que le impida manifestar su voluntad. /gid00049/gid00162/gid00070/gid00072/gid00077/gid00064 /gid00017/gid00024 /gid00014 /gid00051/gid00068/gid00070/gid00075/gid00064/gid00076/gid00068/gid00077/gid00083/gid00078/gid00001/gid00067/gid00068 /gid00036/gid00078/gid00077/gid00085/gid00072/gid00085/gid00068/gid00077/gid00066/gid00072/gid00064/gid00001/gid00054/gid00077/gid00072/gid00085/gid00068/gid00081/gid00082/gid00072/gid00083/gid00064/gid00081/gid00072/gid00064', '/gid00014/gid00049/gid00162/gid00070/gid00072/gid00077/gid00064 /gid00017/gid00025 c) Acoso sexual en lugares públicos: es aquel cometido en lugares públicos o de libre acceso público por personas que integren la comunidad universitaria, en que, sin mediar el consentimiento de la persona, se realiza un acto de signiﬁcación sexual consistente en actos de carácter verbal o ejecutados por medio de gestos; conductas consistentes en acercamientos o persecuciones, o actos de exhibicionismo obsceno o de contenido sexual explícito. 03. Discriminación de género: entendida como toda distinción, exclusión o restricción, basada en el sexo, orientación sexo afectiva, identidad de género o expresión de género de una persona y que, careciendo de justiﬁcación razonable, le cause privación, perturbación o amenaza en el legítimo ejercicio de sus derechos humanos y libertades fundamentales. Las deﬁniciones antes indicadas son sin perjuicio de otras conductas que puedan estimarse vulneradoras de lo establecido en la Ley N°21.369. II. Deﬁniciones relacionadas con la convivencia universitaria en temáticas diversas a las tratadas por la Ley 21.369 y que conﬁguran atentados a la dignidad de los integrantes de la Comunidad Universitaria. 01. Discriminación Arbitraria: toda distinción, exclusión o restricción que carezca de justiﬁcación razonable, efectuada por agentes del Estado o particulares, y que cause privación, perturbación o amenaza en el ejercicio legítimo de los derechos fundamentales establecidos en la Constitución Política de la República o en los tratados internacionales ratiﬁcados por Chile que se encuentren vigentes. Algunas categorías en las cuales pudiera basarse la discriminación arbitraria son pertenencia a pueblos originarios, nacionalidad, situación económica, preparación estudiantil, profesional o académica, grado académico, idioma, pareceres, ideología u opinión política, religión o creencia, sindicación y/o participación (o no) en organizaciones, estado civil, edad, ﬁliación, apariencia personal, enfermedad o situación de discapacidad. /gid00051/gid00068/gid00070/gid00075/gid00064/gid00076/gid00068/gid00077/gid00083/gid00078/gid00001/gid00067/gid00068/gid00001 /gid00036/gid00078/gid00077/gid00085/gid00072/gid00085/gid00068/gid00077/gid00066/gid00072/gid00064/gid00001/gid00054/gid00077/gid00072/gid00085/gid00068/gid00081/gid00082/gid00072/gid00083/gid00064/gid00081/gid00072/gid00064', '\x15 Seguimiento de Casos y la Coordinación de Estudios, Observación, Desarrollo y Mejora Continua de Equidad de Género. A su vez, la Dirección cuenta con un Consejo Asesor de Equidad de Género, conformado por integrant es de todos los estamentos la comunidad universitaria. 5. Que, en lo que respecta a la regularización normativa en esta materia, por Resolución Exenta N ° 1 1 4 1 d e f e c h a 0 7 de mayo de 2019 se aprobó Protocolo de actuación para enfrenta r situaciones de acoso sexual, abuso sexual, maltrato, acoso laboral y discrim inación arbitraria, el cual fue mo dificado por Resolución Exenta N°0727 de fecha 29 de abril de 2021. 6. Que, en concordancia con lo dispuesto en el acto administrativo que crea la Dirección de Equi dad de Género, por Resolución Exenta N°1109 de fecha 06 de julio de 2021, se designar on integrantes del primer Consejo Asesor de la Dirección de Equidad e Género y se aprobó re glamento para su funcionamiento, indicando entre sus funciones “Velar por la correcta aplicación del Protocolo de Actuación para Enfrentar Situaciones de Acoso, Abuso Sexual, Maltrato, Acoso Laboral y Discriminación Arbitraria y de la Política de Equidad de Género de la Universidad d e L a F r o n t e r a e i n f o r m a r y d a r c u e n t a d e situaciones irregulares contempladas dentro de dichos instrumentos”. 7. Que, por Resolución Exenta N°0719 de fecha 28 de abril de 2021, se creó la Coordinación de Procedimientos Disci plinarios, teniendo por objeto el “[… ] asesorar y tramitar todos los procesos administrativos disciplinarios que se instruyan en la Universidad”, con stituyéndose como unidad especi alizada independiente de la Dirección de Equidad de Género a cargo del pr ocedimiento de investigaci ón y sanción en la orgánica universitaria, con especial atención en los procedimientos asociados a materia de género, en correspondencia con lo dispuesto en el artículo 3° de la Ley N°21.369 que Regula el Acoso Sexual, la Violencia y la Discriminación de Género en el Ám bito de la Educación Superior, que dispone que las Instituciones de Educación Superior contarán con unidades responsables de la implementación de sus políticas, planes, protocolos y reglamentos sobre violencia y discriminación de género y, de forma separad a, contarán también con una o más unidades responsables de llevar a cabo los procesos de investigación y sanción del acoso sexual, la violencia y la discriminación de género y de p r o t e c c i ó n y r e p a r a c i ó n d e l a s v í c t i m a s . E s t a s unidades deben ser integradas por personal cap acitado en derechos humanos y perspectiva de género, dispondrán de recursos humanos y pr esupuestarios suficientes y de las facultades necesarias para el efectivo cumplimiento de su tarea. 8. Que, por Resolución Exenta N°1073 de fecha 27 de abril de 2022, se aprobó procedimiento de uso de nombre social para personas trans de la Universidad de La Frontera, lo cual viene a otorgar cumplimiento a los compromisos suscritos por la Universidad señalados en el considerando 3° de la presente resolución y en concordancia con lo dispuesto en la Ley N°21.12 0 que Reconoce y da protección al derecho a la identidad de género y en la Ley N °21.369 antes referida. 9. Que, la entrada en vigencia de la Ley N°21.369 que Regula el Acoso Sexual, la Violenci a y la Discriminación de Género en el Ámbito de la Educación Superior, dispone que l as Instituciones de Educación Superior deberán promover políticas integrales orientadas a prevenir, investigar, sanci onar y erradicar el acoso sexual, la violencia y la discr iminación de género, y proteger y reparar a las víctimas en el ámbito de la educación superior, con la finalid ad de establecer ambientes seguros y libres de acoso sexual, violencia y discriminación de gén ero, para todas las personas que se relacionen en comunidades académicas de educa ción superior, con prescinden cia de su sexo, género, identidad y orientación sexual. 10. Que, el artículo 3 de la ley precitada, indica que “Las instituciones de educación superior señaladas en el ar tículo 1° deberán contar con una política integral contra el acoso sexual, la viol encia y la discriminación de género, que contendrá un modelo de prevención y un modelo de sanción de dichas conductas, construido con la participación de todos los estamentos ex istentes en su interior”, lo cual la Universidad de La Frontera venía elaborando median te comisiones triestamentale s y procesos públicos y participativos con los disti ntos estamentos de la comunidad universitaria, como consta en', '6.- UNIVERSIDAD LIBRE DE DISCR IMINACIONES Y VIOLENCIAS DE GÉNERO La Universidad comprende que la prevención y la erradicación de las diferentes formas de violencia de género, dentro de las cuales se c omprenden el acoso sexual, la violencia y la discriminación de género, son fundamentales para el desarrollo pleno y sana convivencia de todas las personas y comunidades. Es por ello que, entendiendo el valor qu e tienen los procesos form ativos y educativos, se desarrollarán instancias y estrategias permanentes que permitan prevenir, abordar y erradicar las diferentes formas de discriminación y violencia de género, entregando además las condiciones que permitan a la co munidad universitaria participar de instancias que promuevan el buen trato, la valoración y reconocimiento de las diversidades culturales y de género. La prevención, acogida, acompañamiento, reeducación, actuación y sanción serán abor dadas desde modelos y protocolos construidos y evaluados participativa y triestamentalmente. Se promoverán estrategias para el bienestar y p r o t e c c i ó n d e l a s p e r s o n a s y c o m u n i d a d e s universitarias que hayan vivenciado situacion es de discriminación y/o violencias de g énero, a través de un modelo de reparación. Se desarrollarán ambientes físicos seguros y protectores, con el fin de erradicar los prejuicios, discriminaciones, agresiones y violencias de género, en todos los espacios de encuentro y convivencia universitaria. Se promoverá el reconocimiento y visibilización de las desi gualdades, disc riminaciones, desventajas y exclusiones que se configuran a part ir de la superposición de diferentes factores sociales, como el género, la cultura, clase social, entre otros, que afecta el crecimiento y desarrollo de las personas, favoreciendo la pa rticipación y empoderamiento en la comunidad universitaria de todas las personas, sin ningún tipo de discriminación. Atendido lo mandatado en el artículo 3 de la ley 21.369, se determina que el modelo de prevención y el modelo de sanción de las cond uctas contra el acoso sexual, la violencia y la discriminación de género, se contendrán en actos administrativos que aborden dicha temática en el contexto de la normativa que al efecto determine la Universidad. Esta normativa contendrá acciones de prevención , información, sensibi lización, sanción, capacitación y formación relacionadas con la vi olencia y la discrimin ación de género, y mecanismos de monitoreo y evaluación de su impacto. Asimismo, deberá contar con una estrategia de comunicación que garantice que las políticas, planes, protocolos y reglamentos sean conocidos en el interior de las instituciones de educación superior. TÍTULO V. DE LA IMPLEMENTACIÓN, SEGUIMIENTO Y EVALUACIÓN PERMANENTE DE LA POLÍTICA DE IGUALDAD Y EQUID AD DE GÉNERO Y DE SUS ACTORES. Una vez aprobada la Política de Igualdad y Equidad de Género, ésta se materializará en un PLAN DE IGUALDAD Y EQUIDAD DE GÉNERO , el cual se construirá teniendo como base los principios y lineamien tos contenidos en esta Política. Este instrumento establecerá responsables, plazos y recursos para su implem entación e impacto en los ámbitos de gestión institucional, docencia de pregrado y postgrado, investigación y vinculación con el medio. Asimismo, las diferentes unidades de la Universidad implementarán su s Planes de Acción en concordancia con la Política y el Plan de Igualdad y Equidad de Género. En todos estos procesos, EL ROL DE LOS/AS DIRECTIVOS/AS, JEFATURAS Y PERSONAS RESPONSABLES DE EQUIPOS en la Universidad, será velar por el cumplimiento de las diferentes etapas señaladas en esta Política y en su Plan, impulsando el compromiso de las personas que conforman la comunidad universitaria para alcanzar los objetivos y metas de la institución y sostenerlas en el tiempo. TÍTULO VI. UNIDAD RESPONSABLE. LA DIRECCIÓN DE EQUIDAD DE GÉNERO coordinará el diseño y pu esta en marcha del Plan de Igualdad y Equidad de Género.']","Dos ejemplos de comportamiento no verbal de naturaleza sexual que constituyan acoso, según la normativa proporcionada, son:

1. Exhibicionismo o actos de exhibición obscena de contenido sexual.
2. Miradas persistentes o sugestivas de carácter sexual que produzcan incomodidad.",Dos ejemplos son la exhibición de fotos sexualmente sugestivas o pornográficas,1.0,,0.9999999999,1.0
¿Cuál es el objetivo principal de la Política Financiera de la Universidad de La Frontera?,"['2 Superior, proponer las políticas para la educación superior y coordinar a los órganos del Estado que componen el Sistema”, debiendo para tales efectos, que las Universidades cuenten con directrices que permitan la elaboración e implementación de políticas propias de su quehacer universitario. 5. Que, por Resolución Exenta N°4013 de fecha 14 de diciembre de 2023, se aprobó el Protocolo de Gestión de Políticas Institucionales de la Universidad de La Frontera, el cual tuvo por obje to regular el ciclo de vida de las políticas institucionales mediante un instrumento que otorgue procesos homogéneos en concordancia con la normativa nacional en Educación Superior. 6. Que, en cuanto a los antecedentes que motivan esta Política: En este con texto normativo para las Instituciones de Educación Superior, en el cual existen nuevas exigencias en materias financieras, aumento de sistemas de control, así como los nuevos criterios de acreditación institucional, surge la necesidad de contar con una Po lítica Financiera para la Universidad de La Frontera. Lo anterior, argumentado en los procedimientos y requerimientos para generar las autorizaciones para los procesos de tramitación de endeudamientos, sean estos de corto, mediano o largo plazo. Por otra p arte, la necesidad de contar con procesos de control más rigurosos, de manera de dar cumplimiento a las exigencias del nuevo marco legal y normativo, como lo es la Ley de delitos económicos, lavado de activos y de financiamiento del terrorismo. En el mismo sentido, la necesidad de contar con procedimientos actualizados y pertinentes a la realidad actual Universitaria y de financiamiento del sistema de educación superior, motivo por el cual se requiere contar con un reglamento conocido y transparente sobre la elaboración, ejecución y control del presupuesto universitario que, de cuenta de las necesidades de financiamiento de todo el quehacer universitario, y que vele por la sostenibilidad presente y futura. En función de este mandato, además de la propia naturaleza de las políticas institucionales, como reflejo de la cultura y valores de la Institución, es relevante considerar la participación como un eje transversal al ciclo de vida de las políticas institucionales. En función de la creación de nuevos en tes fiscalizadores como lo es la Superintendencia de Educación Superior y las actuales atribuciones tanto de la Subsecretaría de Educación Superior como de la Contraloría General de la República en relación a las instituciones de educación superior, se norma la rendición de cuentas de la gestión financiera de este tipo de instituciones. Además, se suma la definición de nuevos criterios y estándares para la acreditación institucional por parte de la CNA, que incorpora la dimensión Gestión Estratégica y Recur sos Institucionales con fines de asegurar la sostenibilidad del proyecto. 7. Que, en cuanto al proceso general de elaboración de la Política y en conformidad a las directrices institucionales, este proceso se ordenó en tres etapas fundamentales: diagnóstico, elaboración y validación: a) Etapa de Diagnóstico La construcción de esta política fue iniciada por la Vicerrectoría de Administración y Finanzas mediante ordinario N°198/3010 de fecha 16 de noviembre de 2023, en que se solicitó formalizar la Comisión pa ra la Elaboración de la Política Financiera de la Universidad de La Frontera (en adelante también “la Comisión”) y de la Secretaría Técnica a tal efecto. Esta Comisión estuvo compuesta por representantes de diversos estamentos universitarios, unidades rela cionadas al área financiera, Dirección Jurídica, facultades, y las asociaciones gremiales académica y administrativa. En consecuencia, por Resolución Exenta N°3866 de fecha 04 de diciembre de 2023 se designaron sus integrantes, lo que fue complementado por Resolución Exenta N°4066 de fecha 19 de diciembre de 2023. La Comisión para la Elaboración de la Política Financiera comenzó a sesionar con fecha 27 de noviembre de 2023.', '/gid00049/gid00162/gid00070/gid00072/gid00077/gid00064 /gid00018/gid00022 /gid00014 14. Coordinación: durante el proceso de investigación existirá vinculación permanente con las diferentes unidades académicas y administrativas de la Universidad, con el ﬁn de orientar y acordar medidas que promuevan una adecuada convivencia universitaria cuando hayan existido situaciones asociadas a este reglamento. Así también, se fomentará la coordinación y colaboración con redes internas y externas a la Universidad, con el ﬁn de gestionar espacios de atención para aquellas personas que lo requieran. 15. Trato digno y equitativo: se otorgará un trato igualitario a todos los miembros de la comunidad universitaria. Se considerará como primordial en el análisis y abordaje de las situaciones relacionadas con este reglamento, las condiciones estructurales de desigualdad que afectan especialmente a las mujeres y a personas con otras identidades de género, expresiones de género u orientaciones sexo afectivas, producto de los patrones sociales y culturales resultantes de los procesos de socialización de género. /gid00051/gid00068/gid00070/gid00075/gid00064/gid00076/gid00068/gid00077/gid00083/gid00078/gid00001/gid00067/gid00068 /gid00036/gid00078/gid00077/gid00085/gid00072/gid00085/gid00068/gid00077/gid00066/gid00072/gid00064/gid00001/gid00054/gid00077/gid00072/gid00085/gid00068/gid00081/gid00082/gid00072/gid00083/gid00064/gid00081/gid00072/gid00064', '9 Transcurrida la vigencia de este plazo, se deberá evaluar de manera participativa la continuidad y/o modificación del documento, según los lineamientos del Protocolo de Gestión de Políticas Institucionales. ANOTESE Y COMUNÍQUESE PLINIO DURAN GARCIA JUAN MANUEL FIERRO BUSTOS SECRETARIO GENERAL RECTOR SUBROGANTE JFB/PDG/CMI/fhb Distribución: \uf0b7 Rectoría \uf0b7 Secretaría General \uf0b7 Vicerrectoría Académica \uf0b7 Vicerrectoría Investig. y Postgrado \uf0b7 Vicerrectoría de Pregrado \uf0b7 Vicerrectoría Adm. y Fzas. \uf0b7 Contraloría Universitaria \uf0b7 Decanos de Facultad \uf0b7 Vicedecanos de Facultad \uf0b7 Direcciones de Pregrado \uf0b7 Directores de Campus \uf0b7 Directores de Instituto \uf0b7 Secretarios de Facultad \uf0b7 Directores Administrativos \uf0b7 Directores Deptos. Académicos \uf0b7 Directores de Carrera \uf0b7 Direcc. Registro Ac. Estudiantil \uf0b7 Jefes de División \uf0b7 Jefes de Sección \uf0b7 Jefes de Oficina', '3 En una primera fase, se llevó a cabo un proceso de un diagnóstico sobre el ámbito financiero de la Universidad. Esta etapa contempló dos fases: - Recolección de información primaria a través de: a) Entrevistas semi estructuradas con actores e informantes clave internos e informantes clave externos, representantes de universidades e instituciones públicas y privadas. b) Realización de un conversatorio en que participaron decanos y vicerrectores. - Revisión del estado del arte, considerando información secundaria proveniente del análisis comparado de políticas financieras, donde se consult ó documentación correspondiente a diversas instituciones de educación superior tanto nacionales como internacionales, públicas y privadas, así como la revisión de la normativa interna. b) Etapa de Elaboración Entre noviembre de 2023 y mayo de 2024, la Co misión sesionó de manera regular, con el objeto de analizar y evaluar los hallazgos y resultados obtenidos en la etapa de diagnóstico, estableciendo su pertinencia para ser desarrollados e incluidos en esta Política, a la luz de la normativa universitaria y de la realidad institucional en esta materia. Para ello, las sesiones de trabajo se estructuraron en torno al análisis de temas seleccionados, informes expositivos, y su posterior discusión y acuerdos. Los primeros avances de esta etapa fueron la defini ción del objetivo general y los objetivos específicos, factores rectores de este instrumento de gestión. Luego de aprobados estos objetivos, se establecieron los principios formativos y definiciones que tuvieran un carácter esencial en la proyección de la Política. En la definición de principios formativos se buscó que no se reiterasen aquellos establecidos en las leyes de Educación Superior que regulan a la Institución, sino a reconocer aquellos que resultaran relevantes y preeminentes en la implementación de este instrumento. Por último, se desarrollaron las directrices de esta política, entendidas como los requerimientos o mandatos acerca de los aspectos financieros relevantes que se deben gestionar e implementar de modo prioritario. Estas directrices f ueron trabajadas con el fin de responder de manera consistente al objetivo general y específicos, en el marco de los principios formativos de esta Política. c) Validación La Comisión determinó la realización de una consulta participativa que involucró a la comunidad universitaria, en sus estamentos académico y administrativo, quienes entregaron su parecer respecto a los principales elementos y propuestas de este documento. Esta instancia se llevó a cabo durante el mes de mayo de 2024 y tuvo por resultado 5 33 respuestas, con una evaluación satisfactoria de un 87,7%. A partir de la retroalimentación recibida se realizaron ajustes que mejoraron la propuesta. De manera complementaria, el día 10 de junio de 2024, este documento fue presentada ante el Comité de Rectoría, recibiendo retroalimentación que genero nuevos ajustes. El resultado de este proceso concluyó en la versión que sería presentada ante los cuerpos colegiados institucionales. 8. Que, en lo referido al marco normativo, se han considerado los instrumentos jurídicos que a continuación se indican: a) En cuanto a la normativa nacional: Ley N°20.129 que Establece un Sistema Nacional de Aseguramiento de la Calidad de la Educación Superior; Ley N°21.091 sobre Educación Superior; Ley N°21.094 sobre Univer sidades Estatales; Criterios y Estándares de Calidad para la Acreditación Institucional del Subsistema Universitario de la Comisión Nacional de Acreditación (CNA), Ley N° 20.370 General de Educación; Ley N°21.640 sobre presupuesto del sector público corres pondiente al año 2024, D.F.L. N°156 de 1981 del MINEDUC que aprueba Estatuto de la Universidad de La Frontera; Decreto N°180 de 1987 del Ministerio de Hacienda que fija norma para la presentación de presupuestos, balance de ejecución presupuestaria e']","El objetivo principal de la Política Financiera de la Universidad de La Frontera es regular el ciclo de vida de las políticas institucionales a través de un instrumento que otorgue procesos homogéneos en concordancia con la normativa nacional en Educación Superior. Esto incluye la generación de autorizaciones para procesos de tramitación de endeudamientos, la implementación de controles rigurosos para cumplir con las exigencias legales, y la elaboración de un reglamento transparente sobre la ejecución y control del presupuesto universitario para garantizar la sostenibilidad del quehacer universitario.",El objetivo principal es establecer principios y directrices para una gestión financiera sostenible,0.5714285714285714,,0.7499999999625,1.0
¿Quién es el responsable de aplicar la Política Financiera en su totalidad?,"['8 5. Gestión eficiente del endeudamiento: La Universidad, en su compromiso con una gestión financiera responsable y sostenible, contará con pautas anuales de endeudamiento, que permitan evaluar, autorizar y controlar el uso del crédito o de empréstitos como herramienta estratégica de financiamiento. Estas pautas deberán incluir criterios objetivos y límites definidos para la toma de deuda, tanto en términos de su monto, plazo, costo financiero y condiciones de pago, como de su impacto proyectado en la sostenibilidad institucional. La gestión del endeudamiento estará orientada a cubrir necesidades financieras justificadas, vinculadas a proyectos de inversión, infraestructura, crecimiento académico, innovación, capital de trabajo o cualquier iniciativa que contribuya directamente al cumplimiento de la Misión Institucional y a los d esafíos estratégicos priorizados en el Plan Estratégico de Desarrollo (PED). Cada decisión de endeudamiento deberá sustentarse en un análisis jurídico -legal y técnico- financiero riguroso que determine: \uf0b7 Las autorizaciones y directrices incorporadas en la Ley de Presupuestos del Sector Público y de la Dirección de Presupuestos. \uf0b7 La brecha institucional u oportunidad para cubrir; \uf0b7 El monto requerido y la fuente de financiamiento más adecuada; \uf0b7 Los plazos y condiciones del endeudamiento; \uf0b7 Y la capacidad efectiva de repago, considerando la proyección de flujos institucionales y márgenes de maniobra financiera. Adicionalmente, se establecerán mecanismos efectivos de control, monitoreo y rendición de cuentas, que incluyan revisiones periódicas del endeudamiento vige nte, alertas tempranas ante desviaciones críticas, y reportes institucionales sobre su evolución e impacto. Estos mecanismos deberán integrarse a los procesos de auditoría interna y a los sistemas de planificación presupuestaria, y de aseguramiento de la c alidad, a fin de asegurar una visión integral del comportamiento financiero de la Universidad. TÍTULO VI. DE LA DIFUSIÓN Y POSICIONAMIENTO La Universidad de La Frontera, a través de la Vicerrectoría de Administración y Finanzas, por medio de su Direcció n de Finanzas y en coordinación con la Dirección de Comunicaciones, desarrollará una estrategia comunicacional destinada a difundir, socializar y posicionar la Política Financiera en toda la comunidad universitaria. Con la colaboración de las direcciones, jefaturas, personas responsables de equipos y la comunidad universitaria en general, se realizarán acciones permanentes de difusión, socialización y comunicación que permitan el adecuado conocimiento de esta Política y el compromiso por parte de todas las personas que tengan un vínculo académico, estudiantil y funcionario con la Universidad. TÍTULO VII. DE LA IMPLEMENTACIÓN, SEGUIMIENTO Y EVALUACIÓN La Vicerrectoría de Administración y Finanzas elaborará un Plan de Implementación para asegurar la operacionalización de sus objetivos y lineamientos, el cual deberá estructurarse en función de los objetivos estratégicos institucionales vigentes, formulando objetivos operativos, identificando responsables, plazos y recursos. Los recursos necesarios deben ser a signados en coherencia con la disponibilidad presupuestaria, garantizando la sustentabilidad institucional de corto, mediano y largo plazo. El Plan de Implementación se deberá incorporar al Cuadro de Mando Integrado vigente de la Universidad. Por tanto, el seguimiento o monitoreo se encontrará sujeto al Plan de Acción Anual de la unidad responsable y de todas aquellas unidades involucradas. El plazo máximo de vigencia de la Política será de 5 años, sin perjuicio de que se observe la necesidad de adecuación previo a este plazo.', '5 4. Diversificar la matriz de ingresos con el fin de fortalecer las condiciones materiales y financieras para el desarrollo de las distintas funciones institucionales. 5. Gestionar procesos de endeudamiento de manera eficiente, responsable y controlada, mediante el uso de pautas claras, mecanismos de evaluación y monitoreo permanente, que garanticen su alineación con los principios de sostenibilidad y con el sistema de aseguramiento de la calidad institucional. TÍTULO III. DE LAS DEFINICIONES 1. Endeudamiento: Son los ingresos provenientes de la utilización de créditos o empréstitos otorgados por el sist ema financiero nacional, tanto en moneda local y extranjera, y los compromisos derivados de las operaciones con proveedores nacionales y extranjeros. Además, se entiende como la capacidad que tiene la Universidad de La Frontera para contraer obligaciones internas o externas, de corto, mediano o largo plazo, a través de operaciones tendientes a la obtención de recursos y estará constituida por aquellos compromisos monetarios adquiridos por la institución derivados de obligaciones de pago a futuro o de empré stitos públicos internos o externos, sujetos a los reembolsos de acuerdo con las condiciones que se establezcan. Su capacidad de endeudamiento está también definida por las directrices contenidas en la ley de presupuestos del sector público, por su patrim onio, endeudamiento vigente y capacidad de flujo de pago. Las decisiones de endeudamiento deberán estar contenidas en las pautas de endeudamiento a ser aprobadas en forma conjunta con el presupuesto universitario o los ajustes al presupuesto. 1. Gestión económica y financiera: Proceso de planificación, control y toma de decisiones relacionadas con el uso eficiente de los recursos económicos y financieros de la Universidad. En el proceso de planificación, se establecen objetivos financieros a corto, mediano y largo plazo, desarrollando las estrategias para alcanzarlos, teniendo en cuenta los recursos disponibles y los riesgos potenciales. La gestión económica y financiera dependerá directamente y será responsabilidad de la gobernanza institucional, la cual estará centrada y articulada desde la Vicerrectoría de Administración y Finanzas. 2. Riesgo financiero: La probabilidad de ocurrencia de efectos adversos que impliquen operaciones financieras, las cuales impactan en un déficit presupuestario sostenido y/o patrimonial. El riesgo financiero está dado por pérdidas patrimoniales significativas, caídas permanentes en los flujos de ingresos, aumentos sostenidos en estructuras de gastos, entre otros. 3. Inversión: Referido a aquellos activos adquiridos o desarrollados por la Universidad, con el objetivo de generar ingresos o aumentar su patrimonio neto a largo plazo, los cuales se encuentren alineados con el quehacer institucional a través de lo declarado en su Plan Estratégico de Desarrollo. 4. Matriz de ingresos: Instrumento sistemático que permite identificar, clasificar, proyectar y evaluar las distintas fuentes de financiamiento institucional, asegurando su diversificación, sostenibilidad y coherencia con los objetivos estratégicos. Esta matriz incluye ingresos provenientes de fondos fiscales directos e indirectos, aranceles de pre y post grado, proyectos con financiamiento externo, convenios, prestación de servicios, asesorías, propiedad intelectual, formación continua, entre otros 5. Plan presupuestario: Corresponde a la estimación financiera de los ingresos y gastos de la Institución para su ejercicio anual, compatibilizando los recursos disponibles con el logro de metas y objetivos previamente establecidos. El plan presupuestario corresponde al instrumento de presupue sto de la institución el que permite planificar los recursos necesarios tanto en ingresos, gastos e inversión para el desarrollo de todas las actividades que la Institución realizará anualmente. Se debe cumplir con los aspectos legales y normativos vigentes, como es actualmente lo establecido en el Decreto N°180 de 1987 del', '4 informes de gestión de las instituciones de Educación Superior; Ley Nº 21.595 sobre delitos económicos; y, Ley Nº 20.393 que establece la responsabilidad penal de las personas jurídicas. b) En cuanto a la normativa interna: Resolución Exenta N° 0708 de fecha 1 6 de marzo de 2022 se aprobó la Misión de la Universidad de La Frontera; Resolución Exenta N° 0951 de fecha 29 de marzo de 2023 que aprobó Modelo Educativo de la Universidad de La Frontera; y, Resolución Exenta N°3851 de fecha 01 de diciembre de 2023 que a probó Plan Estratégico de Desarrollo Institucional PED2030 de la Universidad de La Frontera. 9. Que, esta Política Financiera se construye haciéndose cargos de la crisis financiera que ha afectado a la Universidad, configurándose como un instrumento que busc a no solo generar las directrices de su sistema financiero, sino también generar los compromisos institucionales para prevenir que situaciones de similar naturaleza vuelvan a ocurrir en el futuro. En tal sentido, la Política se articula de manera coherente con el Plan de Ajuste Institucional aprobado por la Universidad, recogiendo sus directrices y fortaleciendo los mecanismos de gobernanza, control presupuestario, diversificación de ingresos y gestión de riesgos, todos ellos orientados a resguardar la sostenibilidad económica y la viabilidad de largo plazo del proyecto universitario. 10. Que, el Acuerdo de Junta Directiva de la Universidad de La Frontera en Sesión ordinaria N°355 de fecha 22 de mayo de 2025, previo informe favorable del Consejo Académico N°298 de fecha 18 de julio de 2024, en orden de aprobar la Política Financiera de la Universidad de La Frontera. 11. Que, de conformidad a lo dispuesto en la Resolución N°36 de 2024 de la Contraloría General de la República sobre toma de razón, la presente resolución se encuentra exenta del trámite de toma de razón. 12. Que, la Dirección Jurídica de la Universidad de La Frontera, otorgó visto bueno a la presente política. R E S U E L V O: APRUEBASE POLÍTICA FINANCIERA DE LA UNIVERSIDAD DE LA FRONTERA, cuyo texto es el siguiente: POLÍTICA FINANCIERA DE LA UNIVERSIDAD DE LA FRONTERA TÍTULO I. DEL OBJETIVO GENERAL Establecer las directrices generales de sostenibilidad financiera de la institución, con el fin de asegurar y resguardar los recursos económicos nece sarios para el cumplimiento de su misión, viabilidad futura y cumplimiento legal y normativo vigente. TÍTULO II. DE LOS OBJETIVOS ESPECÍFICOS 1. Fortalecer el modelo de gobernanza que resguarde una eficiente gestión financiera, asegurando la toma de decisio nes informadas, participativas y alineadas con los principios institucionales de transparencia, rendición de cuentas y probidad. 2. Resguardar la sostenibilidad financiera de la institución a través de la implementación de procesos de planificación y control presupuestario, integrados a los instrumentos de gestión estratégica y al sistema de aseguramiento de la calidad institucional. 3. Desarrollar un sistema integral de gestión de riesgos financieros que identifique, evalúe y mitigue proactivamente los riesgos potenciales, asegurando la estabilidad financiera y minimizando posibles impactos adversos, en concordancia con los estándares del aseguramiento de la calidad.', 'Durante todo el procedimiento, la o el Fiscal podrá adoptar, con carácter preventivo, de oﬁcio, por solicitud escrita de la persona afectada o de la Coordinación de Acogida y seguimiento de Casos, alguna de las siguientes medidas cautelares con el objeto de garantizar la protección de las personas afectadas por las conductas que regula este reglamento. Dicha medida podrá ser modiﬁcada en caso de que se considere insuﬁciente o hayan variado las circunstancias que se tuvieron en vista al momento de decretarla. Estas medidas deberán resolverse de manera prevalente y en carácter de urgente y deberán ser coordinadas y consensuadas con las unidades administrativas y académicas que correspondan para su mejor implementación. En todo momento se debe resguardar la seguridad y la dignidad de la persona afectada, cautelándose – en la medida de lo posible- a no tener contacto directo con la persona denunciada. Recibida la denuncia por la o el ﬁscal, la solicitud de ellas ante otras autoridades no dará origen a la protección que establece este artículo. 01. De las medidas de protección de las y los funcionarios denunciantes. La o el Fiscal podrá disponer respecto de la persona denunciada: a) La separación física de espacios. b) El traslado de unidad, manteniendo sus remuneraciones y condiciones de trabajo. c) Suspensión de sus funciones en los términos previstos en el Estatuto Administrativo. d) Destinar transitoriamente a otro cargo dentro de la misma institución y ciudad, a la o los inculpados como medida preventiva, de conformidad al artículo 136 del Estatuto Administrativo. /gid00049/gid00162/gid00070/gid00072/gid00077/gid00064 /gid00019/gid00024 /gid00014 /gid00049/gid00133/gid00051/gid00051/gid00034/gid00039/gid00048/gid00001/gid00020/gid00128 /gid00037/gid00038/gid00001/gid00045/gid00034/gid00052 /gid00046/gid00038/gid00037/gid00042/gid00037/gid00034/gid00052 /gid00036/gid00034/gid00054/gid00053/gid00038/gid00045/gid00034/gid00051/gid00038/gid00052 /gid00034/gid00051/gid00053/gid00144/gid00036/gid00054/gid00045/gid00048/gid00001/gid00018/gid00025/gid00027/gid00001/gid00046/gid00068/gid00067/gid00072/gid00067/gid00064/gid00082/gid00001/gid00036/gid00064/gid00084/gid00083/gid00068/gid00075/gid00064/gid00081/gid00068/gid00082/gid00015 /gid00051/gid00068/gid00070/gid00075/gid00064/gid00076/gid00068/gid00077/gid00083/gid00078/gid00001/gid00067/gid00068 /gid00036/gid00078/gid00077/gid00085/gid00072/gid00085/gid00068/gid00077/gid00066/gid00072/gid00064/gid00001/gid00054/gid00077/gid00072/gid00085/gid00068/gid00081/gid00082/gid00072/gid00083/gid00064/gid00081/gid00072/gid00064']",La responsabilidad de aplicar la Política Financiera en su totalidad recae en la Vicerrectoría de Administración y Finanzas de la Universidad de La Frontera.,El Rector es la autoridad responsable de impulsar,1.0,,0.0,0.0
"Según la Política Financiera, ¿cuál es el plazo máximo de vigencia del documento?","['8 5. Gestión eficiente del endeudamiento: La Universidad, en su compromiso con una gestión financiera responsable y sostenible, contará con pautas anuales de endeudamiento, que permitan evaluar, autorizar y controlar el uso del crédito o de empréstitos como herramienta estratégica de financiamiento. Estas pautas deberán incluir criterios objetivos y límites definidos para la toma de deuda, tanto en términos de su monto, plazo, costo financiero y condiciones de pago, como de su impacto proyectado en la sostenibilidad institucional. La gestión del endeudamiento estará orientada a cubrir necesidades financieras justificadas, vinculadas a proyectos de inversión, infraestructura, crecimiento académico, innovación, capital de trabajo o cualquier iniciativa que contribuya directamente al cumplimiento de la Misión Institucional y a los d esafíos estratégicos priorizados en el Plan Estratégico de Desarrollo (PED). Cada decisión de endeudamiento deberá sustentarse en un análisis jurídico -legal y técnico- financiero riguroso que determine: \uf0b7 Las autorizaciones y directrices incorporadas en la Ley de Presupuestos del Sector Público y de la Dirección de Presupuestos. \uf0b7 La brecha institucional u oportunidad para cubrir; \uf0b7 El monto requerido y la fuente de financiamiento más adecuada; \uf0b7 Los plazos y condiciones del endeudamiento; \uf0b7 Y la capacidad efectiva de repago, considerando la proyección de flujos institucionales y márgenes de maniobra financiera. Adicionalmente, se establecerán mecanismos efectivos de control, monitoreo y rendición de cuentas, que incluyan revisiones periódicas del endeudamiento vige nte, alertas tempranas ante desviaciones críticas, y reportes institucionales sobre su evolución e impacto. Estos mecanismos deberán integrarse a los procesos de auditoría interna y a los sistemas de planificación presupuestaria, y de aseguramiento de la c alidad, a fin de asegurar una visión integral del comportamiento financiero de la Universidad. TÍTULO VI. DE LA DIFUSIÓN Y POSICIONAMIENTO La Universidad de La Frontera, a través de la Vicerrectoría de Administración y Finanzas, por medio de su Direcció n de Finanzas y en coordinación con la Dirección de Comunicaciones, desarrollará una estrategia comunicacional destinada a difundir, socializar y posicionar la Política Financiera en toda la comunidad universitaria. Con la colaboración de las direcciones, jefaturas, personas responsables de equipos y la comunidad universitaria en general, se realizarán acciones permanentes de difusión, socialización y comunicación que permitan el adecuado conocimiento de esta Política y el compromiso por parte de todas las personas que tengan un vínculo académico, estudiantil y funcionario con la Universidad. TÍTULO VII. DE LA IMPLEMENTACIÓN, SEGUIMIENTO Y EVALUACIÓN La Vicerrectoría de Administración y Finanzas elaborará un Plan de Implementación para asegurar la operacionalización de sus objetivos y lineamientos, el cual deberá estructurarse en función de los objetivos estratégicos institucionales vigentes, formulando objetivos operativos, identificando responsables, plazos y recursos. Los recursos necesarios deben ser a signados en coherencia con la disponibilidad presupuestaria, garantizando la sustentabilidad institucional de corto, mediano y largo plazo. El Plan de Implementación se deberá incorporar al Cuadro de Mando Integrado vigente de la Universidad. Por tanto, el seguimiento o monitoreo se encontrará sujeto al Plan de Acción Anual de la unidad responsable y de todas aquellas unidades involucradas. El plazo máximo de vigencia de la Política será de 5 años, sin perjuicio de que se observe la necesidad de adecuación previo a este plazo.', '5 4. Diversificar la matriz de ingresos con el fin de fortalecer las condiciones materiales y financieras para el desarrollo de las distintas funciones institucionales. 5. Gestionar procesos de endeudamiento de manera eficiente, responsable y controlada, mediante el uso de pautas claras, mecanismos de evaluación y monitoreo permanente, que garanticen su alineación con los principios de sostenibilidad y con el sistema de aseguramiento de la calidad institucional. TÍTULO III. DE LAS DEFINICIONES 1. Endeudamiento: Son los ingresos provenientes de la utilización de créditos o empréstitos otorgados por el sist ema financiero nacional, tanto en moneda local y extranjera, y los compromisos derivados de las operaciones con proveedores nacionales y extranjeros. Además, se entiende como la capacidad que tiene la Universidad de La Frontera para contraer obligaciones internas o externas, de corto, mediano o largo plazo, a través de operaciones tendientes a la obtención de recursos y estará constituida por aquellos compromisos monetarios adquiridos por la institución derivados de obligaciones de pago a futuro o de empré stitos públicos internos o externos, sujetos a los reembolsos de acuerdo con las condiciones que se establezcan. Su capacidad de endeudamiento está también definida por las directrices contenidas en la ley de presupuestos del sector público, por su patrim onio, endeudamiento vigente y capacidad de flujo de pago. Las decisiones de endeudamiento deberán estar contenidas en las pautas de endeudamiento a ser aprobadas en forma conjunta con el presupuesto universitario o los ajustes al presupuesto. 1. Gestión económica y financiera: Proceso de planificación, control y toma de decisiones relacionadas con el uso eficiente de los recursos económicos y financieros de la Universidad. En el proceso de planificación, se establecen objetivos financieros a corto, mediano y largo plazo, desarrollando las estrategias para alcanzarlos, teniendo en cuenta los recursos disponibles y los riesgos potenciales. La gestión económica y financiera dependerá directamente y será responsabilidad de la gobernanza institucional, la cual estará centrada y articulada desde la Vicerrectoría de Administración y Finanzas. 2. Riesgo financiero: La probabilidad de ocurrencia de efectos adversos que impliquen operaciones financieras, las cuales impactan en un déficit presupuestario sostenido y/o patrimonial. El riesgo financiero está dado por pérdidas patrimoniales significativas, caídas permanentes en los flujos de ingresos, aumentos sostenidos en estructuras de gastos, entre otros. 3. Inversión: Referido a aquellos activos adquiridos o desarrollados por la Universidad, con el objetivo de generar ingresos o aumentar su patrimonio neto a largo plazo, los cuales se encuentren alineados con el quehacer institucional a través de lo declarado en su Plan Estratégico de Desarrollo. 4. Matriz de ingresos: Instrumento sistemático que permite identificar, clasificar, proyectar y evaluar las distintas fuentes de financiamiento institucional, asegurando su diversificación, sostenibilidad y coherencia con los objetivos estratégicos. Esta matriz incluye ingresos provenientes de fondos fiscales directos e indirectos, aranceles de pre y post grado, proyectos con financiamiento externo, convenios, prestación de servicios, asesorías, propiedad intelectual, formación continua, entre otros 5. Plan presupuestario: Corresponde a la estimación financiera de los ingresos y gastos de la Institución para su ejercicio anual, compatibilizando los recursos disponibles con el logro de metas y objetivos previamente establecidos. El plan presupuestario corresponde al instrumento de presupue sto de la institución el que permite planificar los recursos necesarios tanto en ingresos, gastos e inversión para el desarrollo de todas las actividades que la Institución realizará anualmente. Se debe cumplir con los aspectos legales y normativos vigentes, como es actualmente lo establecido en el Decreto N°180 de 1987 del', '3 En una primera fase, se llevó a cabo un proceso de un diagnóstico sobre el ámbito financiero de la Universidad. Esta etapa contempló dos fases: - Recolección de información primaria a través de: a) Entrevistas semi estructuradas con actores e informantes clave internos e informantes clave externos, representantes de universidades e instituciones públicas y privadas. b) Realización de un conversatorio en que participaron decanos y vicerrectores. - Revisión del estado del arte, considerando información secundaria proveniente del análisis comparado de políticas financieras, donde se consult ó documentación correspondiente a diversas instituciones de educación superior tanto nacionales como internacionales, públicas y privadas, así como la revisión de la normativa interna. b) Etapa de Elaboración Entre noviembre de 2023 y mayo de 2024, la Co misión sesionó de manera regular, con el objeto de analizar y evaluar los hallazgos y resultados obtenidos en la etapa de diagnóstico, estableciendo su pertinencia para ser desarrollados e incluidos en esta Política, a la luz de la normativa universitaria y de la realidad institucional en esta materia. Para ello, las sesiones de trabajo se estructuraron en torno al análisis de temas seleccionados, informes expositivos, y su posterior discusión y acuerdos. Los primeros avances de esta etapa fueron la defini ción del objetivo general y los objetivos específicos, factores rectores de este instrumento de gestión. Luego de aprobados estos objetivos, se establecieron los principios formativos y definiciones que tuvieran un carácter esencial en la proyección de la Política. En la definición de principios formativos se buscó que no se reiterasen aquellos establecidos en las leyes de Educación Superior que regulan a la Institución, sino a reconocer aquellos que resultaran relevantes y preeminentes en la implementación de este instrumento. Por último, se desarrollaron las directrices de esta política, entendidas como los requerimientos o mandatos acerca de los aspectos financieros relevantes que se deben gestionar e implementar de modo prioritario. Estas directrices f ueron trabajadas con el fin de responder de manera consistente al objetivo general y específicos, en el marco de los principios formativos de esta Política. c) Validación La Comisión determinó la realización de una consulta participativa que involucró a la comunidad universitaria, en sus estamentos académico y administrativo, quienes entregaron su parecer respecto a los principales elementos y propuestas de este documento. Esta instancia se llevó a cabo durante el mes de mayo de 2024 y tuvo por resultado 5 33 respuestas, con una evaluación satisfactoria de un 87,7%. A partir de la retroalimentación recibida se realizaron ajustes que mejoraron la propuesta. De manera complementaria, el día 10 de junio de 2024, este documento fue presentada ante el Comité de Rectoría, recibiendo retroalimentación que genero nuevos ajustes. El resultado de este proceso concluyó en la versión que sería presentada ante los cuerpos colegiados institucionales. 8. Que, en lo referido al marco normativo, se han considerado los instrumentos jurídicos que a continuación se indican: a) En cuanto a la normativa nacional: Ley N°20.129 que Establece un Sistema Nacional de Aseguramiento de la Calidad de la Educación Superior; Ley N°21.091 sobre Educación Superior; Ley N°21.094 sobre Univer sidades Estatales; Criterios y Estándares de Calidad para la Acreditación Institucional del Subsistema Universitario de la Comisión Nacional de Acreditación (CNA), Ley N° 20.370 General de Educación; Ley N°21.640 sobre presupuesto del sector público corres pondiente al año 2024, D.F.L. N°156 de 1981 del MINEDUC que aprueba Estatuto de la Universidad de La Frontera; Decreto N°180 de 1987 del Ministerio de Hacienda que fija norma para la presentación de presupuestos, balance de ejecución presupuestaria e', '4 informes de gestión de las instituciones de Educación Superior; Ley Nº 21.595 sobre delitos económicos; y, Ley Nº 20.393 que establece la responsabilidad penal de las personas jurídicas. b) En cuanto a la normativa interna: Resolución Exenta N° 0708 de fecha 1 6 de marzo de 2022 se aprobó la Misión de la Universidad de La Frontera; Resolución Exenta N° 0951 de fecha 29 de marzo de 2023 que aprobó Modelo Educativo de la Universidad de La Frontera; y, Resolución Exenta N°3851 de fecha 01 de diciembre de 2023 que a probó Plan Estratégico de Desarrollo Institucional PED2030 de la Universidad de La Frontera. 9. Que, esta Política Financiera se construye haciéndose cargos de la crisis financiera que ha afectado a la Universidad, configurándose como un instrumento que busc a no solo generar las directrices de su sistema financiero, sino también generar los compromisos institucionales para prevenir que situaciones de similar naturaleza vuelvan a ocurrir en el futuro. En tal sentido, la Política se articula de manera coherente con el Plan de Ajuste Institucional aprobado por la Universidad, recogiendo sus directrices y fortaleciendo los mecanismos de gobernanza, control presupuestario, diversificación de ingresos y gestión de riesgos, todos ellos orientados a resguardar la sostenibilidad económica y la viabilidad de largo plazo del proyecto universitario. 10. Que, el Acuerdo de Junta Directiva de la Universidad de La Frontera en Sesión ordinaria N°355 de fecha 22 de mayo de 2025, previo informe favorable del Consejo Académico N°298 de fecha 18 de julio de 2024, en orden de aprobar la Política Financiera de la Universidad de La Frontera. 11. Que, de conformidad a lo dispuesto en la Resolución N°36 de 2024 de la Contraloría General de la República sobre toma de razón, la presente resolución se encuentra exenta del trámite de toma de razón. 12. Que, la Dirección Jurídica de la Universidad de La Frontera, otorgó visto bueno a la presente política. R E S U E L V O: APRUEBASE POLÍTICA FINANCIERA DE LA UNIVERSIDAD DE LA FRONTERA, cuyo texto es el siguiente: POLÍTICA FINANCIERA DE LA UNIVERSIDAD DE LA FRONTERA TÍTULO I. DEL OBJETIVO GENERAL Establecer las directrices generales de sostenibilidad financiera de la institución, con el fin de asegurar y resguardar los recursos económicos nece sarios para el cumplimiento de su misión, viabilidad futura y cumplimiento legal y normativo vigente. TÍTULO II. DE LOS OBJETIVOS ESPECÍFICOS 1. Fortalecer el modelo de gobernanza que resguarde una eficiente gestión financiera, asegurando la toma de decisio nes informadas, participativas y alineadas con los principios institucionales de transparencia, rendición de cuentas y probidad. 2. Resguardar la sostenibilidad financiera de la institución a través de la implementación de procesos de planificación y control presupuestario, integrados a los instrumentos de gestión estratégica y al sistema de aseguramiento de la calidad institucional. 3. Desarrollar un sistema integral de gestión de riesgos financieros que identifique, evalúe y mitigue proactivamente los riesgos potenciales, asegurando la estabilidad financiera y minimizando posibles impactos adversos, en concordancia con los estándares del aseguramiento de la calidad.']","Según la Política Financiera de la Universidad de La Frontera, el plazo máximo de vigencia del documento es de 5 años.",El plazo máximo de vigencia de la Política será de 5 años,1.0,,0.9999999999,1.0
¿Cuál es uno de los propósitos centrales de la Política de Igualdad y Equidad de Género de la UFRO?,"['\x17 17. Cabe señalar que el proceso puso énfasis en el trabajo deliberativo, particip ativo, público y triestamental, siendo todas las instancias convocadas y coordinadas por el equipo profesional de la Dirección de Equidad de Género. La Comisión y las subco misiones programaron audienci as con instancias institucionales y especialistas en temas jurídicos, de género e institucionales para complementar la información recogida en el diagnóstico. Luego se abocó a elaborar la contextuali zación sociopolítica del Preámbulo, así como los Principios, Lineamientos Es tratégicos, Difusión e Implementación de la propuesta de Política de Igualdad y Equidad de Género. Cabe señalar que al realizarse una votación en la Comisión respecto de los 11 princi pios que debía contener la Política, los rangos de aprobación fluctuaron entre un 96% y un 100%; e n t a n t o e n l a s d i r e c t r i c e s , d i c h o s r a n g o s oscilaron entre un 76,9% y un 92,6%. 18. Que, la etapa de validación, las personas integrantes de la Comisión De liberativa contaron con los tiempos y facilidades para poder socializar con sus bases cada una de las propuestas de contenido. 19. Luego de contar con las respectivas observaciones y ajustes, la Dirección de Equidad de Género y la Comisión Deliberativa invitaron a la comunidad universitaria a una sesión abierta, p a r t i c i p a t i v a y t r i estamental para recibir observaciones, sugerencias y propuestas. En la sesión realizada con fecha 29 de septiembre del 2021 participaron 108 personas, correspon diendo éstas a 80 mujeres y 28 hombres de diferentes estamentos de la Universidad. Quienes pa rticiparon de la sesión relevaron la Política de Igualdad y Equidad de Género de la Universidad para la comunidad local, regional y nacional, valorando que su elaboración fue conside rando a los tres estamentos en instancias participativas, además de destacar la incorporación de los ámbit os intercultural e interseccional en sus principios y lineamientos estratégicos. Así también se destacó que la Política de Igualdad y Equidad de Género acogiera las demandas de igualdad y equidad de género de la comunidad universitaria, además de alinearse con los requerimientos normativos nacionales e internacionales. 20. Que, en consecuencia, el presente instrumento tiene por objeto resp onder, en el espacio universitar io, a la desigualdad entre hombres, mujeres y otras identidades de gé nero por causa de diferentes fenómenos sociopolíticos y culturales, a fin de establecer mecanismos de equidad que permitan superar esta brecha en el plano institucional. 21. El acuerdo de la H. Junta Directiva en sesión extraordinaria Nº 226 del 13 de septiembre de 2022, previo informe favorable del Consejo Académico en sesión extraordinar io Nº282 de fecha 15 de di ciembre de 2021, en orden de aprobar la Política de Igualdad y Equidad de Género. 22. Que, la Dirección Jurídica de la universidad de La Frontera, otorgó visto bueno a la presente política. RESUELVO : APRUEBASE la Política de Igualdad y Equidad de Género de la Universidad de La Frontera , cuyo contenido es el siguiente: TITULO I. DEL OBJETIVO GENERAL DE LA POLÍTICA DE IGUALDAD Y EQUIDAD DE GÉNERO Establecer orientaciones estratégicas y directrices que permitan alcanzar una cultura de igualdad y equidad degénero en todos los ámbitos de la gestión y actividad universitaria,con el fin de construir una universidad libre de exclusiones, discriminaciones, violencias y brechas de género, en el marco del respeto de los derechos fundamentales de las personas que integran la Universidad de La Fr ontera, con independencia de su estamento y calidad contractual y dar cumplimiento a lo requerido por el artículo 3 de la Ley 21.369 en cuanto a que la Universidad deberá contar con un ap o l í t i c a i n t e g r a l c o n t r a e l a c o s o s e x u a l , l a violencia y la discriminación de género.', '2 Superior, proponer las políticas para la educación superior y coordinar a los órganos del Estado que componen el Sistema”, debiendo para tales efectos, que las Universidades cuenten con directrices que permitan la elaboración e implementación de políticas propias de su quehacer universitario. 5. Que, por Resolución Exenta N°4013 de fecha 14 de diciembre de 2023, se aprobó el Protocolo de Gestión de Políticas Institucionales de la Universidad de La Frontera, el cual tuvo por obje to regular el ciclo de vida de las políticas institucionales mediante un instrumento que otorgue procesos homogéneos en concordancia con la normativa nacional en Educación Superior. 6. Que, en cuanto a los antecedentes que motivan esta Política: En este con texto normativo para las Instituciones de Educación Superior, en el cual existen nuevas exigencias en materias financieras, aumento de sistemas de control, así como los nuevos criterios de acreditación institucional, surge la necesidad de contar con una Po lítica Financiera para la Universidad de La Frontera. Lo anterior, argumentado en los procedimientos y requerimientos para generar las autorizaciones para los procesos de tramitación de endeudamientos, sean estos de corto, mediano o largo plazo. Por otra p arte, la necesidad de contar con procesos de control más rigurosos, de manera de dar cumplimiento a las exigencias del nuevo marco legal y normativo, como lo es la Ley de delitos económicos, lavado de activos y de financiamiento del terrorismo. En el mismo sentido, la necesidad de contar con procedimientos actualizados y pertinentes a la realidad actual Universitaria y de financiamiento del sistema de educación superior, motivo por el cual se requiere contar con un reglamento conocido y transparente sobre la elaboración, ejecución y control del presupuesto universitario que, de cuenta de las necesidades de financiamiento de todo el quehacer universitario, y que vele por la sostenibilidad presente y futura. En función de este mandato, además de la propia naturaleza de las políticas institucionales, como reflejo de la cultura y valores de la Institución, es relevante considerar la participación como un eje transversal al ciclo de vida de las políticas institucionales. En función de la creación de nuevos en tes fiscalizadores como lo es la Superintendencia de Educación Superior y las actuales atribuciones tanto de la Subsecretaría de Educación Superior como de la Contraloría General de la República en relación a las instituciones de educación superior, se norma la rendición de cuentas de la gestión financiera de este tipo de instituciones. Además, se suma la definición de nuevos criterios y estándares para la acreditación institucional por parte de la CNA, que incorpora la dimensión Gestión Estratégica y Recur sos Institucionales con fines de asegurar la sostenibilidad del proyecto. 7. Que, en cuanto al proceso general de elaboración de la Política y en conformidad a las directrices institucionales, este proceso se ordenó en tres etapas fundamentales: diagnóstico, elaboración y validación: a) Etapa de Diagnóstico La construcción de esta política fue iniciada por la Vicerrectoría de Administración y Finanzas mediante ordinario N°198/3010 de fecha 16 de noviembre de 2023, en que se solicitó formalizar la Comisión pa ra la Elaboración de la Política Financiera de la Universidad de La Frontera (en adelante también “la Comisión”) y de la Secretaría Técnica a tal efecto. Esta Comisión estuvo compuesta por representantes de diversos estamentos universitarios, unidades rela cionadas al área financiera, Dirección Jurídica, facultades, y las asociaciones gremiales académica y administrativa. En consecuencia, por Resolución Exenta N°3866 de fecha 04 de diciembre de 2023 se designaron sus integrantes, lo que fue complementado por Resolución Exenta N°4066 de fecha 19 de diciembre de 2023. La Comisión para la Elaboración de la Política Financiera comenzó a sesionar con fecha 27 de noviembre de 2023.', '\x16 Resolución Exenta N°1400 de fecha 12 de ag osto de 2021, que designó integrantes de la Comisión de elaboración de la propuesta de Política de Género de la Universidad de La Frontera y, asimismo, mediante la creación de unidades especi alizadas y la elaboración de procedimientos sobre esta materia que se indican en los considerandos 3° al 7° del presente acto administrativo. 11. Que, para tales efectos, la Universidad encomendó a la Dirección de Equidad de Género el proceso de elaboración y diseño de una propuesta de Política de Igualdad y Equidad de Gé nero, en el marco de su funciones, atendido el artículo 2 letra a) de la Resolución Exen ta N°0813 de 2019 que comprende como tal, el “Proponer a las auto ridades y organismos correspondi entes, políticas, planes, normativas y medidas orientadas al fortalecimiento de la institucionalidad para alcanzar la equidad de género en la Universidad de La Frontera”. 12. Que, se dispuso de un proceso general para la elaboración e implementación de la propuesta de Política de Igualdad y Equidad de Género, conformado por una etapa de diseño y elaboración; etapa de difusión y posicionamiento; y etapa de implementación, seguimiento y evaluación, correspondiendo el presente acto administrativo a la primera de ellas. En este sentido, la etapa de diseño y elaboración de la Política de Igualdad y Equidad de Género se conforma de una etapa de diagnóstico; una etapa de elaboración; y, una etapa de validación, las cuales fueron previas a su presentación a los cuerpos colegiados de la Universidad. 13. Que, la etapa de diagnóstico comprendió un estudio el cual fue presentado al Comité Étic o Científico de la Universidad con fecha 08 de noviembre de 2019, quien evacuó con fecha 08 de enero de 2020 el Acta de Evaluación N°001_20 del Protocolo de Investigación, el que permitió desarrollarlo con los estándares éticos ym e t o d o l ó g i c o s . E l d i s e ñ o m e t o d o l ó g i c o f u e d e c arácter mixto, es decir, cuantitativo y cualitativo. Los resultados del Diagnóstico de Situ ación y Relaciones de Género fueron dados a conocer públicamente el 22 de di ciembre de 2020 y se encuentran disponibles desde esa fecha en el sitio web de la Universidad. 14. Que, la etapa de elaboración se desarrolló mediante una propuesta llevada a cabo por el equipo profesional de la Dirección de Equidad de Género en atención a los resultados otorgados en la etapa de diagnóstico. Tal propuesta fue presentada a una Comisión Técnica Asesora, coordinada por la Directora de Equidad de Género, y en la cual participaron la Dra. Antonia Santos Pérez, Presidenta de la Comisión de Igualdad de Género del CRUCH; Mg. Natalia Caniguan Velarde, Directora del Instituto de Estudios Indígenas e Intercultural es y la abogada Ruth Aedo San Martin, abogada de la Dirección Jurídica de la Universid ad. Dicha comisión entr egó orientaciones para desarrollar el proceso deliberativo de la Política de Igualdad y Equidad de Género de la Universidad. 15. Asimismo, la Dirección de Equidad de Género convocó a estructuras y organizaci ones de los estamentos de la comunidad universitaria, de distintas Facultades, Campus e Institutos y Organizaciones reconocidas por la Universidad para conformar la Comisión Delibe rativa Triestamental, sumándose a este trabajo deliberativo, el Consejo Asesor de la Dirección de Equidad de Género. 16. La Comisión fue constituida con fecha 30 de marzo del 2021 en sesión pública, virtual y abierta. Luego de ell o, las 36 personas participantes de la Comisión se organizaron en siete subcomisiones: Institucionalización de la perspectiva de género en la gestión univ ersitaria; Participació n, liderazgo y gobierno universitario con perspectiva de género; Condiciones laboral es y académicas con perspectiva de género; Universidad libre de discriminaci ones y violencias de género; Gé nero, pueblos originarios e interculturalidad; Transversalidad de gén ero en procesos de form ación, docencia e investigación; Corresponsabilidad y conciliación de la vida pe rsonal, familiar, académica y laboral.', '\x14\x13 Será responsabilidad de esta DIRECCIÓN , generar y coordinar instancias participativas y de revisión de reglamentos y procedimientos con las diferentes estructuras y/o unidades académicas y administrativas pertinentes. Así también, esta Dirección generará y coordinar á acciones que, a partir de la evidencia entregada por el Diagnóstico de Situación y Relaciones de Género y otras fuentes de información oficiales, permitan desarroll ar propuestas validadas por las autoridades responsables de las distintas unidades. E stas propuestas permitirán generar normas e instrumentos que hagan efectiva la implementación de la Política y del Plan. La implementación de la Política será eval uada mediante procedimientos públicos y participativos cada cinco años, contando e ste periodo a partir de la creación e implementación del Plan de Igualdad y Equi dad de Género, lo que será puesto en conocimiento del órgano colegiado superior de l a U n i v e r s i d a d . A s i m i s m o , s e e s t a b l e c e r á u n procedimiento de seguimiento e hitos anuales de monitoreo de ambos instrumentos, con participación triestamental representada por el Consejo Asesor de la Dirección de Equidad de Género. Si durante algunos de los hitos anu ales de monitoreo se observa incumplimiento sustantivo del Plan de Igualdad y Equidad de Género, el Consejo Asesor de la Dirección de Equidad de Género, podrá solicitar reducir el periodo de evaluación a tres años, mediante solicitud fundada dirigida al Rector o Rectora. TITULO VII. DE LA SOCIALIZACIÓN, COMU NICACIÓN Y POSICIONAMIENTO DE LA POLÍTICA DE IGUALDAD Y EQUIDAD DE GÉNERO. La Universidad de La Frontera, a través de la Dirección de Equidad de Género, en coordinación con la Dirección de Comunicaciones, desarrollará una estrategia comunicacional destinada a difundir, socializar y posicionar la Política de Igualdad y Equidad de Género en toda la comunidad universitaria. Con la colaboración de las di recciones, jefaturas, personas responsables de equipos y la comunidad universitaria en general, se realizarán acciones permanentes de difusión, socialización y comunicación que permitan el adecuado conocimiento de esta Política y el compromiso por parte de todas las personas que t engan un vínculo estudiantil y funcionario con la Universidad. TÍTULO VIII. MARCO NORMATIVO : La Universidad de La Frontera enmarca su Política de Igualdad y Equidad de Género en la normativa legal vigente y su nor mativa interna, entre ellas: /g520La Declaración Universal de Derechos Humanos de 1948. /g520Declaración de la Naciones Unidas sobre los Derechos de Los Pueblos Indígenas del 2007 /g520La Convención Americana sobre Derechos Humanos (Pacto de San José). /g520Declaración Americana sobre los Derechos de Los Pueblos Indígenas de 2016. /g520La Convención sobre la Eliminación de todas las formas de Discriminación contra la Mujer - CEDAW (1979) ratificada por Chile en 1989, cuyo protocolo facultativo fue aprobado por el Congreso Nacional de Chile en 2019 y publicado en el Diario Oficial en marzo de 2020. /g520El Convenio 169 de la OIT (1989) sobre Pueblos Indígenas y Tribales en Países Independientes, ratificado por Chile en 2009. • La Convención Interamericana para prevenir, s ancionar y erradicar la violencia contra la mujer (Convención de Belem do Pará) de 1995, ratificada por Chile en 1996. Normativa nacional: • La Constitución Política de la República de Chile. /g520El artículo 52 de la Ley 18.575 Orgánica Constitucional de Bases Generales de la']","Uno de los propósitos centrales de la Política de Igualdad y Equidad de Género de la Universidad de La Frontera (UFRO) es establecer orientaciones estratégicas y directrices que permitan alcanzar una cultura de igualdad y equidad de género en todos los ámbitos de la gestión y actividad universitaria, con el fin de construir una universidad libre de exclusiones, discriminaciones, violencias y brechas de género, respetando los derechos fundamentales de todas las personas que integran la universidad.",Uno de los propósitos centrales es implementar acciones para prevenir,1.0,,0.8055555555287036,1.0
¿Qué rol juega la Dirección de Equidad de Género (DEG) en la aplicación de esta Política?,"['\x17 17. Cabe señalar que el proceso puso énfasis en el trabajo deliberativo, particip ativo, público y triestamental, siendo todas las instancias convocadas y coordinadas por el equipo profesional de la Dirección de Equidad de Género. La Comisión y las subco misiones programaron audienci as con instancias institucionales y especialistas en temas jurídicos, de género e institucionales para complementar la información recogida en el diagnóstico. Luego se abocó a elaborar la contextuali zación sociopolítica del Preámbulo, así como los Principios, Lineamientos Es tratégicos, Difusión e Implementación de la propuesta de Política de Igualdad y Equidad de Género. Cabe señalar que al realizarse una votación en la Comisión respecto de los 11 princi pios que debía contener la Política, los rangos de aprobación fluctuaron entre un 96% y un 100%; e n t a n t o e n l a s d i r e c t r i c e s , d i c h o s r a n g o s oscilaron entre un 76,9% y un 92,6%. 18. Que, la etapa de validación, las personas integrantes de la Comisión De liberativa contaron con los tiempos y facilidades para poder socializar con sus bases cada una de las propuestas de contenido. 19. Luego de contar con las respectivas observaciones y ajustes, la Dirección de Equidad de Género y la Comisión Deliberativa invitaron a la comunidad universitaria a una sesión abierta, p a r t i c i p a t i v a y t r i estamental para recibir observaciones, sugerencias y propuestas. En la sesión realizada con fecha 29 de septiembre del 2021 participaron 108 personas, correspon diendo éstas a 80 mujeres y 28 hombres de diferentes estamentos de la Universidad. Quienes pa rticiparon de la sesión relevaron la Política de Igualdad y Equidad de Género de la Universidad para la comunidad local, regional y nacional, valorando que su elaboración fue conside rando a los tres estamentos en instancias participativas, además de destacar la incorporación de los ámbit os intercultural e interseccional en sus principios y lineamientos estratégicos. Así también se destacó que la Política de Igualdad y Equidad de Género acogiera las demandas de igualdad y equidad de género de la comunidad universitaria, además de alinearse con los requerimientos normativos nacionales e internacionales. 20. Que, en consecuencia, el presente instrumento tiene por objeto resp onder, en el espacio universitar io, a la desigualdad entre hombres, mujeres y otras identidades de gé nero por causa de diferentes fenómenos sociopolíticos y culturales, a fin de establecer mecanismos de equidad que permitan superar esta brecha en el plano institucional. 21. El acuerdo de la H. Junta Directiva en sesión extraordinaria Nº 226 del 13 de septiembre de 2022, previo informe favorable del Consejo Académico en sesión extraordinar io Nº282 de fecha 15 de di ciembre de 2021, en orden de aprobar la Política de Igualdad y Equidad de Género. 22. Que, la Dirección Jurídica de la universidad de La Frontera, otorgó visto bueno a la presente política. RESUELVO : APRUEBASE la Política de Igualdad y Equidad de Género de la Universidad de La Frontera , cuyo contenido es el siguiente: TITULO I. DEL OBJETIVO GENERAL DE LA POLÍTICA DE IGUALDAD Y EQUIDAD DE GÉNERO Establecer orientaciones estratégicas y directrices que permitan alcanzar una cultura de igualdad y equidad degénero en todos los ámbitos de la gestión y actividad universitaria,con el fin de construir una universidad libre de exclusiones, discriminaciones, violencias y brechas de género, en el marco del respeto de los derechos fundamentales de las personas que integran la Universidad de La Fr ontera, con independencia de su estamento y calidad contractual y dar cumplimiento a lo requerido por el artículo 3 de la Ley 21.369 en cuanto a que la Universidad deberá contar con un ap o l í t i c a i n t e g r a l c o n t r a e l a c o s o s e x u a l , l a violencia y la discriminación de género.', '\x16 Resolución Exenta N°1400 de fecha 12 de ag osto de 2021, que designó integrantes de la Comisión de elaboración de la propuesta de Política de Género de la Universidad de La Frontera y, asimismo, mediante la creación de unidades especi alizadas y la elaboración de procedimientos sobre esta materia que se indican en los considerandos 3° al 7° del presente acto administrativo. 11. Que, para tales efectos, la Universidad encomendó a la Dirección de Equidad de Género el proceso de elaboración y diseño de una propuesta de Política de Igualdad y Equidad de Gé nero, en el marco de su funciones, atendido el artículo 2 letra a) de la Resolución Exen ta N°0813 de 2019 que comprende como tal, el “Proponer a las auto ridades y organismos correspondi entes, políticas, planes, normativas y medidas orientadas al fortalecimiento de la institucionalidad para alcanzar la equidad de género en la Universidad de La Frontera”. 12. Que, se dispuso de un proceso general para la elaboración e implementación de la propuesta de Política de Igualdad y Equidad de Género, conformado por una etapa de diseño y elaboración; etapa de difusión y posicionamiento; y etapa de implementación, seguimiento y evaluación, correspondiendo el presente acto administrativo a la primera de ellas. En este sentido, la etapa de diseño y elaboración de la Política de Igualdad y Equidad de Género se conforma de una etapa de diagnóstico; una etapa de elaboración; y, una etapa de validación, las cuales fueron previas a su presentación a los cuerpos colegiados de la Universidad. 13. Que, la etapa de diagnóstico comprendió un estudio el cual fue presentado al Comité Étic o Científico de la Universidad con fecha 08 de noviembre de 2019, quien evacuó con fecha 08 de enero de 2020 el Acta de Evaluación N°001_20 del Protocolo de Investigación, el que permitió desarrollarlo con los estándares éticos ym e t o d o l ó g i c o s . E l d i s e ñ o m e t o d o l ó g i c o f u e d e c arácter mixto, es decir, cuantitativo y cualitativo. Los resultados del Diagnóstico de Situ ación y Relaciones de Género fueron dados a conocer públicamente el 22 de di ciembre de 2020 y se encuentran disponibles desde esa fecha en el sitio web de la Universidad. 14. Que, la etapa de elaboración se desarrolló mediante una propuesta llevada a cabo por el equipo profesional de la Dirección de Equidad de Género en atención a los resultados otorgados en la etapa de diagnóstico. Tal propuesta fue presentada a una Comisión Técnica Asesora, coordinada por la Directora de Equidad de Género, y en la cual participaron la Dra. Antonia Santos Pérez, Presidenta de la Comisión de Igualdad de Género del CRUCH; Mg. Natalia Caniguan Velarde, Directora del Instituto de Estudios Indígenas e Intercultural es y la abogada Ruth Aedo San Martin, abogada de la Dirección Jurídica de la Universid ad. Dicha comisión entr egó orientaciones para desarrollar el proceso deliberativo de la Política de Igualdad y Equidad de Género de la Universidad. 15. Asimismo, la Dirección de Equidad de Género convocó a estructuras y organizaci ones de los estamentos de la comunidad universitaria, de distintas Facultades, Campus e Institutos y Organizaciones reconocidas por la Universidad para conformar la Comisión Delibe rativa Triestamental, sumándose a este trabajo deliberativo, el Consejo Asesor de la Dirección de Equidad de Género. 16. La Comisión fue constituida con fecha 30 de marzo del 2021 en sesión pública, virtual y abierta. Luego de ell o, las 36 personas participantes de la Comisión se organizaron en siete subcomisiones: Institucionalización de la perspectiva de género en la gestión univ ersitaria; Participació n, liderazgo y gobierno universitario con perspectiva de género; Condiciones laboral es y académicas con perspectiva de género; Universidad libre de discriminaci ones y violencias de género; Gé nero, pueblos originarios e interculturalidad; Transversalidad de gén ero en procesos de form ación, docencia e investigación; Corresponsabilidad y conciliación de la vida pe rsonal, familiar, académica y laboral.', '2 Superior, proponer las políticas para la educación superior y coordinar a los órganos del Estado que componen el Sistema”, debiendo para tales efectos, que las Universidades cuenten con directrices que permitan la elaboración e implementación de políticas propias de su quehacer universitario. 5. Que, por Resolución Exenta N°4013 de fecha 14 de diciembre de 2023, se aprobó el Protocolo de Gestión de Políticas Institucionales de la Universidad de La Frontera, el cual tuvo por obje to regular el ciclo de vida de las políticas institucionales mediante un instrumento que otorgue procesos homogéneos en concordancia con la normativa nacional en Educación Superior. 6. Que, en cuanto a los antecedentes que motivan esta Política: En este con texto normativo para las Instituciones de Educación Superior, en el cual existen nuevas exigencias en materias financieras, aumento de sistemas de control, así como los nuevos criterios de acreditación institucional, surge la necesidad de contar con una Po lítica Financiera para la Universidad de La Frontera. Lo anterior, argumentado en los procedimientos y requerimientos para generar las autorizaciones para los procesos de tramitación de endeudamientos, sean estos de corto, mediano o largo plazo. Por otra p arte, la necesidad de contar con procesos de control más rigurosos, de manera de dar cumplimiento a las exigencias del nuevo marco legal y normativo, como lo es la Ley de delitos económicos, lavado de activos y de financiamiento del terrorismo. En el mismo sentido, la necesidad de contar con procedimientos actualizados y pertinentes a la realidad actual Universitaria y de financiamiento del sistema de educación superior, motivo por el cual se requiere contar con un reglamento conocido y transparente sobre la elaboración, ejecución y control del presupuesto universitario que, de cuenta de las necesidades de financiamiento de todo el quehacer universitario, y que vele por la sostenibilidad presente y futura. En función de este mandato, además de la propia naturaleza de las políticas institucionales, como reflejo de la cultura y valores de la Institución, es relevante considerar la participación como un eje transversal al ciclo de vida de las políticas institucionales. En función de la creación de nuevos en tes fiscalizadores como lo es la Superintendencia de Educación Superior y las actuales atribuciones tanto de la Subsecretaría de Educación Superior como de la Contraloría General de la República en relación a las instituciones de educación superior, se norma la rendición de cuentas de la gestión financiera de este tipo de instituciones. Además, se suma la definición de nuevos criterios y estándares para la acreditación institucional por parte de la CNA, que incorpora la dimensión Gestión Estratégica y Recur sos Institucionales con fines de asegurar la sostenibilidad del proyecto. 7. Que, en cuanto al proceso general de elaboración de la Política y en conformidad a las directrices institucionales, este proceso se ordenó en tres etapas fundamentales: diagnóstico, elaboración y validación: a) Etapa de Diagnóstico La construcción de esta política fue iniciada por la Vicerrectoría de Administración y Finanzas mediante ordinario N°198/3010 de fecha 16 de noviembre de 2023, en que se solicitó formalizar la Comisión pa ra la Elaboración de la Política Financiera de la Universidad de La Frontera (en adelante también “la Comisión”) y de la Secretaría Técnica a tal efecto. Esta Comisión estuvo compuesta por representantes de diversos estamentos universitarios, unidades rela cionadas al área financiera, Dirección Jurídica, facultades, y las asociaciones gremiales académica y administrativa. En consecuencia, por Resolución Exenta N°3866 de fecha 04 de diciembre de 2023 se designaron sus integrantes, lo que fue complementado por Resolución Exenta N°4066 de fecha 19 de diciembre de 2023. La Comisión para la Elaboración de la Política Financiera comenzó a sesionar con fecha 27 de noviembre de 2023.', '\x14\x13 Será responsabilidad de esta DIRECCIÓN , generar y coordinar instancias participativas y de revisión de reglamentos y procedimientos con las diferentes estructuras y/o unidades académicas y administrativas pertinentes. Así también, esta Dirección generará y coordinar á acciones que, a partir de la evidencia entregada por el Diagnóstico de Situación y Relaciones de Género y otras fuentes de información oficiales, permitan desarroll ar propuestas validadas por las autoridades responsables de las distintas unidades. E stas propuestas permitirán generar normas e instrumentos que hagan efectiva la implementación de la Política y del Plan. La implementación de la Política será eval uada mediante procedimientos públicos y participativos cada cinco años, contando e ste periodo a partir de la creación e implementación del Plan de Igualdad y Equi dad de Género, lo que será puesto en conocimiento del órgano colegiado superior de l a U n i v e r s i d a d . A s i m i s m o , s e e s t a b l e c e r á u n procedimiento de seguimiento e hitos anuales de monitoreo de ambos instrumentos, con participación triestamental representada por el Consejo Asesor de la Dirección de Equidad de Género. Si durante algunos de los hitos anu ales de monitoreo se observa incumplimiento sustantivo del Plan de Igualdad y Equidad de Género, el Consejo Asesor de la Dirección de Equidad de Género, podrá solicitar reducir el periodo de evaluación a tres años, mediante solicitud fundada dirigida al Rector o Rectora. TITULO VII. DE LA SOCIALIZACIÓN, COMU NICACIÓN Y POSICIONAMIENTO DE LA POLÍTICA DE IGUALDAD Y EQUIDAD DE GÉNERO. La Universidad de La Frontera, a través de la Dirección de Equidad de Género, en coordinación con la Dirección de Comunicaciones, desarrollará una estrategia comunicacional destinada a difundir, socializar y posicionar la Política de Igualdad y Equidad de Género en toda la comunidad universitaria. Con la colaboración de las di recciones, jefaturas, personas responsables de equipos y la comunidad universitaria en general, se realizarán acciones permanentes de difusión, socialización y comunicación que permitan el adecuado conocimiento de esta Política y el compromiso por parte de todas las personas que t engan un vínculo estudiantil y funcionario con la Universidad. TÍTULO VIII. MARCO NORMATIVO : La Universidad de La Frontera enmarca su Política de Igualdad y Equidad de Género en la normativa legal vigente y su nor mativa interna, entre ellas: /g520La Declaración Universal de Derechos Humanos de 1948. /g520Declaración de la Naciones Unidas sobre los Derechos de Los Pueblos Indígenas del 2007 /g520La Convención Americana sobre Derechos Humanos (Pacto de San José). /g520Declaración Americana sobre los Derechos de Los Pueblos Indígenas de 2016. /g520La Convención sobre la Eliminación de todas las formas de Discriminación contra la Mujer - CEDAW (1979) ratificada por Chile en 1989, cuyo protocolo facultativo fue aprobado por el Congreso Nacional de Chile en 2019 y publicado en el Diario Oficial en marzo de 2020. /g520El Convenio 169 de la OIT (1989) sobre Pueblos Indígenas y Tribales en Países Independientes, ratificado por Chile en 2009. • La Convención Interamericana para prevenir, s ancionar y erradicar la violencia contra la mujer (Convención de Belem do Pará) de 1995, ratificada por Chile en 1996. Normativa nacional: • La Constitución Política de la República de Chile. /g520El artículo 52 de la Ley 18.575 Orgánica Constitucional de Bases Generales de la']","La Dirección de Equidad de Género (DEG) juega un rol central en la aplicación de la Política de Igualdad y Equidad de Género en la Universidad de La Frontera. Sus responsabilidades incluyen:

1. **Generar y coordinar instancias participativas**: La DEG coordina acciones y espacios para la revisión de reglamentos y procedimientos, involucrando a diferentes estructuras y unidades académicas y administrativas.

2. **Desarrollo de propuestas**: A partir de la evidencia obtenida del Diagnóstico de Situación y Relaciones de Género y otras fuentes oficiales, la DEG elabora propuestas que son validadas por las autoridades de las diversas unidades de la universidad.

3. **Implementación y seguimiento**: La DEG es responsable de hacer efectiva la implementación de la Política y del Plan de Igualdad y Equidad de Género, lo que incluye un procedimiento de seguimiento y monitoreo anual de ambos instrumentos.

4. **Evaluación**: Se establecerá un procedimiento de evaluación pública y participativa de la implementación de la Política cada cinco años, con la posibilidad de que el Consejo Asesor de la DEG solicite una evaluación a tres años en caso de incumplimientos.

5. **Estrategia comunicacional**: La DEG, en coordinación con la Dirección de Comunicaciones, desarrolla una estrategia para difundir, socializar y posicionar la Política de Igualdad y Equidad de Género entre la comunidad universitaria, fomentando el compromiso de todos los integrantes de la institución.

En resumen, la DEG es un eje clave en la creación, implementación, evaluación y difusión de la Política de Igualdad y Equidad de Género, asegurando su cumplimiento y la participación activa de la comunidad universitaria.",La Dirección de Equidad de Género (DEG) es la unidad responsable de impulsar,1.0,,0.9166666666361111,1.0
Mencione al menos tres principios rectores de la Política de Género.,"['\x17 17. Cabe señalar que el proceso puso énfasis en el trabajo deliberativo, particip ativo, público y triestamental, siendo todas las instancias convocadas y coordinadas por el equipo profesional de la Dirección de Equidad de Género. La Comisión y las subco misiones programaron audienci as con instancias institucionales y especialistas en temas jurídicos, de género e institucionales para complementar la información recogida en el diagnóstico. Luego se abocó a elaborar la contextuali zación sociopolítica del Preámbulo, así como los Principios, Lineamientos Es tratégicos, Difusión e Implementación de la propuesta de Política de Igualdad y Equidad de Género. Cabe señalar que al realizarse una votación en la Comisión respecto de los 11 princi pios que debía contener la Política, los rangos de aprobación fluctuaron entre un 96% y un 100%; e n t a n t o e n l a s d i r e c t r i c e s , d i c h o s r a n g o s oscilaron entre un 76,9% y un 92,6%. 18. Que, la etapa de validación, las personas integrantes de la Comisión De liberativa contaron con los tiempos y facilidades para poder socializar con sus bases cada una de las propuestas de contenido. 19. Luego de contar con las respectivas observaciones y ajustes, la Dirección de Equidad de Género y la Comisión Deliberativa invitaron a la comunidad universitaria a una sesión abierta, p a r t i c i p a t i v a y t r i estamental para recibir observaciones, sugerencias y propuestas. En la sesión realizada con fecha 29 de septiembre del 2021 participaron 108 personas, correspon diendo éstas a 80 mujeres y 28 hombres de diferentes estamentos de la Universidad. Quienes pa rticiparon de la sesión relevaron la Política de Igualdad y Equidad de Género de la Universidad para la comunidad local, regional y nacional, valorando que su elaboración fue conside rando a los tres estamentos en instancias participativas, además de destacar la incorporación de los ámbit os intercultural e interseccional en sus principios y lineamientos estratégicos. Así también se destacó que la Política de Igualdad y Equidad de Género acogiera las demandas de igualdad y equidad de género de la comunidad universitaria, además de alinearse con los requerimientos normativos nacionales e internacionales. 20. Que, en consecuencia, el presente instrumento tiene por objeto resp onder, en el espacio universitar io, a la desigualdad entre hombres, mujeres y otras identidades de gé nero por causa de diferentes fenómenos sociopolíticos y culturales, a fin de establecer mecanismos de equidad que permitan superar esta brecha en el plano institucional. 21. El acuerdo de la H. Junta Directiva en sesión extraordinaria Nº 226 del 13 de septiembre de 2022, previo informe favorable del Consejo Académico en sesión extraordinar io Nº282 de fecha 15 de di ciembre de 2021, en orden de aprobar la Política de Igualdad y Equidad de Género. 22. Que, la Dirección Jurídica de la universidad de La Frontera, otorgó visto bueno a la presente política. RESUELVO : APRUEBASE la Política de Igualdad y Equidad de Género de la Universidad de La Frontera , cuyo contenido es el siguiente: TITULO I. DEL OBJETIVO GENERAL DE LA POLÍTICA DE IGUALDAD Y EQUIDAD DE GÉNERO Establecer orientaciones estratégicas y directrices que permitan alcanzar una cultura de igualdad y equidad degénero en todos los ámbitos de la gestión y actividad universitaria,con el fin de construir una universidad libre de exclusiones, discriminaciones, violencias y brechas de género, en el marco del respeto de los derechos fundamentales de las personas que integran la Universidad de La Fr ontera, con independencia de su estamento y calidad contractual y dar cumplimiento a lo requerido por el artículo 3 de la Ley 21.369 en cuanto a que la Universidad deberá contar con un ap o l í t i c a i n t e g r a l c o n t r a e l a c o s o s e x u a l , l a violencia y la discriminación de género.', 'Que, en su condición de Universidad Pública, socialmente responsable e inspirada en el pleno respeto de los derechos y garantías fundamentales de las personas, la Universidad de La Frontera debe avanzar en su obligación intrínseca de contar con un reglamento que le permita, en forma eﬁcaz y oportuna, prevenir, actuar, abordar e, investigar aquellas conductas atentatorias de la condición de persona, cualquiera sea su sexo, identidad de género, orientación sexo afectiva, expresión de género, condición funcionaria, académica o estudiantil, nacionalidad u otra. Que, en este contexto, el presente reglamento se inspira entre otros principios en los de libertad, igualdad, no discriminación, igualdad y equidad de género, juridicidad, respeto, tolerancia y, en los distintos cuerpos legislativos que, tanto a nivel internacional, como en el derecho interno, y en las propias normas universitarias o que a ella hagan referencia, se han preocupado de poner de relieve estos derechos y principios. Que, el presente reglamento de investigación aborda situaciones que tienen que ver con Violencia de Género, Acoso Sexual, Maltrato y Acoso Laboral, Académico y Estudiantil, Discriminación Arbitraria y discriminación de género, viene en otorgar una mejora en los procedimientos de denuncia, toda vez que reconoce procedimientos de tramitación, tanto para casos de violencia y discriminación en materia de género y materia laboral, académica y estudiantil. Que, es necesaria la aprobación del presente reglamento con miras a la construcción de espacios universitarios seguros, respetuosos, libres de discriminación y violencia de género, acoso y maltrato en la Universidad, velando por las buenas prácticas y los principios de Protección a las Garantías Constitucionales, la equidad de género, debido proceso, legalidad, presunción de inocencia, congruencia, proporcionalidad, todos pilares en que se funda un Estado de Derecho. /gid00017/gid00018/gid00015 /gid00017/gid00019/gid00015 /gid00017/gid00020/gid00015 /gid00017/gid00021/gid00015 /gid00036/gid00078/gid00077/gid00082/gid00072/gid00067/gid00068/gid00081/gid00064/gid00077/gid00067/gid00078/gid00027 /gid00014/gid00049/gid00162/gid00070/gid00072/gid00077/gid00064 /gid00017/gid00019 /gid00051/gid00068/gid00070/gid00075/gid00064/gid00076/gid00068/gid00077/gid00083/gid00078/gid00001/gid00067/gid00068 /gid00036/gid00078/gid00077/gid00085/gid00072/gid00085/gid00068/gid00077/gid00066/gid00072/gid00064/gid00001/gid00054/gid00077/gid00072/gid00085/gid00068/gid00081/gid00082/gid00072/gid00083/gid00064/gid00081/gid00072/gid00064', '2 Superior, proponer las políticas para la educación superior y coordinar a los órganos del Estado que componen el Sistema”, debiendo para tales efectos, que las Universidades cuenten con directrices que permitan la elaboración e implementación de políticas propias de su quehacer universitario. 5. Que, por Resolución Exenta N°4013 de fecha 14 de diciembre de 2023, se aprobó el Protocolo de Gestión de Políticas Institucionales de la Universidad de La Frontera, el cual tuvo por obje to regular el ciclo de vida de las políticas institucionales mediante un instrumento que otorgue procesos homogéneos en concordancia con la normativa nacional en Educación Superior. 6. Que, en cuanto a los antecedentes que motivan esta Política: En este con texto normativo para las Instituciones de Educación Superior, en el cual existen nuevas exigencias en materias financieras, aumento de sistemas de control, así como los nuevos criterios de acreditación institucional, surge la necesidad de contar con una Po lítica Financiera para la Universidad de La Frontera. Lo anterior, argumentado en los procedimientos y requerimientos para generar las autorizaciones para los procesos de tramitación de endeudamientos, sean estos de corto, mediano o largo plazo. Por otra p arte, la necesidad de contar con procesos de control más rigurosos, de manera de dar cumplimiento a las exigencias del nuevo marco legal y normativo, como lo es la Ley de delitos económicos, lavado de activos y de financiamiento del terrorismo. En el mismo sentido, la necesidad de contar con procedimientos actualizados y pertinentes a la realidad actual Universitaria y de financiamiento del sistema de educación superior, motivo por el cual se requiere contar con un reglamento conocido y transparente sobre la elaboración, ejecución y control del presupuesto universitario que, de cuenta de las necesidades de financiamiento de todo el quehacer universitario, y que vele por la sostenibilidad presente y futura. En función de este mandato, además de la propia naturaleza de las políticas institucionales, como reflejo de la cultura y valores de la Institución, es relevante considerar la participación como un eje transversal al ciclo de vida de las políticas institucionales. En función de la creación de nuevos en tes fiscalizadores como lo es la Superintendencia de Educación Superior y las actuales atribuciones tanto de la Subsecretaría de Educación Superior como de la Contraloría General de la República en relación a las instituciones de educación superior, se norma la rendición de cuentas de la gestión financiera de este tipo de instituciones. Además, se suma la definición de nuevos criterios y estándares para la acreditación institucional por parte de la CNA, que incorpora la dimensión Gestión Estratégica y Recur sos Institucionales con fines de asegurar la sostenibilidad del proyecto. 7. Que, en cuanto al proceso general de elaboración de la Política y en conformidad a las directrices institucionales, este proceso se ordenó en tres etapas fundamentales: diagnóstico, elaboración y validación: a) Etapa de Diagnóstico La construcción de esta política fue iniciada por la Vicerrectoría de Administración y Finanzas mediante ordinario N°198/3010 de fecha 16 de noviembre de 2023, en que se solicitó formalizar la Comisión pa ra la Elaboración de la Política Financiera de la Universidad de La Frontera (en adelante también “la Comisión”) y de la Secretaría Técnica a tal efecto. Esta Comisión estuvo compuesta por representantes de diversos estamentos universitarios, unidades rela cionadas al área financiera, Dirección Jurídica, facultades, y las asociaciones gremiales académica y administrativa. En consecuencia, por Resolución Exenta N°3866 de fecha 04 de diciembre de 2023 se designaron sus integrantes, lo que fue complementado por Resolución Exenta N°4066 de fecha 19 de diciembre de 2023. La Comisión para la Elaboración de la Política Financiera comenzó a sesionar con fecha 27 de noviembre de 2023.', '\x1b Asimismo, se desarrollarán estrategias de apoyo para la inserción laboral y vinculación con la Universidad, para estudiantes que hayan fi nalizado sus programas de estudio, todos ellos con perspectiva de género. 4.- PARTICIPACIÓN, LIDERAZGO Y GOB IERNO UNIVERSITARIO CON PERSPECTIVA DE GÉNERO La Universidad reconoce la participación y liderazgo de las personas que integran la comunidad universitaria, fomentando la partici pación equilibrada, pari taria, informada, transparente, protegida y en igualdad de condiciones, en todos l os cargos de autoridad, representación oficial y de cuerpos colegiados, equipos, comisiones y comités de trabajo, entre otros, sin discriminación por identidad de género, expresión de género y/o orientación sexoafectiva. Se promoverá el ejercicio real y democrático de la p articipación triestam ental, cuando corresponda, con perspectiva de género, protegi endo la autonomía y libertad de expresión, sin generar ello riesgo o desmedro de la situación laboral funcionaria o estudiantil. En concordancia con lo anterior, se garantizará el respeto y prote cción de los tiempos establecidos institucionalmente para las actividad es universitarias, teniendo en cuenta las condiciones personales, de salud y familiares. Co nsiderando, a su vez, las circunstancias o situaciones particulares asociadas al cicl ov i t a ld el a sp e r s o n a s ,l a s c u a l e sd e b e ns e r conciliadas con las actividades de participación en instancias de tomade decisiones. La participación en instancias relativas a procesos institucionales será valorada en la trayectoria o carrera laboral y estudiantil, po r medio de reconocimientos simbólicos, económicos y materiales, cuando corresponda. 5.- GÉNERO, PUEBLOS ORIGINARIOS E INTERCULTURALIDAD La Universidad reconoce que el respeto y legitimación de las formas culturales y manifestaciones de ser mujer, hombre y otras identidades de género, implica transversalizar una perspectiva intercultural de género en la cultura organizacional, tanto en sus estructuras como estamentos. Para estos efectos, se promoverá una perspectiva intercultural de género en los procesos formativos, que permita el fortalecimiento de saberes, conocimientos y prácticas culturales. Estos procesos fomentarán el diálogo respetuoso con liderazgos, representantes y autoridades tradicionales del Pueblo Mapuche y de otros pueblos originarios y culturas. Se promoverá, a su vez, la investigación de carácter intercultural sobre gé nero, reconociendo y respetando las culturas originarias, cuando l as personas, conocimientos y saberes sean destinatarios de estos procesos. La Universidad generará instancias de sensibilización, inducción ,c a p a c i t a c i ó ny f o r m a c i ó n que permitan visibilizar y erradicar las desig ualdades y discriminaciones interseccionales que viven y han vivido las mujeres mapuche, personas de otras identidades culturales de género y nacionalidades, desarrollando competencias interculturales de género. Asimismo, se promoverá y fortalecerá la repre sentatividad con perspectiva intercultural de género en los espacios de participación y lideraz go político, social y cultural, entre otros, dentro de la comunidad universitaria, en todos los ni veles, incluyendo ámbitos de mayor jerarquía de decisión institucional. Se incorporarán instancias tri estamentales de diálogo intercultural permanentes sobre temáticas de género que aborden la diversidad de perspectivas y experiencias estudiantiles, administrativas y académica s al interior de la Universidad, con el fin de difundir los conocimientos, saberes y prácticas cultural es, enfatizando aquellas llevadas a cabo por mujeres mapuche y de otros pueblos origi narios, nacionalidades y culturas.']","La información proporcionada no menciona específicamente los principios rectores de la Política de Igualdad y Equidad de Género de la Universidad de La Frontera. Por lo tanto, no puedo responder a su pregunta con el contexto proporcionado.",Los principios rectores incluyen: Igualdad y No Discriminación,0.0,,0.49999999995,1.0
¿Cuándo comienzan oficialmente las clases del Primer Semestre de Pregrado el año académico 2025?,"['2 - Continuidad de estudios en Dirección de Pregrado o equivalente de la Facultad, estudiantes eliminados por causal académica el 4to. bimestre y segundo semestre 2024. Lunes 06 de enero Último día para solicitar codificación de asignaturas nuevas o modificaciones menores a programas de asignaturas para el 1er. semestre de 2025 por parte de departamentos y unidades académicas, según Res. Int. VIPRE N° 146/2019. Lunes 13 a viernes 31 de enero Período de r egularización de la situación académica y financiera de estudiantes de cursos superiores. FEBRERO Lunes 03 de febrero a viernes 28 de febrero Receso universitario. (*) MARZO Lunes 03 a miércoles 05 de marzo. Último período para resolver transferencias de carrera, reincorporaciones, convalidaciones, elecciones de carrera o mención, entre otros; por parte de las Direcciones de Pregrado o su equivalente a DIRAE. Lunes 03 a viernes 07 de marzo Período de: - Regularización de la situación académica y financie ra de estudiantes de cursos superiores. - Pago de arancel de inscripción , para estudiantes de cursos superiores. Martes 04 de marzo Inicio actividades académicas para estudiantes de primer año que ingresan a la Facultad de Ingeniería y Ciencias. Viernes 07 de Marzo Último día para: - Actualizar programas de asignaturas del 1er. semestre y 1er. bimestre 2025 por parte de los y las docentes en Intranet. - Solicitar Postergación de estudios por parte de estudiantes de cursos superiores para el 1er. semestre 2025 e n Dirección de Pregrado o equivalente de la Facultad. - Presentar solicitud de convalidación de asignaturas para estudiantes ingreso 2025 , incluida documentación en Dirección de Pregrado o equivalente de la Facultad, para hacer efectiva el 1er. semestre 2025. Lunes 10 a viernes 14 de marzo Período de: - Inserción a la Vida Universitaria a estudiantes de Primer Año Ingreso 2025. - Inscripción de asignaturas 1er. semestre y 1er. bimestre 2025, para el estudiantado de cursos superiores en Intranet. Miércoles 12 de marzo Último día para: - Validar y publicar programas de asignaturas del 1er. semestre y 1er. bimestre 2025 por parte de directores/as de carrera en Intranet. Lunes 17 de marzo Inicio período lectivo 1er. semestre y 1er. bimestre año 2025. Viernes 21 de marzo Último día para: - Solicitar modificación de inscripción de alguna asignatura bimestral en dirección de carrera , de acuerdo al artículo 22º letra a), del Reglamento de Régimen de Estudios de Pregrado.', '6 Lunes 21 a viernes 25 de julio Período de: - Exámenes de repetición e ingreso de ca lificaciones en actas electrónicas de exámenes de repetición asignaturas 1er. semestre 2025. Período para presentar, por parte del estudiante, solicitud de: - Continuidad de estudios en Dirección de Pregrado o equivalente de la Facultad, estudiantes eliminad os por causal académica el 2do. bimestre y 1er. semestre 2025. Viernes 25 de julio Último día para: - Solicitar postergación de estudios para el 2do. semestre de 2025, en Dirección de Pregrado o equivalente de la Facultad, excepto para la carrera de Derecho. Lunes 28 de julio a viernes 01 de agosto Receso universitario. (*) AGOSTO Lunes 04 de agosto Último plazo para: - Elección de carrera o de mención en las carreras que corresponda en Dirección de Carrera.9 Período para presentar, por parte del estudiante, solicitud de: - Transferencia interna, incluida documentación para convalidación de asignaturas en Dirección de Pregrado o equivalente de la Facultad, para hacer efectiva el 2do. semestre 2025. Lunes 04 a viernes 08 de agosto Último período para: - Regularizar situaciones de notas faltantes. - Resolver transferencias de carrera, reincorporaciones, convalidaciones, elecciones de carrera o mención, entre otros; por parte de la Dirección de Pregrado o su equivalente a DIRAE. Viernes 08 de agosto Último día para: - Actualizar programas de asignaturas 3er. bimestre y 2do. semestre 2025, por parte de los y las docentes en Intranet. - Regularizar situación académica y financiera por parte del estudiante. Lunes 11 a jueves 14 de agosto Período de: - Matrícula para estudiantes que se reincorporan. - Inscripción de asignaturas 3er. bimestre y 2do. semestre 2025 por parte de los y las estudiantes en Intranet. Miércoles 13 de agosto Último día para validar y publicar programas de asignaturas del 3er. bimestre y 2do. semestre 2 025, por parte de directores/as de carrera en Intranet. Lunes 18 de agosto Inicio período lectivo 3er. bimestre y 2do. semestre 2025. Viernes 22 de agosto Último día para: - Registro de actas rectificatorias y complementarias del 2do. bimestre 2025, vía Intranet. - Ingresar la planificación de las evaluaciones bimestrales por parte de los y las docentes al Sistema de Notas Parciales. 9 Director de carrera solicita a Dirección de Pregrado o equivalente emitir resolución interna para formalizar los traspasos en DIRAE.', 'REGLAMENTO DE RÉGIMEN DE ESTUDIO DE PREGRADO 37/ RREP TÍTULO XIII: DE LA REINCORPORACIÓN A LOS ESTUDIOS ARTÍCULO 58º: La Universidad de La Frontera podrá atender las solicitudes de Reincorporación de estudios, sólo cuando estas correspondan a las situaciones descritas en el Título XII. Toda solicitud de reincorporación se presentará a la Dirección de Pregrado de la Facultad o autoridad equivalente, dentro de los plazos estipulados en el calendario académico. Las solicitudes de quienes se encuentran en la situación descrita el art. 55º, serán aprobadas siempre que la causal que motivó el Retiro Temporal haya sido superada y no exista otra incompatibilidad entre el Reglamento de Régimen de Estudios y las condiciones que presenta el(la) estudiante al momento de reincorporarse. Lo anterior se acreditará por informe profesional del Asistente Social tratante, certiﬁcado de alta médica u otro documento probatorio que el(la) director(a) de Pregrado o autoridad equivalente estime. Las solicitudes de quienes se encuentran en la situación descrita en el Art. 56º serán aprobadas siempre que la causal de salud que motivó el Retiro Temporal haya sido superada y no exista otra incompatibilidad entre el Reglamento de Régimen de Estudios y las condiciones que presenta el(la) estudiante al momento de reincorporarse. Lo anterior se acreditará por informe del profesional tratante, certiﬁcado de alta médica u otro documento probatorio que el(la) director(a) de Pregrado o autoridad equivalente estime, el cual deberá ser previamente visado por el Servicio Médico Estudiantil de la Dirección de Desarrollo Estudiantil. ARTÍCULO 59º: La decisión que se adopte será consignada en Resolución Interna de la Facultad, la que además facultará: a. La matrícula del estudiante. b. La reincorporación al Plan de Estudios vigente a la fecha de la resolución. c. La convalidación o revalidación de una parte o de todo el avance', 'VICERRECTORÍA DE PREGRADO DIRECCIÓN DE DESARROLLO CURRICULAR Y DOCENTE pregrado.ufro.cl ufro.cl dicdo@ufrontera.cl Av. Francisco Salazar 0114545 2 592 118']",Las clases del Primer Semestre de Pregrado del año académico 2025 comienzan oficialmente el lunes 17 de marzo.,Las clases del Primer Semestre de Pregrado comienzan el día **lunes 10 de marzo de 2025**.,1.0,,0.9999999999,0.0
¿Cuál es el periodo de Vacaciones de Invierno para los estudiantes de Pregrado en el 2025?,"['6 Lunes 21 a viernes 25 de julio Período de: - Exámenes de repetición e ingreso de ca lificaciones en actas electrónicas de exámenes de repetición asignaturas 1er. semestre 2025. Período para presentar, por parte del estudiante, solicitud de: - Continuidad de estudios en Dirección de Pregrado o equivalente de la Facultad, estudiantes eliminad os por causal académica el 2do. bimestre y 1er. semestre 2025. Viernes 25 de julio Último día para: - Solicitar postergación de estudios para el 2do. semestre de 2025, en Dirección de Pregrado o equivalente de la Facultad, excepto para la carrera de Derecho. Lunes 28 de julio a viernes 01 de agosto Receso universitario. (*) AGOSTO Lunes 04 de agosto Último plazo para: - Elección de carrera o de mención en las carreras que corresponda en Dirección de Carrera.9 Período para presentar, por parte del estudiante, solicitud de: - Transferencia interna, incluida documentación para convalidación de asignaturas en Dirección de Pregrado o equivalente de la Facultad, para hacer efectiva el 2do. semestre 2025. Lunes 04 a viernes 08 de agosto Último período para: - Regularizar situaciones de notas faltantes. - Resolver transferencias de carrera, reincorporaciones, convalidaciones, elecciones de carrera o mención, entre otros; por parte de la Dirección de Pregrado o su equivalente a DIRAE. Viernes 08 de agosto Último día para: - Actualizar programas de asignaturas 3er. bimestre y 2do. semestre 2025, por parte de los y las docentes en Intranet. - Regularizar situación académica y financiera por parte del estudiante. Lunes 11 a jueves 14 de agosto Período de: - Matrícula para estudiantes que se reincorporan. - Inscripción de asignaturas 3er. bimestre y 2do. semestre 2025 por parte de los y las estudiantes en Intranet. Miércoles 13 de agosto Último día para validar y publicar programas de asignaturas del 3er. bimestre y 2do. semestre 2 025, por parte de directores/as de carrera en Intranet. Lunes 18 de agosto Inicio período lectivo 3er. bimestre y 2do. semestre 2025. Viernes 22 de agosto Último día para: - Registro de actas rectificatorias y complementarias del 2do. bimestre 2025, vía Intranet. - Ingresar la planificación de las evaluaciones bimestrales por parte de los y las docentes al Sistema de Notas Parciales. 9 Director de carrera solicita a Dirección de Pregrado o equivalente emitir resolución interna para formalizar los traspasos en DIRAE.', '10 Período para presentar solicitud de continuidad de estudios en Dirección de Pregrado o equivalente de la Facultad, estudiantes eliminados por causal académica. Lunes 12 a viernes 23 de enero Elección de carrera o de mención en las carreras que corresponda en Dirección de Carrera. 15 Período para presentar solicitud de: - Transferencia interna incluida documentación para convalidación de asignaturas en Dirección de Pregrado o equivalente de la Facultad, para hacer efectiva el 1e r. semestre de 2026. Lunes 19 a viernes 23 de enero Capacitación intensiva en docencia universitaria. Jueves 29 de enero Cuenta Pública Rector FEBRERO Lunes 02 a viernes 27 de febrero Receso universitario. (*) (*) Durante los períodos de Suspensión d e Actividades Lectivas y de Recesos, los y las estudiantes que cursan Prácticas Profesionales Controladas o Internado mantienen su desempeño en el centro de práctica, según el calendario de su actividad curricular. Se autoriza a la Vicerrectoría de Pregra do para adecuar las fechas del presente calendario académico en el evento que se produzcan situaciones de hecho que así lo ameriten, por resolución interna de esa vicerrectoría y en la medida que ello no implique alteraciones que causen perjuicio a los y las estudiantes. 2°) APRUEBASE CALENDARIO ACADÉMICO DE POSTGRADO 2025: Enero 2025 Lunes16 de diciembre 2024 a viernes 3 de enero Periodo para actualizar y publicar programas de asignaturas del 1er semestre 2025 Lunes 16 de diciembre 2024 a viernes 10 de enero Evaluación Docente 2do semestre 2024 Lunes 6 a viernes 24 de enero Período de ingreso de calificaciones finales en actas, 2do semestre 2024 Lunes13 a viernes 24 de enero Último día para solicitar codificación de asignaturas nuevas y modificaciones menores a programas de asignatura del 1er semestre 2025, por parte de las Direcciones de Programas de Doctorado y Magíster en Intranet Lunes 20 a viernes 30 de enero 1° Periodo de matrícula para estudiantes de nuevos ingresos. Viernes 24 de enero Término período lectivo 2do.Sem.2024 Lunes 03 a viernes 28 de febrero Receso Universitario 15 Director de carrera solici ta a Dirección de Pregrado o equivalente emitir resolución interna para formalizar los traspasos en DIRAE.', 'REGLAMENTO DE RÉGIMEN DE ESTUDIO DE PREGRADO 37/ RREP TÍTULO XIII: DE LA REINCORPORACIÓN A LOS ESTUDIOS ARTÍCULO 58º: La Universidad de La Frontera podrá atender las solicitudes de Reincorporación de estudios, sólo cuando estas correspondan a las situaciones descritas en el Título XII. Toda solicitud de reincorporación se presentará a la Dirección de Pregrado de la Facultad o autoridad equivalente, dentro de los plazos estipulados en el calendario académico. Las solicitudes de quienes se encuentran en la situación descrita el art. 55º, serán aprobadas siempre que la causal que motivó el Retiro Temporal haya sido superada y no exista otra incompatibilidad entre el Reglamento de Régimen de Estudios y las condiciones que presenta el(la) estudiante al momento de reincorporarse. Lo anterior se acreditará por informe profesional del Asistente Social tratante, certiﬁcado de alta médica u otro documento probatorio que el(la) director(a) de Pregrado o autoridad equivalente estime. Las solicitudes de quienes se encuentran en la situación descrita en el Art. 56º serán aprobadas siempre que la causal de salud que motivó el Retiro Temporal haya sido superada y no exista otra incompatibilidad entre el Reglamento de Régimen de Estudios y las condiciones que presenta el(la) estudiante al momento de reincorporarse. Lo anterior se acreditará por informe del profesional tratante, certiﬁcado de alta médica u otro documento probatorio que el(la) director(a) de Pregrado o autoridad equivalente estime, el cual deberá ser previamente visado por el Servicio Médico Estudiantil de la Dirección de Desarrollo Estudiantil. ARTÍCULO 59º: La decisión que se adopte será consignada en Resolución Interna de la Facultad, la que además facultará: a. La matrícula del estudiante. b. La reincorporación al Plan de Estudios vigente a la fecha de la resolución. c. La convalidación o revalidación de una parte o de todo el avance', '2 - Continuidad de estudios en Dirección de Pregrado o equivalente de la Facultad, estudiantes eliminados por causal académica el 4to. bimestre y segundo semestre 2024. Lunes 06 de enero Último día para solicitar codificación de asignaturas nuevas o modificaciones menores a programas de asignaturas para el 1er. semestre de 2025 por parte de departamentos y unidades académicas, según Res. Int. VIPRE N° 146/2019. Lunes 13 a viernes 31 de enero Período de r egularización de la situación académica y financiera de estudiantes de cursos superiores. FEBRERO Lunes 03 de febrero a viernes 28 de febrero Receso universitario. (*) MARZO Lunes 03 a miércoles 05 de marzo. Último período para resolver transferencias de carrera, reincorporaciones, convalidaciones, elecciones de carrera o mención, entre otros; por parte de las Direcciones de Pregrado o su equivalente a DIRAE. Lunes 03 a viernes 07 de marzo Período de: - Regularización de la situación académica y financie ra de estudiantes de cursos superiores. - Pago de arancel de inscripción , para estudiantes de cursos superiores. Martes 04 de marzo Inicio actividades académicas para estudiantes de primer año que ingresan a la Facultad de Ingeniería y Ciencias. Viernes 07 de Marzo Último día para: - Actualizar programas de asignaturas del 1er. semestre y 1er. bimestre 2025 por parte de los y las docentes en Intranet. - Solicitar Postergación de estudios por parte de estudiantes de cursos superiores para el 1er. semestre 2025 e n Dirección de Pregrado o equivalente de la Facultad. - Presentar solicitud de convalidación de asignaturas para estudiantes ingreso 2025 , incluida documentación en Dirección de Pregrado o equivalente de la Facultad, para hacer efectiva el 1er. semestre 2025. Lunes 10 a viernes 14 de marzo Período de: - Inserción a la Vida Universitaria a estudiantes de Primer Año Ingreso 2025. - Inscripción de asignaturas 1er. semestre y 1er. bimestre 2025, para el estudiantado de cursos superiores en Intranet. Miércoles 12 de marzo Último día para: - Validar y publicar programas de asignaturas del 1er. semestre y 1er. bimestre 2025 por parte de directores/as de carrera en Intranet. Lunes 17 de marzo Inicio período lectivo 1er. semestre y 1er. bimestre año 2025. Viernes 21 de marzo Último día para: - Solicitar modificación de inscripción de alguna asignatura bimestral en dirección de carrera , de acuerdo al artículo 22º letra a), del Reglamento de Régimen de Estudios de Pregrado.']",El periodo de Vacaciones de Invierno para los estudiantes de Pregrado en el 2025 es del lunes 28 de julio al viernes 01 de agosto.,El periodo de Vacaciones de Invierno para Pregrado es desde el **lunes 21 de julio al viernes 01 de agosto de 2025**.,1.0,,0.7499999999625,1.0
¿Cuál es la fecha límite para la Eliminación de Asignaturas del Segundo Semestre de Postgrado?,"['3 TÍTULO II. DE LA CREACIÓN, ADECUACION Y CIERRE DE LOS PROGRAMAS DE MAGÍSTER. ARTÍCULO 11. El proyecto de creación de un programa de magister se ajustará a lo establecido en el Procedimiento de Creación de Programas de Postgrado y Especialidades según normativa vigente. ARTÍCULO 12. La propuesta de creación deberá estar en concordancia con la misión de la Universidad, el Modelo Educativo y el Plan Estratégico de Desarrollo, y deberá seguir las orientaciones y marco normativo de la Dirección Académica de Postgrado de la Vicerrectoría de Investigación y Postgrado. ARTÍCULO 13. Los programas podrán ser sometidos a procedimientos de análisis, actualización, ajuste o rediseño curricular de conformidad al procedimiento establecido en la normativa universitaria. Las adecuaciones curriculares entrarán en vigor en el perí odo académico inmediatamente posterior a aquel en que fueron aprobadas y sancionadas por resolución exenta. ARTÍCULO 14. El cierre de programas se ajustará al procedimiento de cierre de programas de conformidad al procedimiento establecido en la normativa universitaria. ARTICULO 15. Cada programa deberá cumplir con los requisitos mínimos exigidos por la normativa vigente para el postgrado de la Universidad de La Frontera, en concordancia con las orientaciones establecidas por la agencia de acreditación (CNA o aquella que la ley establezca) con la finalidad que durante el primer año de su ejecución, inicie el proceso de autoevaluación con fines de acreditación y presenten la documentación respectiva ante la CNA (o la agencia oficial de acreditación de pr ogramas de postgrado de acuerdo con la ley vigente) en las ventanas temporales que la agencia exija. TÍTULO III. DE LA ORGANIZACIÓN Y ADMINISTRACIÓN ARTÍCULO 16. Cada programa contará con una Directora o Director, un Comité Académico y un Cuerpo Académico. ARTÍCULO 17. La dirección del programa estará a cargo de una Directora o Director, nombrado por la Vicerrectoría de Investigación y Postgrado en acuerdo con la respectiva decanatura, de entre el/los/la/las profesores propuestos por el claustro o nú cleo académico del programa, que deberá ser informada a la Dirección Académica de Postgrado una vez que la creación del programa sea aprobada por los cuerpos colegiados o, en un plazo no superior a 15 días del término de la vigencia en el cargo de Directora o Director. ARTÍCULO 18. La Directora o Director permanecerá en el cargo por un período de cuatro años, pudiendo renovarse sólo por un periodo consecutivo. Con todo, mantendrá la condición de cargo de confianza de la Vicerrectoría de Investigación y Pos tgrado. Podrá ser removido del cargo por la Vicerrectora o Vicerrector de Investigación y Postgrado en acuerdo con la respectiva decanatura. ARTÍCULO 19. Para ser Directora o Director de un programa, se requerirá: a) Pertenecer al claustro o núcleo de prof esores del programa con acreditación vigente en la Dirección Académica de Postgrado. b) Tener un contrato con la Universidad de media jornada como mínimo. ARTÍCULO 20. Serán funciones de la Directora o Director del programa: a) Dirigir la ejecución y desarrol lo de las actividades académicas, administrativas y financieras del programa, en coordinación con la Dirección Académica de Postgrado.', '16 e) Comisión: Nombre y firma. f) Fecha del examen. ARTÍCULO 93. La Dirección del Programa deberá enviar a la Dirección Académica de Postgrado el acta de examen de grado, en duplicado, al día hábil siguiente del examen. La Dirección Académica de Postgrado deberá enviar el acta de examen de grad o debidamente firmada a la Dirección de Registro Académico Estudiantil, para su ingreso al avance curricular, y de esta forma dar término al plan de estudios. TÍTULO XIV: DE LA OBTENCIÓN DEL GRADO DE MAGÍSTER ARTÍCULO 94. La calificación final de la o e l estudiante en el programa de magíster resultará del promedio ponderado de las calificaciones obtenidas en las actividades curriculares del plan de estudios del programa (actividad curriculares, electivos, tesis de grado o AFE y examen de grado; teniendo a la vista la publicación enviada para los magíster académicos). Cada programa deberá establecer en su reglamento la ponderación que asignará a cada una de ellas. No obstante, la ponderación de las actividades curriculares y electivas no podrá ser inferior a un 50%. ARTÍCULO 95. Cumplidos todos los requisitos del programa, la Dirección Académica de Postgrado solicitará a la rectora o rector , a través de Secretaría General, que se otorgue a la persona graduada el grado académico correspondiente. ARTÍCULO 96. La persona graduada deberá entregar personalmente en la oficina de Títulos y Grados de la Dirección de Registro Académico Estudiantil todos los documentos necesarios para la tramitación de la resolución de grado en un plazo no superior a 60 días, conta dos desde la fecha del examen de grado y completar el formulario de iniciación del expediente. La fecha de grado corresponderá a la fecha del examen de grado. Después de los 60 días la persona interesada deberá solicitar autorización especial de iniciación de expediente de graduación en la Vicerrectoría de Investigación y Postgrado. ARTÍCULO 97. El certificado y diploma de grado deben indicar el grado académico obtenido, la nota de grado y el concepto asociado: a) Aprobada o aprobado 5,0 – 5,9. b) Aprobada o aprobado con Distinción 6,0 – 6,4. c) Aprobada o aprobado con Distinción Máxima 6,5 - 7,0. ARTÍCULO 98. La Universidad podrá otorgar un certificado de reconocimiento de las asignaturas cursadas en el evento en que una o un estudiante no pueda concluir con s u programa. Este certificado puede ser solicitado por la o el estudiante a la Vicerrectoría de Investigación y Postgrado en un plazo de dos años contados desde que se presentó el impedimento. Este certificado será autorizado por la Vicerrectoría de Inve stigación y Postgrado, previo acuerdo favorable del Comité Académico del Programa y de la Dirección Académica de Postgrado. Este certificado no tendrá ningún costo para la o el solicitante. ARTÍCULO 99. La Universidad otorgará un grado póstumo a la o el estudiante que falleciera habiendo cursado y aprobado todo el plan de estudios de su programa sin haber obtenido aún su grado de magíster. Este grado debe ser solicitado a la Vicerrectoría de Investigación y Postgrado por los abuelos, padre, madre, hijos o cónyuge de la o el estudiante o por un pariente hasta segundo grado de consanguinidad. El plazo para solicitar este grado es de dos años contados desde su deceso.', 'REGLAMENTO DE RÉGIMEN DE ESTUDIO DE PREGRADO 07/ RREP Según duración: a. Horas: Son aquellas asignaturas del Plan de Estudios que se desarrolla en un número especíﬁco de horas durante una semana para la realización de exámenes. b. Semanas: Son aquellas asignaturas que se desarrollan en períodos lectivos distintos a un bimestre, semestre o año. Consideran un periodo para evaluaciones y exámenes de repetición que está indicado en el programa de asignatura. c. Bimestre: Son aquellas asignaturas que se desarrollan en 7 semanas lectivas y una semana para evaluaciones ﬁnales y exámenes de repetición. Lo anterior será regulado por el calendario de actividades académicas de la Universidad. d. Semestre: Son aquellas asignaturas que se desarrollan en 16 semanas de actividades lectivas y dos semanas de evaluaciones y/o exámenes ﬁnales. Lo anterior será regulado por el calendario de actividades académicas de la Universidad. e. Año: Son aquellas asignaturas que se desarrollan en 32 semanas de actividades lectivas y dos semanas de evaluaciones y/o exámenes ﬁnales. Lo anterior será regulado por el calendario de actividades académicas de la Universidad. Programa de Asignatura: Documento oﬁcial que norma la organización de actividades de cada asignatura y que debe cumplir con el formato estipulado por la Dirección de Desarrollo Curricular y Docente. Módulo Integrado: Actividad curricular organizada en torno a varias áreas del conocimiento a la vez. Su extensión podrá ser semestral o anual, cuya responsabilidad administrativa recaerá sobre la Unidad Académica que posea el máximo de horas intra-aula en el programa o mayor aﬁnidad con la temática. Para efectos de este Reglamento se considerarán como asignatura. Periodo Académico: Tiempo comprendido entre el inicio del primer periodo de inscripción de asignaturas de un periodo lectivo hasta el día antes del inicio del periodo de inscripción de asignaturas de otro periodo lectivo consecutivo.', '7 ARTÍCULO 31. Los planes de estudios incluirán en su estructura: a) La denominación del grado académico al que conduce. b) La organización de las actividades curriculares en nivel es semestrales, anuales o modulares. La duración del semestre académico será establecida cada año en el calendario académico de postgrado. c) El nombre de cada actividad curricular, la formación que concede (nivelación, básica o especializada), su carácter ( teórico, práctico o teórico -práctico), su flexibilidad curricular (obligatoria o electiva), su duración (semestral, anual o modular) número de horas intra - aula y extra-aula totales de la actividad curricular, número de créditos transferibles y los requisitos para cursar la actividad curricular y/o para aprobarla. d) El número de horas intra y extra -aula y el número de créditos transferibles (SCT) por actividad curricular, por cada nivel y para el plan de estudios completo. e) La modalidad en que se impartirán l as actividades curriculares (presencial, virtual o semipresencial). ARTÍCULO 32. La Dirección Académica de Postgrado podrá proponer a los programas asignaturas y cursos en modalidad electiva, bajo los lineamientos del Modelo Educativo y la Política de Pos tgrado vigente, en temáticas transversales de formación general para el postgrado. La asigna tura tendrá un rango de 4 -6 SCT, la que deberá ser reconocida por cada programa al momento de realizar un ajuste o rediseño curricular de su plan de estudios. ARTÍCULO 33. El reglamento interno del programa, regulara las siguientes materias: a) Nombre explícito del grado de magíster que otorga el programa. b) Objetivo (general y específicos) del programa. c) Definición del carácter del programa: profesional, académico o mixto. d) Perfil de ingreso: declaración de aquellas condiciones de entrada, conocimientos previos, habilidades, destrezas, aptitudes, o atributos mínimos que debe presentar la o el estudiante al momento de ingresar a un programa determinado. e) Perfil de gradu ación. declaración de las competencias logradas en términos de conocimientos, habilidades y aptitudes que será capaz de demostrar la persona graduada al culminar su proceso formativo y que lo habilitan para su desempeño académico/profesional. f) Requisitos de admisión. g) Ponderación de los criterios de selección. h) Competencias disciplinares y genéricas. i) Procedimiento de cálculo de la nota final del magíster. j) Administración del plan de estudios. k) Causales especiales de eliminación. l) Definición del formato del escrito de la tesis de grado (idioma, incorporación de artículos, etc.). m) Criterios para la asignación de las profesoras y profesores tutores y guías de tesis. n) Criterios para la conformación de la comisión de examen de calificación, incluyendo conflicto de intereses.']",No puedo responder a la pregunta sobre la fecha límite para la eliminación de asignaturas del segundo semestre de postgrado con el contexto proporcionado. La normativa compartida no incluye información específica sobre plazos o fechas límites de eliminación de asignaturas.,La fecha límite para la Eliminación de Asignaturas del Segundo Semestre de Postgrado es el **viernes 19 de septiembre de 2025**.,1.0,,0.0,0.0
¿Cuál es el número y la fecha de la Resolución Exenta que aprueba esta Política de Igualdad y Equidad de Género?,"['\x17 17. Cabe señalar que el proceso puso énfasis en el trabajo deliberativo, particip ativo, público y triestamental, siendo todas las instancias convocadas y coordinadas por el equipo profesional de la Dirección de Equidad de Género. La Comisión y las subco misiones programaron audienci as con instancias institucionales y especialistas en temas jurídicos, de género e institucionales para complementar la información recogida en el diagnóstico. Luego se abocó a elaborar la contextuali zación sociopolítica del Preámbulo, así como los Principios, Lineamientos Es tratégicos, Difusión e Implementación de la propuesta de Política de Igualdad y Equidad de Género. Cabe señalar que al realizarse una votación en la Comisión respecto de los 11 princi pios que debía contener la Política, los rangos de aprobación fluctuaron entre un 96% y un 100%; e n t a n t o e n l a s d i r e c t r i c e s , d i c h o s r a n g o s oscilaron entre un 76,9% y un 92,6%. 18. Que, la etapa de validación, las personas integrantes de la Comisión De liberativa contaron con los tiempos y facilidades para poder socializar con sus bases cada una de las propuestas de contenido. 19. Luego de contar con las respectivas observaciones y ajustes, la Dirección de Equidad de Género y la Comisión Deliberativa invitaron a la comunidad universitaria a una sesión abierta, p a r t i c i p a t i v a y t r i estamental para recibir observaciones, sugerencias y propuestas. En la sesión realizada con fecha 29 de septiembre del 2021 participaron 108 personas, correspon diendo éstas a 80 mujeres y 28 hombres de diferentes estamentos de la Universidad. Quienes pa rticiparon de la sesión relevaron la Política de Igualdad y Equidad de Género de la Universidad para la comunidad local, regional y nacional, valorando que su elaboración fue conside rando a los tres estamentos en instancias participativas, además de destacar la incorporación de los ámbit os intercultural e interseccional en sus principios y lineamientos estratégicos. Así también se destacó que la Política de Igualdad y Equidad de Género acogiera las demandas de igualdad y equidad de género de la comunidad universitaria, además de alinearse con los requerimientos normativos nacionales e internacionales. 20. Que, en consecuencia, el presente instrumento tiene por objeto resp onder, en el espacio universitar io, a la desigualdad entre hombres, mujeres y otras identidades de gé nero por causa de diferentes fenómenos sociopolíticos y culturales, a fin de establecer mecanismos de equidad que permitan superar esta brecha en el plano institucional. 21. El acuerdo de la H. Junta Directiva en sesión extraordinaria Nº 226 del 13 de septiembre de 2022, previo informe favorable del Consejo Académico en sesión extraordinar io Nº282 de fecha 15 de di ciembre de 2021, en orden de aprobar la Política de Igualdad y Equidad de Género. 22. Que, la Dirección Jurídica de la universidad de La Frontera, otorgó visto bueno a la presente política. RESUELVO : APRUEBASE la Política de Igualdad y Equidad de Género de la Universidad de La Frontera , cuyo contenido es el siguiente: TITULO I. DEL OBJETIVO GENERAL DE LA POLÍTICA DE IGUALDAD Y EQUIDAD DE GÉNERO Establecer orientaciones estratégicas y directrices que permitan alcanzar una cultura de igualdad y equidad degénero en todos los ámbitos de la gestión y actividad universitaria,con el fin de construir una universidad libre de exclusiones, discriminaciones, violencias y brechas de género, en el marco del respeto de los derechos fundamentales de las personas que integran la Universidad de La Fr ontera, con independencia de su estamento y calidad contractual y dar cumplimiento a lo requerido por el artículo 3 de la Ley 21.369 en cuanto a que la Universidad deberá contar con un ap o l í t i c a i n t e g r a l c o n t r a e l a c o s o s e x u a l , l a violencia y la discriminación de género.', '\x16 Resolución Exenta N°1400 de fecha 12 de ag osto de 2021, que designó integrantes de la Comisión de elaboración de la propuesta de Política de Género de la Universidad de La Frontera y, asimismo, mediante la creación de unidades especi alizadas y la elaboración de procedimientos sobre esta materia que se indican en los considerandos 3° al 7° del presente acto administrativo. 11. Que, para tales efectos, la Universidad encomendó a la Dirección de Equidad de Género el proceso de elaboración y diseño de una propuesta de Política de Igualdad y Equidad de Gé nero, en el marco de su funciones, atendido el artículo 2 letra a) de la Resolución Exen ta N°0813 de 2019 que comprende como tal, el “Proponer a las auto ridades y organismos correspondi entes, políticas, planes, normativas y medidas orientadas al fortalecimiento de la institucionalidad para alcanzar la equidad de género en la Universidad de La Frontera”. 12. Que, se dispuso de un proceso general para la elaboración e implementación de la propuesta de Política de Igualdad y Equidad de Género, conformado por una etapa de diseño y elaboración; etapa de difusión y posicionamiento; y etapa de implementación, seguimiento y evaluación, correspondiendo el presente acto administrativo a la primera de ellas. En este sentido, la etapa de diseño y elaboración de la Política de Igualdad y Equidad de Género se conforma de una etapa de diagnóstico; una etapa de elaboración; y, una etapa de validación, las cuales fueron previas a su presentación a los cuerpos colegiados de la Universidad. 13. Que, la etapa de diagnóstico comprendió un estudio el cual fue presentado al Comité Étic o Científico de la Universidad con fecha 08 de noviembre de 2019, quien evacuó con fecha 08 de enero de 2020 el Acta de Evaluación N°001_20 del Protocolo de Investigación, el que permitió desarrollarlo con los estándares éticos ym e t o d o l ó g i c o s . E l d i s e ñ o m e t o d o l ó g i c o f u e d e c arácter mixto, es decir, cuantitativo y cualitativo. Los resultados del Diagnóstico de Situ ación y Relaciones de Género fueron dados a conocer públicamente el 22 de di ciembre de 2020 y se encuentran disponibles desde esa fecha en el sitio web de la Universidad. 14. Que, la etapa de elaboración se desarrolló mediante una propuesta llevada a cabo por el equipo profesional de la Dirección de Equidad de Género en atención a los resultados otorgados en la etapa de diagnóstico. Tal propuesta fue presentada a una Comisión Técnica Asesora, coordinada por la Directora de Equidad de Género, y en la cual participaron la Dra. Antonia Santos Pérez, Presidenta de la Comisión de Igualdad de Género del CRUCH; Mg. Natalia Caniguan Velarde, Directora del Instituto de Estudios Indígenas e Intercultural es y la abogada Ruth Aedo San Martin, abogada de la Dirección Jurídica de la Universid ad. Dicha comisión entr egó orientaciones para desarrollar el proceso deliberativo de la Política de Igualdad y Equidad de Género de la Universidad. 15. Asimismo, la Dirección de Equidad de Género convocó a estructuras y organizaci ones de los estamentos de la comunidad universitaria, de distintas Facultades, Campus e Institutos y Organizaciones reconocidas por la Universidad para conformar la Comisión Delibe rativa Triestamental, sumándose a este trabajo deliberativo, el Consejo Asesor de la Dirección de Equidad de Género. 16. La Comisión fue constituida con fecha 30 de marzo del 2021 en sesión pública, virtual y abierta. Luego de ell o, las 36 personas participantes de la Comisión se organizaron en siete subcomisiones: Institucionalización de la perspectiva de género en la gestión univ ersitaria; Participació n, liderazgo y gobierno universitario con perspectiva de género; Condiciones laboral es y académicas con perspectiva de género; Universidad libre de discriminaci ones y violencias de género; Gé nero, pueblos originarios e interculturalidad; Transversalidad de gén ero en procesos de form ación, docencia e investigación; Corresponsabilidad y conciliación de la vida pe rsonal, familiar, académica y laboral.', 'Tramitada la Resolución que pone término al procedimiento disciplinario, se procederá a notiﬁcar a las partes intervinientes y a todas las unidades involucradas, de la forma siguiente: 01. En el caso de los Sumarios Administrativos. La resolución que dispone el sobreseimiento, absolución o sanción en un sumario administrativo originado en actos atentatorios a la dignidad de cualquier integrante de la Comunidad Universitaria será notiﬁcada conforme al artículo 46 de la Ley N°19.880 que establece bases de los procedimientos administrativos que rigen los actos de los órganos de la administración del Estado y a la persona denunciada por las eventuales infracciones en la forma prevista en el Estatuto Administrativo. En dicha resolución deberá explicitar el derecho de la persona afectada y denunciada a interponer recursos administrativos en contra de esta, además de la autoridad ante la cual deba presentarse. 02. En el caso de las investigaciones por infracción al Reglamento de Convivencia Universitaria Estudiantil. En el caso de investigaciónes sometidas al Reglamento de Convivencia, la o el Fiscal notiﬁcará primeramente a la denunciante de su decisión de sobreseer o de formular cargos, y solo una vez que haya vencido el plazo cinco días que tendrá para recurrir al Tribunal de Convivencia, notiﬁcará al inculpado. Si la víctima ha presentado reclamo, lo que se podrá en conocimiento de la persona denunciada, este último no podrá hacer uso de la facultad prevista en el artículo 26 del Reglamento de Convivencia. En el evento que la víctima o las personas afectadas por las eventuales infracciones al Reglamento de Convivencia reclamaran de la formulación de cargos, el ﬁscal deberá proceder en la forma señalada en el artículo 27 del Reglamento de Convivencia. Los mismos derechos que se le reconocen a la persona denunciada ante el Tribunal de Convivencia se le reconocerán a la víctima o las personas afectadas por las eventuales infracciones al Reglamento de Convivencia. /gid00049/gid00162/gid00070/gid00072/gid00077/gid00064 /gid00020/gid00020 /gid00014 /gid00034/gid00051/gid00053/gid00144/gid00036/gid00054/gid00045/gid00048/gid00001/gid00019/gid00020/gid00027/gid00001/gid00047/gid00078/gid00083/gid00072/gid00195/gid00066/gid00064/gid00066/gid00072/gid00178/gid00077/gid00001/gid00067/gid00068/gid00001/gid00083/gid00169/gid00081/gid00076/gid00072/gid00077/gid00078/gid00001/gid00067/gid00068/gid00075/gid00001 /gid00079/gid00081/gid00078/gid00066/gid00068/gid00067/gid00072/gid00076/gid00072/gid00068/gid00077/gid00083/gid00078/gid00015/gid00001 /gid00051/gid00068/gid00070/gid00075/gid00064/gid00076/gid00068/gid00077/gid00083/gid00078/gid00001/gid00067/gid00068 /gid00036/gid00078/gid00077/gid00085/gid00072/gid00085/gid00068/gid00077/gid00066/gid00072/gid00064/gid00001/gid00054/gid00077/gid00072/gid00085/gid00068/gid00081/gid00082/gid00072/gid00083/gid00064/gid00081/gid00072/gid00064', '2 Superior, proponer las políticas para la educación superior y coordinar a los órganos del Estado que componen el Sistema”, debiendo para tales efectos, que las Universidades cuenten con directrices que permitan la elaboración e implementación de políticas propias de su quehacer universitario. 5. Que, por Resolución Exenta N°4013 de fecha 14 de diciembre de 2023, se aprobó el Protocolo de Gestión de Políticas Institucionales de la Universidad de La Frontera, el cual tuvo por obje to regular el ciclo de vida de las políticas institucionales mediante un instrumento que otorgue procesos homogéneos en concordancia con la normativa nacional en Educación Superior. 6. Que, en cuanto a los antecedentes que motivan esta Política: En este con texto normativo para las Instituciones de Educación Superior, en el cual existen nuevas exigencias en materias financieras, aumento de sistemas de control, así como los nuevos criterios de acreditación institucional, surge la necesidad de contar con una Po lítica Financiera para la Universidad de La Frontera. Lo anterior, argumentado en los procedimientos y requerimientos para generar las autorizaciones para los procesos de tramitación de endeudamientos, sean estos de corto, mediano o largo plazo. Por otra p arte, la necesidad de contar con procesos de control más rigurosos, de manera de dar cumplimiento a las exigencias del nuevo marco legal y normativo, como lo es la Ley de delitos económicos, lavado de activos y de financiamiento del terrorismo. En el mismo sentido, la necesidad de contar con procedimientos actualizados y pertinentes a la realidad actual Universitaria y de financiamiento del sistema de educación superior, motivo por el cual se requiere contar con un reglamento conocido y transparente sobre la elaboración, ejecución y control del presupuesto universitario que, de cuenta de las necesidades de financiamiento de todo el quehacer universitario, y que vele por la sostenibilidad presente y futura. En función de este mandato, además de la propia naturaleza de las políticas institucionales, como reflejo de la cultura y valores de la Institución, es relevante considerar la participación como un eje transversal al ciclo de vida de las políticas institucionales. En función de la creación de nuevos en tes fiscalizadores como lo es la Superintendencia de Educación Superior y las actuales atribuciones tanto de la Subsecretaría de Educación Superior como de la Contraloría General de la República en relación a las instituciones de educación superior, se norma la rendición de cuentas de la gestión financiera de este tipo de instituciones. Además, se suma la definición de nuevos criterios y estándares para la acreditación institucional por parte de la CNA, que incorpora la dimensión Gestión Estratégica y Recur sos Institucionales con fines de asegurar la sostenibilidad del proyecto. 7. Que, en cuanto al proceso general de elaboración de la Política y en conformidad a las directrices institucionales, este proceso se ordenó en tres etapas fundamentales: diagnóstico, elaboración y validación: a) Etapa de Diagnóstico La construcción de esta política fue iniciada por la Vicerrectoría de Administración y Finanzas mediante ordinario N°198/3010 de fecha 16 de noviembre de 2023, en que se solicitó formalizar la Comisión pa ra la Elaboración de la Política Financiera de la Universidad de La Frontera (en adelante también “la Comisión”) y de la Secretaría Técnica a tal efecto. Esta Comisión estuvo compuesta por representantes de diversos estamentos universitarios, unidades rela cionadas al área financiera, Dirección Jurídica, facultades, y las asociaciones gremiales académica y administrativa. En consecuencia, por Resolución Exenta N°3866 de fecha 04 de diciembre de 2023 se designaron sus integrantes, lo que fue complementado por Resolución Exenta N°4066 de fecha 19 de diciembre de 2023. La Comisión para la Elaboración de la Política Financiera comenzó a sesionar con fecha 27 de noviembre de 2023.']","El número de la Resolución Exenta que aprueba la Política de Igualdad y Equidad de Género es N°1400, y la fecha es el 12 de agosto de 2021.",La Resolución Exenta es la N° 2340/2022 con fecha 14 de septiembre de 2022.,0.0,,0.9999999999,0.0
¿Qué ley de Universidades Estatales reconoce la equidad de género como principio de las instituciones?,"['Que, en su condición de Universidad Pública, socialmente responsable e inspirada en el pleno respeto de los derechos y garantías fundamentales de las personas, la Universidad de La Frontera debe avanzar en su obligación intrínseca de contar con un reglamento que le permita, en forma eﬁcaz y oportuna, prevenir, actuar, abordar e, investigar aquellas conductas atentatorias de la condición de persona, cualquiera sea su sexo, identidad de género, orientación sexo afectiva, expresión de género, condición funcionaria, académica o estudiantil, nacionalidad u otra. Que, en este contexto, el presente reglamento se inspira entre otros principios en los de libertad, igualdad, no discriminación, igualdad y equidad de género, juridicidad, respeto, tolerancia y, en los distintos cuerpos legislativos que, tanto a nivel internacional, como en el derecho interno, y en las propias normas universitarias o que a ella hagan referencia, se han preocupado de poner de relieve estos derechos y principios. Que, el presente reglamento de investigación aborda situaciones que tienen que ver con Violencia de Género, Acoso Sexual, Maltrato y Acoso Laboral, Académico y Estudiantil, Discriminación Arbitraria y discriminación de género, viene en otorgar una mejora en los procedimientos de denuncia, toda vez que reconoce procedimientos de tramitación, tanto para casos de violencia y discriminación en materia de género y materia laboral, académica y estudiantil. Que, es necesaria la aprobación del presente reglamento con miras a la construcción de espacios universitarios seguros, respetuosos, libres de discriminación y violencia de género, acoso y maltrato en la Universidad, velando por las buenas prácticas y los principios de Protección a las Garantías Constitucionales, la equidad de género, debido proceso, legalidad, presunción de inocencia, congruencia, proporcionalidad, todos pilares en que se funda un Estado de Derecho. /gid00017/gid00018/gid00015 /gid00017/gid00019/gid00015 /gid00017/gid00020/gid00015 /gid00017/gid00021/gid00015 /gid00036/gid00078/gid00077/gid00082/gid00072/gid00067/gid00068/gid00081/gid00064/gid00077/gid00067/gid00078/gid00027 /gid00014/gid00049/gid00162/gid00070/gid00072/gid00077/gid00064 /gid00017/gid00019 /gid00051/gid00068/gid00070/gid00075/gid00064/gid00076/gid00068/gid00077/gid00083/gid00078/gid00001/gid00067/gid00068 /gid00036/gid00078/gid00077/gid00085/gid00072/gid00085/gid00068/gid00077/gid00066/gid00072/gid00064/gid00001/gid00054/gid00077/gid00072/gid00085/gid00068/gid00081/gid00082/gid00072/gid00083/gid00064/gid00081/gid00072/gid00064', '\x1b Asimismo, se desarrollarán estrategias de apoyo para la inserción laboral y vinculación con la Universidad, para estudiantes que hayan fi nalizado sus programas de estudio, todos ellos con perspectiva de género. 4.- PARTICIPACIÓN, LIDERAZGO Y GOB IERNO UNIVERSITARIO CON PERSPECTIVA DE GÉNERO La Universidad reconoce la participación y liderazgo de las personas que integran la comunidad universitaria, fomentando la partici pación equilibrada, pari taria, informada, transparente, protegida y en igualdad de condiciones, en todos l os cargos de autoridad, representación oficial y de cuerpos colegiados, equipos, comisiones y comités de trabajo, entre otros, sin discriminación por identidad de género, expresión de género y/o orientación sexoafectiva. Se promoverá el ejercicio real y democrático de la p articipación triestam ental, cuando corresponda, con perspectiva de género, protegi endo la autonomía y libertad de expresión, sin generar ello riesgo o desmedro de la situación laboral funcionaria o estudiantil. En concordancia con lo anterior, se garantizará el respeto y prote cción de los tiempos establecidos institucionalmente para las actividad es universitarias, teniendo en cuenta las condiciones personales, de salud y familiares. Co nsiderando, a su vez, las circunstancias o situaciones particulares asociadas al cicl ov i t a ld el a sp e r s o n a s ,l a s c u a l e sd e b e ns e r conciliadas con las actividades de participación en instancias de tomade decisiones. La participación en instancias relativas a procesos institucionales será valorada en la trayectoria o carrera laboral y estudiantil, po r medio de reconocimientos simbólicos, económicos y materiales, cuando corresponda. 5.- GÉNERO, PUEBLOS ORIGINARIOS E INTERCULTURALIDAD La Universidad reconoce que el respeto y legitimación de las formas culturales y manifestaciones de ser mujer, hombre y otras identidades de género, implica transversalizar una perspectiva intercultural de género en la cultura organizacional, tanto en sus estructuras como estamentos. Para estos efectos, se promoverá una perspectiva intercultural de género en los procesos formativos, que permita el fortalecimiento de saberes, conocimientos y prácticas culturales. Estos procesos fomentarán el diálogo respetuoso con liderazgos, representantes y autoridades tradicionales del Pueblo Mapuche y de otros pueblos originarios y culturas. Se promoverá, a su vez, la investigación de carácter intercultural sobre gé nero, reconociendo y respetando las culturas originarias, cuando l as personas, conocimientos y saberes sean destinatarios de estos procesos. La Universidad generará instancias de sensibilización, inducción ,c a p a c i t a c i ó ny f o r m a c i ó n que permitan visibilizar y erradicar las desig ualdades y discriminaciones interseccionales que viven y han vivido las mujeres mapuche, personas de otras identidades culturales de género y nacionalidades, desarrollando competencias interculturales de género. Asimismo, se promoverá y fortalecerá la repre sentatividad con perspectiva intercultural de género en los espacios de participación y lideraz go político, social y cultural, entre otros, dentro de la comunidad universitaria, en todos los ni veles, incluyendo ámbitos de mayor jerarquía de decisión institucional. Se incorporarán instancias tri estamentales de diálogo intercultural permanentes sobre temáticas de género que aborden la diversidad de perspectivas y experiencias estudiantiles, administrativas y académica s al interior de la Universidad, con el fin de difundir los conocimientos, saberes y prácticas cultural es, enfatizando aquellas llevadas a cabo por mujeres mapuche y de otros pueblos origi narios, nacionalidades y culturas.', 'El presente reglamento regula la forma de procurar prevenir, enfrentar, investigar, sancionar, reparar y erradicar, aquellas conductas que atentan a la dignidad de los integrantes de la Comunidad Universitaria, particularmente aquellas relacionadas con violencia de género, acoso sexual, discriminación arbitraria y maltrato y acoso laboral, académico y estudiantil, en tanto vulneren la dignidad y garantías fundamentales de los/as funcionarios/as, académicos/as, independiente de su condición contractual, estudiantes regulares de la Universidad y de toda persona vinculada, de cualquier forma, a las actividades universitarias. La potestad para investigar y sancionar se extenderá a los hechos o situaciones que se enmarquen en actividades organizadas o desarrolladas por la Universidad o por personas vinculadas a ellas en los términos señalados en el inciso tercero del artículo 2 de la ley 21.369 y artículo 49 de la Ley N°21.094 ocurran o no en espacios académicos o de investigación, especialmente si tales hechos o situaciones afectan el buen desenvolvimiento de los ﬁnes y propósitos de la Universidad. Todas las funcionarias y funcionarios de la Universidad de La Frontera, sus estudiantes y demás miembros de la Comunidad Universitaria, estarán obligados a respetar la presente normativa, como toda otra que se acuerde en materia de acoso sexual, violencia y discriminación de género, discriminación arbitraria y maltrato y acoso laboral, académico y estudiantil, entendiendo que la misma es parte del estatuto o normativa que rige su actuar. Las conductas descritas en este reglamento serán vinculantes para todos los integrantes de la comunidad universitaria, independiente del medio por el cual éstas sean realizadas. /gid00053/gid00042/gid00053/gid00054/gid00045/gid00048/gid00001/gid00042/gid00015 /gid00037/gid00042/gid00052/gid00049/gid00048/gid00052/gid00042/gid00036/gid00042/gid00048/gid00047/gid00038/gid00052 /gid00040/gid00038/gid00047/gid00038/gid00051/gid00034/gid00045/gid00038/gid00052 /gid00049/gid00133/gid00051/gid00051/gid00034/gid00039/gid00048/gid00001/gid00018/gid00128 /gid00037/gid00038/gid00045/gid00001/gid00133/gid00046/gid00035/gid00042/gid00053/gid00048 /gid00037/gid00038/gid00001/gid00034/gid00049/gid00045/gid00042/gid00036/gid00034/gid00036/gid00042/gid00149/gid00047 /gid00034/gid00051/gid00053/gid00144/gid00036/gid00054/gid00045/gid00048/gid00001/gid00018/gid00027/gid00001/gid00048/gid00065/gid00073/gid00068/gid00083/gid00078/gid00001/gid00015 /gid00034/gid00051/gid00053/gid00144/gid00036/gid00054/gid00045/gid00048/gid00001/gid00019/gid00027/gid00001/gid00034/gid00075/gid00066/gid00064/gid00077/gid00066/gid00068/gid00015/gid00001 /gid00049/gid00162/gid00070/gid00072/gid00077/gid00064 /gid00017/gid00022 /gid00014 /gid00051/gid00068/gid00070/gid00075/gid00064/gid00076/gid00068/gid00077/gid00083/gid00078/gid00001/gid00067/gid00068 /gid00036/gid00078/gid00077/gid00085/gid00072/gid00085/gid00068/gid00077/gid00066/gid00072/gid00064/gid00001/gid00054/gid00077/gid00072/gid00085/gid00068/gid00081/gid00082/gid00072/gid00083/gid00064/gid00081/gid00072/gid00064', '6.- UNIVERSIDAD LIBRE DE DISCR IMINACIONES Y VIOLENCIAS DE GÉNERO La Universidad comprende que la prevención y la erradicación de las diferentes formas de violencia de género, dentro de las cuales se c omprenden el acoso sexual, la violencia y la discriminación de género, son fundamentales para el desarrollo pleno y sana convivencia de todas las personas y comunidades. Es por ello que, entendiendo el valor qu e tienen los procesos form ativos y educativos, se desarrollarán instancias y estrategias permanentes que permitan prevenir, abordar y erradicar las diferentes formas de discriminación y violencia de género, entregando además las condiciones que permitan a la co munidad universitaria participar de instancias que promuevan el buen trato, la valoración y reconocimiento de las diversidades culturales y de género. La prevención, acogida, acompañamiento, reeducación, actuación y sanción serán abor dadas desde modelos y protocolos construidos y evaluados participativa y triestamentalmente. Se promoverán estrategias para el bienestar y p r o t e c c i ó n d e l a s p e r s o n a s y c o m u n i d a d e s universitarias que hayan vivenciado situacion es de discriminación y/o violencias de g énero, a través de un modelo de reparación. Se desarrollarán ambientes físicos seguros y protectores, con el fin de erradicar los prejuicios, discriminaciones, agresiones y violencias de género, en todos los espacios de encuentro y convivencia universitaria. Se promoverá el reconocimiento y visibilización de las desi gualdades, disc riminaciones, desventajas y exclusiones que se configuran a part ir de la superposición de diferentes factores sociales, como el género, la cultura, clase social, entre otros, que afecta el crecimiento y desarrollo de las personas, favoreciendo la pa rticipación y empoderamiento en la comunidad universitaria de todas las personas, sin ningún tipo de discriminación. Atendido lo mandatado en el artículo 3 de la ley 21.369, se determina que el modelo de prevención y el modelo de sanción de las cond uctas contra el acoso sexual, la violencia y la discriminación de género, se contendrán en actos administrativos que aborden dicha temática en el contexto de la normativa que al efecto determine la Universidad. Esta normativa contendrá acciones de prevención , información, sensibi lización, sanción, capacitación y formación relacionadas con la vi olencia y la discrimin ación de género, y mecanismos de monitoreo y evaluación de su impacto. Asimismo, deberá contar con una estrategia de comunicación que garantice que las políticas, planes, protocolos y reglamentos sean conocidos en el interior de las instituciones de educación superior. TÍTULO V. DE LA IMPLEMENTACIÓN, SEGUIMIENTO Y EVALUACIÓN PERMANENTE DE LA POLÍTICA DE IGUALDAD Y EQUID AD DE GÉNERO Y DE SUS ACTORES. Una vez aprobada la Política de Igualdad y Equidad de Género, ésta se materializará en un PLAN DE IGUALDAD Y EQUIDAD DE GÉNERO , el cual se construirá teniendo como base los principios y lineamien tos contenidos en esta Política. Este instrumento establecerá responsables, plazos y recursos para su implem entación e impacto en los ámbitos de gestión institucional, docencia de pregrado y postgrado, investigación y vinculación con el medio. Asimismo, las diferentes unidades de la Universidad implementarán su s Planes de Acción en concordancia con la Política y el Plan de Igualdad y Equidad de Género. En todos estos procesos, EL ROL DE LOS/AS DIRECTIVOS/AS, JEFATURAS Y PERSONAS RESPONSABLES DE EQUIPOS en la Universidad, será velar por el cumplimiento de las diferentes etapas señaladas en esta Política y en su Plan, impulsando el compromiso de las personas que conforman la comunidad universitaria para alcanzar los objetivos y metas de la institución y sostenerlas en el tiempo. TÍTULO VI. UNIDAD RESPONSABLE. LA DIRECCIÓN DE EQUIDAD DE GÉNERO coordinará el diseño y pu esta en marcha del Plan de Igualdad y Equidad de Género.']",La ley que reconoce la equidad de género como principio de las instituciones de educación superior en Chile es la Ley N°21.094.,La Ley N°21.094 sobre Universidades Estatales,0.0,,0.0,0.0
¿Cuál es el objeto de la Dirección de Equidad de Género (DEG) de la Universidad?,"['\x1b Asimismo, se desarrollarán estrategias de apoyo para la inserción laboral y vinculación con la Universidad, para estudiantes que hayan fi nalizado sus programas de estudio, todos ellos con perspectiva de género. 4.- PARTICIPACIÓN, LIDERAZGO Y GOB IERNO UNIVERSITARIO CON PERSPECTIVA DE GÉNERO La Universidad reconoce la participación y liderazgo de las personas que integran la comunidad universitaria, fomentando la partici pación equilibrada, pari taria, informada, transparente, protegida y en igualdad de condiciones, en todos l os cargos de autoridad, representación oficial y de cuerpos colegiados, equipos, comisiones y comités de trabajo, entre otros, sin discriminación por identidad de género, expresión de género y/o orientación sexoafectiva. Se promoverá el ejercicio real y democrático de la p articipación triestam ental, cuando corresponda, con perspectiva de género, protegi endo la autonomía y libertad de expresión, sin generar ello riesgo o desmedro de la situación laboral funcionaria o estudiantil. En concordancia con lo anterior, se garantizará el respeto y prote cción de los tiempos establecidos institucionalmente para las actividad es universitarias, teniendo en cuenta las condiciones personales, de salud y familiares. Co nsiderando, a su vez, las circunstancias o situaciones particulares asociadas al cicl ov i t a ld el a sp e r s o n a s ,l a s c u a l e sd e b e ns e r conciliadas con las actividades de participación en instancias de tomade decisiones. La participación en instancias relativas a procesos institucionales será valorada en la trayectoria o carrera laboral y estudiantil, po r medio de reconocimientos simbólicos, económicos y materiales, cuando corresponda. 5.- GÉNERO, PUEBLOS ORIGINARIOS E INTERCULTURALIDAD La Universidad reconoce que el respeto y legitimación de las formas culturales y manifestaciones de ser mujer, hombre y otras identidades de género, implica transversalizar una perspectiva intercultural de género en la cultura organizacional, tanto en sus estructuras como estamentos. Para estos efectos, se promoverá una perspectiva intercultural de género en los procesos formativos, que permita el fortalecimiento de saberes, conocimientos y prácticas culturales. Estos procesos fomentarán el diálogo respetuoso con liderazgos, representantes y autoridades tradicionales del Pueblo Mapuche y de otros pueblos originarios y culturas. Se promoverá, a su vez, la investigación de carácter intercultural sobre gé nero, reconociendo y respetando las culturas originarias, cuando l as personas, conocimientos y saberes sean destinatarios de estos procesos. La Universidad generará instancias de sensibilización, inducción ,c a p a c i t a c i ó ny f o r m a c i ó n que permitan visibilizar y erradicar las desig ualdades y discriminaciones interseccionales que viven y han vivido las mujeres mapuche, personas de otras identidades culturales de género y nacionalidades, desarrollando competencias interculturales de género. Asimismo, se promoverá y fortalecerá la repre sentatividad con perspectiva intercultural de género en los espacios de participación y lideraz go político, social y cultural, entre otros, dentro de la comunidad universitaria, en todos los ni veles, incluyendo ámbitos de mayor jerarquía de decisión institucional. Se incorporarán instancias tri estamentales de diálogo intercultural permanentes sobre temáticas de género que aborden la diversidad de perspectivas y experiencias estudiantiles, administrativas y académica s al interior de la Universidad, con el fin de difundir los conocimientos, saberes y prácticas cultural es, enfatizando aquellas llevadas a cabo por mujeres mapuche y de otros pueblos origi narios, nacionalidades y culturas.', 'Que, en su condición de Universidad Pública, socialmente responsable e inspirada en el pleno respeto de los derechos y garantías fundamentales de las personas, la Universidad de La Frontera debe avanzar en su obligación intrínseca de contar con un reglamento que le permita, en forma eﬁcaz y oportuna, prevenir, actuar, abordar e, investigar aquellas conductas atentatorias de la condición de persona, cualquiera sea su sexo, identidad de género, orientación sexo afectiva, expresión de género, condición funcionaria, académica o estudiantil, nacionalidad u otra. Que, en este contexto, el presente reglamento se inspira entre otros principios en los de libertad, igualdad, no discriminación, igualdad y equidad de género, juridicidad, respeto, tolerancia y, en los distintos cuerpos legislativos que, tanto a nivel internacional, como en el derecho interno, y en las propias normas universitarias o que a ella hagan referencia, se han preocupado de poner de relieve estos derechos y principios. Que, el presente reglamento de investigación aborda situaciones que tienen que ver con Violencia de Género, Acoso Sexual, Maltrato y Acoso Laboral, Académico y Estudiantil, Discriminación Arbitraria y discriminación de género, viene en otorgar una mejora en los procedimientos de denuncia, toda vez que reconoce procedimientos de tramitación, tanto para casos de violencia y discriminación en materia de género y materia laboral, académica y estudiantil. Que, es necesaria la aprobación del presente reglamento con miras a la construcción de espacios universitarios seguros, respetuosos, libres de discriminación y violencia de género, acoso y maltrato en la Universidad, velando por las buenas prácticas y los principios de Protección a las Garantías Constitucionales, la equidad de género, debido proceso, legalidad, presunción de inocencia, congruencia, proporcionalidad, todos pilares en que se funda un Estado de Derecho. /gid00017/gid00018/gid00015 /gid00017/gid00019/gid00015 /gid00017/gid00020/gid00015 /gid00017/gid00021/gid00015 /gid00036/gid00078/gid00077/gid00082/gid00072/gid00067/gid00068/gid00081/gid00064/gid00077/gid00067/gid00078/gid00027 /gid00014/gid00049/gid00162/gid00070/gid00072/gid00077/gid00064 /gid00017/gid00019 /gid00051/gid00068/gid00070/gid00075/gid00064/gid00076/gid00068/gid00077/gid00083/gid00078/gid00001/gid00067/gid00068 /gid00036/gid00078/gid00077/gid00085/gid00072/gid00085/gid00068/gid00077/gid00066/gid00072/gid00064/gid00001/gid00054/gid00077/gid00072/gid00085/gid00068/gid00081/gid00082/gid00072/gid00083/gid00064/gid00081/gid00072/gid00064', '/gid00049/gid00162/gid00070/gid00072/gid00077/gid00064 /gid00018/gid00022 /gid00014 14. Coordinación: durante el proceso de investigación existirá vinculación permanente con las diferentes unidades académicas y administrativas de la Universidad, con el ﬁn de orientar y acordar medidas que promuevan una adecuada convivencia universitaria cuando hayan existido situaciones asociadas a este reglamento. Así también, se fomentará la coordinación y colaboración con redes internas y externas a la Universidad, con el ﬁn de gestionar espacios de atención para aquellas personas que lo requieran. 15. Trato digno y equitativo: se otorgará un trato igualitario a todos los miembros de la comunidad universitaria. Se considerará como primordial en el análisis y abordaje de las situaciones relacionadas con este reglamento, las condiciones estructurales de desigualdad que afectan especialmente a las mujeres y a personas con otras identidades de género, expresiones de género u orientaciones sexo afectivas, producto de los patrones sociales y culturales resultantes de los procesos de socialización de género. /gid00051/gid00068/gid00070/gid00075/gid00064/gid00076/gid00068/gid00077/gid00083/gid00078/gid00001/gid00067/gid00068 /gid00036/gid00078/gid00077/gid00085/gid00072/gid00085/gid00068/gid00077/gid00066/gid00072/gid00064/gid00001/gid00054/gid00077/gid00072/gid00085/gid00068/gid00081/gid00082/gid00072/gid00083/gid00064/gid00081/gid00072/gid00064', '/gid00017/gid00022/gid00015 /gid00017/gid00023/gid00015 /gid00017/gid00024/gid00015 Que, el “Diagnóstico de la Situación y Relaciones de Género en la Universidad de La Frontera” (2020) y el “Estudio de Riesgos de Acoso Sexual, violencia y discriminación de género al Interior de la UFRO” (2022) señalan que existen diversas formas de discriminación y violencia de género en la Universidad entre los tres estamentos. Ambos estudios se encuentran a disposición en el sitio web de la Dirección de Equidad de Género, deg.ufro.cl, sección documentos. Que, el artículo 3 la Ley N°21.369 que regula el acoso sexual, la violencia y la discriminación de género en el ámbito de la Educación Superior, dispone que las Instituciones de Educación Superior deberán contar con una política integral contra las materias que trata la ley, la cual deberá contener un modelo de prevención y un modelo de sanción de dichas conductas, el cual deberá ser construido mediante métodos participativos por los estamentos de dicha Institución. En este sentido, por Resolución Exenta N°2340 de 2022 se aprobó la Política de Igualdad y Equidad de Género de la Universidad de La Frontera y por Resolución Exenta N°2347 de 2022 se aprobó Modelo de Prevención contra el acoso sexual, la violencia la discriminación de género, sin perjuicio de ello y anterior a la exigencia de la Ley N°21.369, mediante Resolución Exenta N°1141 de 2019 se Aprobó Protocolo de actuación para enfrentar situaciones de acoso sexual, abuso sexual, maltrato, acoso laboral y discriminación arbitraria de la Universidad de La Frontera. Ahora bien, el artículo 6 de la ley precitada vino en deﬁnir mínimos legales que hacen necesario la modiﬁcación y complementación del protocolo de actuación universitario, en mérito de disponer de un modelo de investigación y sanción del acoso sexual, la violencia y la discriminación de género y de protección y reparación a las víctimas mediante los literales que indica la ley. Que, el presente Reglamento ha sido construido en base a los instrumentos aprobados previamente por las instancias universitarias correspondientes, a saber: el Protocolo de Buenas Prácticas Laborales y Gestión de Denuncias de Maltrato y Acoso Laboral y Sexual (Resolución Exenta N°3597 de 2017), el Protocolo de actuación para enfrentar situaciones de acoso sexual, maltrato, abuso laboral y discriminación arbitraria (Resolución Exenta N°1141 de 2019) y la Coordinación de Procedimientos Disciplinarios (Resolución Exenta N°0719 de 2021). /gid00049/gid00162/gid00070/gid00072/gid00077/gid00064 /gid00017/gid00020 /gid00014 /gid00051/gid00068/gid00070/gid00075/gid00064/gid00076/gid00068/gid00077/gid00083/gid00078/gid00001/gid00067/gid00068 /gid00036/gid00078/gid00077/gid00085/gid00072/gid00085/gid00068/gid00077/gid00066/gid00072/gid00064/gid00001/gid00054/gid00077/gid00072/gid00085/gid00068/gid00081/gid00082/gid00072/gid00083/gid00064/gid00081/gid00072/gid00064']","El contexto proporcionado no incluye información específica sobre el objeto de la Dirección de Equidad de Género (DEG) de la Universidad de La Frontera. Por lo tanto, no puedo responder a tu pregunta con la información disponible.",El objeto de la DEG es proponer y gestionar la aplicación,0.0,,0.0,0.0
